{
    "offers": [
        {
            "page": 2,
            "wakacjeplURL": "https://www.wakacje.pl/wczasy?str-2/",
            "hotel": "Happy Life Village",
            "location": "Egipt / Sharm el Sheikh / Dahab",
            "date": "08.01.2026- 16.01.2026",
            "formated_date": "2026-01-08",
            "price_per_person": "3236zł",
            "image_url": "https://i.wakacje.pl/no-index/hotel/happy-life-village-basen-1253909645-343-228.jpg",
            "offer_url": "https://www.wakacje.pl/oferty/egipt/sharm-el-sheikh/dahab/happy-life-village-880657.html?-od-2026-01-08,7-dni,all-inclusive&utm_source=travellead&utm_medium=cps&utm_campaign=1656-vacccation.com&a_aid=1656&chan=code5",
            "short_url": "https://is.gd/WpTCTO",
            "airport": "Katowice, Warszawa, Wrocław",
            "likes": 715,
            "star_rating": "trzygwiazdkowy"
        },
        {
            "page": 2,
            "wakacjeplURL": "https://www.wakacje.pl/wczasy?str-2/",
            "hotel": "Albatros Sea World Resort Marsa Alam",
            "location": "Egipt / Marsa El Alam / Al-Kusajr",
            "date": "13.01.2026- 20.01.2026",
            "formated_date": "2026-01-13",
            "price_per_person": "5261zł",
            "image_url": "https://i.wakacje.pl/no-index/hotel/happy-life-village-teren-hotelu-1253909875-343-228.jpg",
            "offer_url": "https://www.wakacje.pl/oferty/egipt/marsa-el-alam/al-kusajr/albatros-sea-world-resort-marsa-alam-795035.html?-od-2026-01-13,7-dni,all-inclusive&utm_source=travellead&utm_medium=cps&utm_campaign=1656-vacccation.com&a_aid=1656&chan=code5",
            "short_url": "https://is.gd/Yu0YkB",
            "airport": "Join UP",
            "likes": 883,
            "star_rating": "pięciogwiazdkowy"
        },
        {
            "page": 2,
            "wakacjeplURL": "https://www.wakacje.pl/wczasy?str-2/",
            "hotel": "Akassia Swiss Resort (ex. Calimera Club Akassia Swiss Resort)",
            "location": "Egipt / Marsa El Alam / Al-Kusajr",
            "date": "13.01.2026- 20.01.2026",
            "formated_date": "2026-01-13",
            "price_per_person": "4577zł",
            "image_url": "https://i.wakacje.pl/no-index/hotel/happy-life-village-basen-zjezdzalnia-825755741-343-228.jpg",
            "offer_url": "https://www.wakacje.pl/oferty/egipt/marsa-el-alam/al-kusajr/akassia-swiss-resort-ex-calimera-club-akassia-swiss-resort-254866.html?-od-2026-01-13,7-dni,all-inclusive&utm_source=travellead&utm_medium=cps&utm_campaign=1656-vacccation.com&a_aid=1656&chan=code5",
            "short_url": "https://is.gd/ODX1cr",
            "airport": "Katowice, Warszawa",
            "likes": 1325,
            "star_rating": "pięciogwiazdkowy"
        },
        {
            "page": 2,
            "wakacjeplURL": "https://www.wakacje.pl/wczasy?str-2/",
            "hotel": "Pickalbatros Vita Resort Portofino",
            "location": "Egipt / Marsa El Alam",
            "date": "13.01.2026- 20.01.2026",
            "formated_date": "2026-01-13",
            "price_per_person": "5045zł",
            "image_url": "https://i.wakacje.pl/no-index/hotel/happy-life-village-basen-1253909812-343-228.jpg",
            "offer_url": "https://www.wakacje.pl/oferty/egipt/marsa-el-alam/pickalbatros-vita-resort-portofino-788826.html?-od-2026-01-13,7-dni,all-inclusive&utm_source=travellead&utm_medium=cps&utm_campaign=1656-vacccation.com&a_aid=1656&chan=code5",
            "short_url": "https://is.gd/PnUdr5",
            "airport": "Anex Poland",
            "likes": 892,
            "star_rating": "czterogwiazdkowy"
        },
        {
            "page": 2,
            "wakacjeplURL": "https://www.wakacje.pl/wczasy?str-2/",
            "hotel": "Utopia Beach Club",
            "location": "Egipt / Marsa El Alam / Al-Kusajr",
            "date": "13.01.2026- 20.01.2026",
            "formated_date": "2026-01-13",
            "price_per_person": "3966zł",
            "image_url": "https://i.wakacje.pl/no-index/hotel/happy-life-village-zjezdzalnia-1506573222-343-228.jpg",
            "offer_url": "https://www.wakacje.pl/oferty/egipt/marsa-el-alam/al-kusajr/utopia-beach-club-660096.html?-od-2026-01-13,7-dni,all-inclusive&utm_source=travellead&utm_medium=cps&utm_campaign=1656-vacccation.com&a_aid=1656&chan=code5",
            "short_url": "https://is.gd/53B7Ao",
            "airport": "Katowice, Warszawa, Rzeszów",
            "likes": 2156,
            "star_rating": "czterogwiazdkowy"
        },
        {
            "page": 2,
            "wakacjeplURL": "https://www.wakacje.pl/wczasy?str-2/",
            "hotel": "Rose Rayhaan by Rotana",
            "location": "Emiraty Arabskie / Dubaj",
            "date": "02.09.2026- 09.09.2026",
            "formated_date": "2026-09-02",
            "price_per_person": "6342zł",
            "image_url": "https://i.wakacje.pl/no-index/hotel/happy-life-village-teren-hotelu-1253910608-343-228.jpg",
            "offer_url": "https://www.wakacje.pl/oferty/emiraty-arabskie/dubaj/dubaj/rose-rayhaan-by-rotana-1030232.html?-od-2026-09-02,7-dni,all-inclusive&utm_source=travellead&utm_medium=cps&utm_campaign=1656-vacccation.com&a_aid=1656&chan=code5",
            "short_url": "https://is.gd/NnZ717",
            "airport": "Coral Travel",
            "likes": 2053,
            "star_rating": "czterogwiazdkowy"
        },
        {
            "page": 2,
            "wakacjeplURL": "https://www.wakacje.pl/wczasy?str-2/",
            "hotel": "Red Sea Grand Resort (Hurghada)",
            "location": "Egipt / Hurghada",
            "date": "10.01.2026- 18.01.2026",
            "formated_date": "2026-01-10",
            "price_per_person": "3498zł",
            "image_url": "https://i.wakacje.pl/no-index/hotel/happy-life-village-teren-hotelu-1506573221-343-228.jpg",
            "offer_url": "https://www.wakacje.pl/oferty/egipt/hurghada/hurghada/red-sea-grand-resort-hurghada-480267.html?-od-2026-01-10,7-dni,all-inclusive&utm_source=travellead&utm_medium=cps&utm_campaign=1656-vacccation.com&a_aid=1656&chan=code5",
            "short_url": "https://is.gd/B37gB4",
            "airport": "Katowice, Warszawa, Rzeszów",
            "likes": 477,
            "star_rating": "czteroipółgwiazdkowy"
        },
        {
            "page": 2,
            "wakacjeplURL": "https://www.wakacje.pl/wczasy?str-2/",
            "hotel": "Amwaj Oyoun Resort & Casino (ex AA Amwaj Resort)",
            "location": "Egipt / Sharm el Sheikh",
            "date": "22.01.2026- 29.01.2026",
            "formated_date": "2026-01-22",
            "price_per_person": "3722zł",
            "image_url": "https://i.wakacje.pl/no-index/hotel/happy-life-village-pokoj-844304105-343-228.jpg",
            "offer_url": "https://www.wakacje.pl/oferty/egipt/sharm-el-sheikh/amwaj-oyoun-resort-casino-ex-aa-amwaj-resort-876959.html?-od-2026-01-22,7-dni,all-inclusive&utm_source=travellead&utm_medium=cps&utm_campaign=1656-vacccation.com&a_aid=1656&chan=code5",
            "short_url": "https://is.gd/6P3OpC",
            "airport": "Coral Travel",
            "likes": 654,
            "star_rating": "czterogwiazdkowy"
        },
        {
            "page": 2,
            "wakacjeplURL": "https://www.wakacje.pl/wczasy?str-2/",
            "hotel": "Three Corners Sea Beach",
            "location": "Egipt / Marsa El Alam",
            "date": "15.01.2026- 22.01.2026",
            "formated_date": "2026-01-15",
            "price_per_person": "5204zł",
            "image_url": "https://i.wakacje.pl/no-index/hotel/happy-life-village-pokoj-1253910039-343-228.jpg",
            "offer_url": "https://www.wakacje.pl/oferty/egipt/marsa-el-alam/three-corners-sea-beach-910366.html?-od-2026-01-15,7-dni,all-inclusive&utm_source=travellead&utm_medium=cps&utm_campaign=1656-vacccation.com&a_aid=1656&chan=code5",
            "short_url": "https://is.gd/hkOi7D",
            "airport": "Katowice, Warszawa, Rzeszów",
            "likes": 1902,
            "star_rating": "czterogwiazdkowy"
        },
        {
            "page": 2,
            "wakacjeplURL": "https://www.wakacje.pl/wczasy?str-2/",
            "hotel": "Fanar & Residences (Salalah)",
            "location": "Oman / Zufar / Salala",
            "date": "09.01.2026- 16.01.2026",
            "formated_date": "2026-01-09",
            "price_per_person": "13058zł",
            "image_url": "https://i.wakacje.pl/no-index/hotel/happy-life-village-pokoj-1253910300-343-228.jpg",
            "offer_url": "https://www.wakacje.pl/oferty/oman/zufar/salala/fanar-residences-salalah-441839.html?-od-2026-01-09,7-dni,all-inclusive&utm_source=travellead&utm_medium=cps&utm_campaign=1656-vacccation.com&a_aid=1656&chan=code5",
            "short_url": "https://is.gd/woNfXI",
            "airport": "Coral Travel",
            "likes": 561,
            "star_rating": "pięciogwiazdkowy"
        },
        {
            "page": 3,
            "wakacjeplURL": "https://www.wakacje.pl/wczasy?str-3/",
            "hotel": "Radisson Individuals Marina Port Ghalib (ex. Sunrise Marina Resort)",
            "location": "Egipt / Marsa El Alam / Port Ghalib",
            "date": "13.01.2026- 20.01.2026",
            "formated_date": "2026-01-13",
            "price_per_person": "4401zł",
            "image_url": "https://i.wakacje.pl/no-index/hotel/radisson-individuals-marina-port-ghalib-ex-sunrise-marina-resort-basen-obiekt-1435472392-343-228.jpg",
            "offer_url": "https://www.wakacje.pl/oferty/egipt/marsa-el-alam/port-ghalib/radisson-individuals-marina-port-ghalib-ex-sunrise-marina-resort-282238.html?-od-2026-01-13,7-dni,all-inclusive&utm_source=travellead&utm_medium=cps&utm_campaign=1656-vacccation.com&a_aid=1656&chan=code5",
            "short_url": "https://is.gd/OAiCoG",
            "airport": "Katowice, Warszawa, Rzeszów",
            "likes": 310,
            "star_rating": "pięciogwiazdkowy"
        },
        {
            "page": 3,
            "wakacjeplURL": "https://www.wakacje.pl/wczasy?str-3/",
            "hotel": "Rewaya Majestic Resort",
            "location": "Egipt / Hurghada",
            "date": "09.01.2026- 16.01.2026",
            "formated_date": "2026-01-09",
            "price_per_person": "4014zł",
            "image_url": "https://i.wakacje.pl/no-index/hotel/radisson-individuals-marina-port-ghalib-ex-sunrise-marina-resort-plaza-1489223719-343-228.jpg",
            "offer_url": "https://www.wakacje.pl/oferty/egipt/hurghada/hurghada/rewaya-majestic-resort-1010785.html?-od-2026-01-09,7-dni,all-inclusive&utm_source=travellead&utm_medium=cps&utm_campaign=1656-vacccation.com&a_aid=1656&chan=code5",
            "short_url": "https://is.gd/d51VXX",
            "airport": "Coral Travel",
            "likes": 1402,
            "star_rating": "pięciogwiazdkowy"
        },
        {
            "page": 3,
            "wakacjeplURL": "https://www.wakacje.pl/wczasy?str-3/",
            "hotel": "Blend Club Aqua Resort (ex. Golden Five Club)",
            "location": "Egipt / Hurghada",
            "date": "09.01.2026- 16.01.2026",
            "formated_date": "2026-01-09",
            "price_per_person": "3569zł",
            "image_url": "https://i.wakacje.pl/no-index/hotel/radisson-individuals-marina-port-ghalib-ex-sunrise-marina-resort-obiekt-1489223747-343-228.jpg",
            "offer_url": "https://www.wakacje.pl/oferty/egipt/hurghada/hurghada/blend-club-aqua-resort-ex-golden-five-club-757102.html?-od-2026-01-09,7-dni,all-inclusive&utm_source=travellead&utm_medium=cps&utm_campaign=1656-vacccation.com&a_aid=1656&chan=code5",
            "short_url": "https://is.gd/iRmdMM",
            "airport": "Katowice, Warszawa, Poznań",
            "likes": 1212,
            "star_rating": "czterogwiazdkowy"
        },
        {
            "page": 3,
            "wakacjeplURL": "https://www.wakacje.pl/wczasy?str-3/",
            "hotel": "Hilton Marsa Alam Nubian Resort",
            "location": "Egipt / Marsa El Alam",
            "date": "13.01.2026- 20.01.2026",
            "formated_date": "2026-01-13",
            "price_per_person": "5279zł",
            "image_url": "https://i.wakacje.pl/no-index/hotel/radisson-individuals-marina-port-ghalib-ex-sunrise-marina-resort-plaza-1489223614-343-228.jpg",
            "offer_url": "https://www.wakacje.pl/oferty/egipt/marsa-el-alam/hilton-marsa-alam-nubian-resort-259156.html?-od-2026-01-13,7-dni,all-inclusive&utm_source=travellead&utm_medium=cps&utm_campaign=1656-vacccation.com&a_aid=1656&chan=code5",
            "short_url": "https://is.gd/3Izmxe",
            "airport": "Anex Poland",
            "likes": 1556,
            "star_rating": "pięciogwiazdkowy"
        },
        {
            "page": 3,
            "wakacjeplURL": "https://www.wakacje.pl/wczasy?str-3/",
            "hotel": "Rewaya Inn Resort (ex. Hawaii Paradise Aqua Park Resort)",
            "location": "Egipt / Hurghada",
            "date": "09.01.2026- 16.01.2026",
            "formated_date": "2026-01-09",
            "price_per_person": "3344zł",
            "image_url": "https://i.wakacje.pl/no-index/hotel/radisson-individuals-marina-port-ghalib-ex-sunrise-marina-resort-basen-1435472456-343-228.jpg",
            "offer_url": "https://www.wakacje.pl/oferty/egipt/hurghada/hurghada/rewaya-inn-resort-ex-hawaii-paradise-aqua-park-resort-756996.html?-od-2026-01-09,7-dni,all-inclusive&utm_source=travellead&utm_medium=cps&utm_campaign=1656-vacccation.com&a_aid=1656&chan=code5",
            "short_url": "https://is.gd/TpOhK1",
            "airport": "Katowice, Warszawa, Poznań",
            "likes": 1624,
            "star_rating": "czterogwiazdkowy"
        },
        {
            "page": 3,
            "wakacjeplURL": "https://www.wakacje.pl/wczasy?str-3/",
            "hotel": "Jaz Aquamarine (ex. Iberotel Aquamarine)",
            "location": "Egipt / Hurghada",
            "date": "09.01.2026- 17.01.2026",
            "formated_date": "2026-01-09",
            "price_per_person": "5202zł",
            "image_url": "https://i.wakacje.pl/no-index/hotel/radisson-individuals-marina-port-ghalib-ex-sunrise-marina-resort-teren-hotelu-964610914-343-228.jpg",
            "offer_url": "https://www.wakacje.pl/oferty/egipt/hurghada/hurghada/jaz-aquamarine-ex-iberotel-aquamarine-910415.html?-od-2026-01-09,7-dni,all-inclusive&utm_source=travellead&utm_medium=cps&utm_campaign=1656-vacccation.com&a_aid=1656&chan=code5",
            "short_url": "https://is.gd/SzVUoT",
            "airport": "Anex Poland",
            "likes": 272,
            "star_rating": "pięciogwiazdkowy"
        },
        {
            "page": 3,
            "wakacjeplURL": "https://www.wakacje.pl/wczasy?str-3/",
            "hotel": "Jaz Aquamarine (ex. Iberotel Aquamarine)",
            "location": "Egipt / Hurghada",
            "date": "08.01.2026- 15.01.2026",
            "formated_date": "2026-01-08",
            "price_per_person": "5872zł",
            "image_url": "https://i.wakacje.pl/no-index/hotel/radisson-individuals-marina-port-ghalib-ex-sunrise-marina-resort-budynek-glowny-obiekt-1435472420-343-228.jpg",
            "offer_url": "https://www.wakacje.pl/oferty/egipt/hurghada/hurghada/jaz-aquamarine-ex-iberotel-aquamarine-12693.html?-od-2026-01-08,7-dni,all-inclusive&utm_source=travellead&utm_medium=cps&utm_campaign=1656-vacccation.com&a_aid=1656&chan=code5",
            "short_url": "https://is.gd/2EMpGV",
            "airport": "Katowice, Warszawa, Rzeszów",
            "likes": 1054,
            "star_rating": "pięciogwiazdkowy"
        },
        {
            "page": 3,
            "wakacjeplURL": "https://www.wakacje.pl/wczasy?str-3/",
            "hotel": "The Cove Rotana Resort",
            "location": "Emiraty Arabskie / Ras al-Khaimah",
            "date": "08.06.2026- 15.06.2026",
            "formated_date": "2026-06-08",
            "price_per_person": "7646zł",
            "image_url": "https://i.wakacje.pl/no-index/hotel/radisson-individuals-marina-port-ghalib-ex-sunrise-marina-resort-budynek-glowny-obiekt-1435472215-343-228.jpg",
            "offer_url": "https://www.wakacje.pl/oferty/emiraty-arabskie/ras-al-khaimah/ras-al-khaimah/the-cove-rotana-resort-1029269.html?-od-2026-06-08,7-dni,all-inclusive&utm_source=travellead&utm_medium=cps&utm_campaign=1656-vacccation.com&a_aid=1656&chan=code5",
            "short_url": "https://is.gd/AT16v8",
            "airport": "Coral Travel",
            "likes": 2035,
            "star_rating": "pięciogwiazdkowy"
        },
        {
            "page": 3,
            "wakacjeplURL": "https://www.wakacje.pl/wczasy?str-3/",
            "hotel": "Casa Blue Luxury Resort",
            "location": "Egipt / Marsa El Alam / Port Ghalib",
            "date": "10.01.2026- 18.01.2026",
            "formated_date": "2026-01-10",
            "price_per_person": "6356zł",
            "image_url": "https://i.wakacje.pl/no-index/hotel/radisson-individuals-marina-port-ghalib-ex-sunrise-marina-resort-basen-teren-hotelu-obiekt-1435472310-343-228.jpg",
            "offer_url": "https://www.wakacje.pl/oferty/egipt/marsa-el-alam/port-ghalib/casa-blue-luxury-resort-752736.html?-od-2026-01-10,7-dni,all-inclusive&utm_source=travellead&utm_medium=cps&utm_campaign=1656-vacccation.com&a_aid=1656&chan=code5",
            "short_url": "https://is.gd/okT9Rs",
            "airport": "Katowice, Warszawa, Poznań",
            "likes": 2434,
            "star_rating": "pięciogwiazdkowy"
        },
        {
            "page": 3,
            "wakacjeplURL": "https://www.wakacje.pl/wczasy?str-3/",
            "hotel": "Jaz Lamaya Resort (ex Iberotel)",
            "location": "Egipt / Marsa El Alam / Madinat Coraya",
            "date": "13.01.2026- 20.01.2026",
            "formated_date": "2026-01-13",
            "price_per_person": "6009zł",
            "image_url": "https://i.wakacje.pl/no-index/hotel/radisson-individuals-marina-port-ghalib-ex-sunrise-marina-resort-basen-teren-hotelu-964610902-343-228.jpg",
            "offer_url": "https://www.wakacje.pl/oferty/egipt/marsa-el-alam/madinat-coraya/jaz-lamaya-resort-ex-iberotel-351089.html?-od-2026-01-13,7-dni,all-inclusive&utm_source=travellead&utm_medium=cps&utm_campaign=1656-vacccation.com&a_aid=1656&chan=code5",
            "short_url": "https://is.gd/LmepQh",
            "airport": "Anex Poland",
            "likes": 116,
            "star_rating": "pięciogwiazdkowy"
        },
        {
            "page": 4,
            "wakacjeplURL": "https://www.wakacje.pl/wczasy?str-4/",
            "hotel": "Pickalbatros Sands Port Ghalib (ex. Red Sea Siva Sands)",
            "location": "Egipt / Marsa El Alam / Port Ghalib",
            "date": "13.01.2026- 20.01.2026",
            "formated_date": "2026-01-13",
            "price_per_person": "5221zł",
            "image_url": "https://i.wakacje.pl/no-index/hotel/pickalbatros-sands-port-ghalib-ex-red-sea-siva-sands-basen-1595081930-343-228.jpg",
            "offer_url": "https://www.wakacje.pl/oferty/egipt/marsa-el-alam/port-ghalib/pickalbatros-sands-port-ghalib-ex-red-sea-siva-sands-958505.html?-od-2026-01-13,7-dni,all-inclusive&utm_source=travellead&utm_medium=cps&utm_campaign=1656-vacccation.com&a_aid=1656&chan=code5",
            "short_url": "https://is.gd/EBW71I",
            "airport": "Katowice, Warszawa, Rzeszów",
            "likes": 1930,
            "star_rating": "pięciogwiazdkowy"
        },
        {
            "page": 4,
            "wakacjeplURL": "https://www.wakacje.pl/wczasy?str-4/",
            "hotel": "Laur Experience & Elegance",
            "location": "Turcja / Wybrzeże Egejskie / Didim",
            "date": "22.10.2026- 29.10.2026",
            "formated_date": "2026-10-22",
            "price_per_person": "5145zł",
            "image_url": "https://i.wakacje.pl/no-index/hotel/pickalbatros-sands-port-ghalib-ex-red-sea-siva-sands-teren-hotelu-1595100053-343-228.jpg",
            "offer_url": "https://www.wakacje.pl/oferty/turcja/wybrzeze-egejskie/didim/laur-experience-elegance-211281.html?-od-2026-10-22,7-dni,all-inclusive&utm_source=travellead&utm_medium=cps&utm_campaign=1656-vacccation.com&a_aid=1656&chan=code5",
            "short_url": "https://is.gd/PTlsge",
            "airport": "Coral Travel",
            "likes": 199,
            "star_rating": "pięciogwiazdkowy"
        },
        {
            "page": 4,
            "wakacjeplURL": "https://www.wakacje.pl/wczasy?str-4/",
            "hotel": "Ali Baba Palace",
            "location": "Egipt / Hurghada",
            "date": "09.01.2026- 16.01.2026",
            "formated_date": "2026-01-09",
            "price_per_person": "4590zł",
            "image_url": "https://i.wakacje.pl/no-index/hotel/pickalbatros-sands-port-ghalib-ex-red-sea-siva-sands-plaza-1595081917-343-228.jpg",
            "offer_url": "https://www.wakacje.pl/oferty/egipt/hurghada/hurghada/ali-baba-palace-757108.html?-od-2026-01-09,7-dni,all-inclusive&utm_source=travellead&utm_medium=cps&utm_campaign=1656-vacccation.com&a_aid=1656&chan=code5",
            "short_url": "https://is.gd/y3UWFU",
            "airport": "Rzeszów, Gdańsk, Wrocław",
            "likes": 565,
            "star_rating": "czterogwiazdkowy"
        },
        {
            "page": 4,
            "wakacjeplURL": "https://www.wakacje.pl/wczasy?str-4/",
            "hotel": "Pickalbatros Portofino Marsa Alam",
            "location": "Egipt / Marsa El Alam",
            "date": "10.01.2026- 18.01.2026",
            "formated_date": "2026-01-10",
            "price_per_person": "4858zł",
            "image_url": "https://i.wakacje.pl/no-index/hotel/pickalbatros-sands-port-ghalib-ex-red-sea-siva-sands-teren-hotelu-1595100054-343-228.jpg",
            "offer_url": "https://www.wakacje.pl/oferty/egipt/marsa-el-alam/pickalbatros-portofino-marsa-alam-776034.html?-od-2026-01-10,7-dni,all-inclusive&utm_source=travellead&utm_medium=cps&utm_campaign=1656-vacccation.com&a_aid=1656&chan=code5",
            "short_url": "https://is.gd/PhAyQd",
            "airport": "Coral Travel",
            "likes": 1306,
            "star_rating": "czterogwiazdkowy"
        },
        {
            "page": 4,
            "wakacjeplURL": "https://www.wakacje.pl/wczasy?str-4/",
            "hotel": "Rose Rayhaan by Rotana",
            "location": "Emiraty Arabskie / Dubaj",
            "date": "02.09.2026- 09.09.2026",
            "formated_date": "2026-09-02",
            "price_per_person": "6067zł",
            "image_url": "https://i.wakacje.pl/no-index/hotel/pickalbatros-sands-port-ghalib-ex-red-sea-siva-sands-pokoj-1595100122-343-228.jpg",
            "offer_url": "https://www.wakacje.pl/oferty/emiraty-arabskie/dubaj/dubaj/rose-rayhaan-by-rotana-801703.html?-od-2026-09-02,7-dni,all-inclusive&utm_source=travellead&utm_medium=cps&utm_campaign=1656-vacccation.com&a_aid=1656&chan=code5",
            "short_url": "https://is.gd/k0xBLM",
            "airport": "Katowice, Warszawa, Poznań",
            "likes": 2045,
            "star_rating": "czterogwiazdkowy"
        },
        {
            "page": 4,
            "wakacjeplURL": "https://www.wakacje.pl/wczasy?str-4/",
            "hotel": "Oasis Atlantico Belorizonte",
            "location": "Wyspy Zielonego Przylądka / Sal / Santa Maria",
            "date": "09.03.2026- 17.03.2026",
            "formated_date": "2026-03-09",
            "price_per_person": "8958zł",
            "image_url": "https://i.wakacje.pl/no-index/hotel/pickalbatros-sands-port-ghalib-ex-red-sea-siva-sands-obiekt-1595081943-343-228.jpg",
            "offer_url": "https://www.wakacje.pl/oferty/wyspy-zielonego-przyladka/sal/santa-maria/oasis-atlantico-belorizonte-441850.html?-od-2026-03-09,7-dni,all-inclusive&utm_source=travellead&utm_medium=cps&utm_campaign=1656-vacccation.com&a_aid=1656&chan=code5",
            "short_url": "https://is.gd/roDrEH",
            "airport": "Anex Poland",
            "likes": 2410,
            "star_rating": "czterogwiazdkowy"
        },
        {
            "page": 4,
            "wakacjeplURL": "https://www.wakacje.pl/wczasy?str-4/",
            "hotel": "Albatros Palace Port Ghalib (ex. Red Sea The Palace)",
            "location": "Egipt / Marsa El Alam / Port Ghalib",
            "date": "19.04.2026- 26.04.2026",
            "formated_date": "2026-04-19",
            "price_per_person": "7163zł",
            "image_url": "https://i.wakacje.pl/no-index/hotel/pickalbatros-sands-port-ghalib-ex-red-sea-siva-sands-obiekt-1595100056-343-228.jpg",
            "offer_url": "https://www.wakacje.pl/oferty/egipt/marsa-el-alam/port-ghalib/albatros-palace-port-ghalib-ex-red-sea-the-palace-708540.html?-od-2026-04-19,7-dni,all-inclusive&utm_source=travellead&utm_medium=cps&utm_campaign=1656-vacccation.com&a_aid=1656&chan=code5",
            "short_url": "https://is.gd/aRIHgs",
            "airport": "Warszawa, Gdańsk, Katowice",
            "likes": 1738,
            "star_rating": "pięciogwiazdkowy"
        },
        {
            "page": 4,
            "wakacjeplURL": "https://www.wakacje.pl/wczasy?str-4/",
            "hotel": "Rehana Royal Beach Resort & Spa",
            "location": "Egipt / Sharm el Sheikh",
            "date": "13.01.2026- 20.01.2026",
            "formated_date": "2026-01-13",
            "price_per_person": "4055zł",
            "image_url": "https://i.wakacje.pl/no-index/hotel/pickalbatros-sands-port-ghalib-ex-red-sea-siva-sands-obiekt-1595081945-343-228.jpg",
            "offer_url": "https://www.wakacje.pl/oferty/egipt/sharm-el-sheikh/rehana-royal-beach-resort-spa-779278.html?-od-2026-01-13,7-dni,all-inclusive&utm_source=travellead&utm_medium=cps&utm_campaign=1656-vacccation.com&a_aid=1656&chan=code5",
            "short_url": "https://is.gd/XRhf1k",
            "airport": "Itaka",
            "likes": 718,
            "star_rating": "pięciogwiazdkowy"
        },
        {
            "page": 4,
            "wakacjeplURL": "https://www.wakacje.pl/wczasy?str-4/",
            "hotel": "Doubletree By Hilton Resort & Spa Marjan Island",
            "location": "Emiraty Arabskie / Ras al-Khaimah / Marjan Island",
            "date": "01.06.2026- 08.06.2026",
            "formated_date": "2026-06-01",
            "price_per_person": "8406zł",
            "image_url": "https://i.wakacje.pl/no-index/hotel/pickalbatros-sands-port-ghalib-ex-red-sea-siva-sands-pokoj-1595100090-343-228.jpg",
            "offer_url": "https://www.wakacje.pl/oferty/emiraty-arabskie/ras-al-khaimah/marjan-island/doubletree-by-hilton-resort-spa-marjan-island-1040223.html?-od-2026-06-01,7-dni,all-inclusive&utm_source=travellead&utm_medium=cps&utm_campaign=1656-vacccation.com&a_aid=1656&chan=code5",
            "short_url": "https://is.gd/zai5pB",
            "airport": "Rzeszów, Gdańsk, Wrocław",
            "likes": 1625,
            "star_rating": "pięciogwiazdkowy"
        },
        {
            "page": 4,
            "wakacjeplURL": "https://www.wakacje.pl/wczasy?str-4/",
            "hotel": "Barcelo Mussanah Resort (ex Millenium Resort Mussanah)",
            "location": "Oman / Al Batina / Al Mudayq",
            "date": "14.01.2026- 21.01.2026",
            "formated_date": "2026-01-14",
            "price_per_person": "8058zł",
            "image_url": "https://i.wakacje.pl/no-index/hotel/pickalbatros-sands-port-ghalib-ex-red-sea-siva-sands-pokoj-1595100094-343-228.jpg",
            "offer_url": "https://www.wakacje.pl/oferty/oman/al-batina/al-mudayq/barcelo-mussanah-resort-ex-millenium-resort-mussanah-719355.html?-od-2026-01-14,7-dni,all-inclusive&utm_source=travellead&utm_medium=cps&utm_campaign=1656-vacccation.com&a_aid=1656&chan=code5",
            "short_url": "https://is.gd/OCTa1m",
            "airport": "Coral Travel",
            "likes": 1406,
            "star_rating": "czterogwiazdkowy"
        },
        {
            "page": 5,
            "wakacjeplURL": "https://www.wakacje.pl/wczasy?str-5/",
            "hotel": "Titanic Palace Resort",
            "location": "Egipt / Hurghada",
            "date": "08.01.2026- 15.01.2026",
            "formated_date": "2026-01-08",
            "price_per_person": "4514zł",
            "image_url": "https://i.wakacje.pl/no-index/hotel/titanic-palace-resort-basen-1764511626-343-228.jpg",
            "offer_url": "https://www.wakacje.pl/oferty/egipt/hurghada/hurghada/titanic-palace-resort-14032.html?-od-2026-01-08,7-dni,all-inclusive&utm_source=travellead&utm_medium=cps&utm_campaign=1656-vacccation.com&a_aid=1656&chan=code5",
            "short_url": "https://is.gd/NSsyqd",
            "airport": "Katowice, Warszawa, Gdańsk",
            "likes": 1850,
            "star_rating": "pięciogwiazdkowy"
        },
        {
            "page": 5,
            "wakacjeplURL": "https://www.wakacje.pl/wczasy?str-5/",
            "hotel": "Marina Lodge Port Ghalib",
            "location": "Egipt / Marsa El Alam / Port Ghalib",
            "date": "13.01.2026- 20.01.2026",
            "formated_date": "2026-01-13",
            "price_per_person": "4073zł",
            "image_url": "https://i.wakacje.pl/no-index/hotel/titanic-palace-resort-dla-dzieci-1467761714-343-228.jpg",
            "offer_url": "https://www.wakacje.pl/oferty/egipt/marsa-el-alam/port-ghalib/marina-lodge-port-ghalib-287260.html?-od-2026-01-13,7-dni,all-inclusive&utm_source=travellead&utm_medium=cps&utm_campaign=1656-vacccation.com&a_aid=1656&chan=code5",
            "short_url": "https://is.gd/Wyu5W6",
            "airport": "Coral Travel",
            "likes": 144,
            "star_rating": "czterogwiazdkowy"
        },
        {
            "page": 5,
            "wakacjeplURL": "https://www.wakacje.pl/wczasy?str-5/",
            "hotel": "Reef Oasis Suakin Resort",
            "location": "Egipt / Marsa El Alam",
            "date": "09.01.2026- 16.01.2026",
            "formated_date": "2026-01-09",
            "price_per_person": "5456zł",
            "image_url": "https://i.wakacje.pl/no-index/hotel/titanic-palace-resort-teren-hotelu-1764511611-343-228.jpg",
            "offer_url": "https://www.wakacje.pl/oferty/egipt/marsa-el-alam/reef-oasis-suakin-resort-810970.html?-od-2026-01-09,7-dni,all-inclusive&utm_source=travellead&utm_medium=cps&utm_campaign=1656-vacccation.com&a_aid=1656&chan=code5",
            "short_url": "https://is.gd/159o8O",
            "airport": "Katowice, Warszawa, Rzeszów",
            "likes": 192,
            "star_rating": "pięciogwiazdkowy"
        },
        {
            "page": 5,
            "wakacjeplURL": "https://www.wakacje.pl/wczasy?str-5/",
            "hotel": "Aladdin Beach Resort",
            "location": "Egipt / Hurghada",
            "date": "09.01.2026- 16.01.2026",
            "formated_date": "2026-01-09",
            "price_per_person": "4388zł",
            "image_url": "https://i.wakacje.pl/no-index/hotel/titanic-palace-resort-obiekt-1764511631-343-228.jpg",
            "offer_url": "https://www.wakacje.pl/oferty/egipt/hurghada/hurghada/aladdin-beach-resort-757106.html?-od-2026-01-09,7-dni,all-inclusive&utm_source=travellead&utm_medium=cps&utm_campaign=1656-vacccation.com&a_aid=1656&chan=code5",
            "short_url": "https://is.gd/D978su",
            "airport": "Coral Travel",
            "likes": 140,
            "star_rating": "czterogwiazdkowy"
        },
        {
            "page": 5,
            "wakacjeplURL": "https://www.wakacje.pl/wczasy?str-5/",
            "hotel": "Stella Gardens Resort & Spa (ex Stella Di Mare Gardens)",
            "location": "Egipt / Hurghada / Makadi Bay",
            "date": "09.01.2026- 17.01.2026",
            "formated_date": "2026-01-09",
            "price_per_person": "3966zł",
            "image_url": "https://i.wakacje.pl/no-index/hotel/titanic-palace-resort-basen-teren-hotelu-obiekt-1764511615-343-228.jpg",
            "offer_url": "https://www.wakacje.pl/oferty/egipt/hurghada/makadi-bay/stella-gardens-resort-spa-ex-stella-di-mare-gardens-910357.html?-od-2026-01-09,7-dni,all-inclusive&utm_source=travellead&utm_medium=cps&utm_campaign=1656-vacccation.com&a_aid=1656&chan=code5",
            "short_url": "https://is.gd/a30cuZ",
            "airport": "Warszawa, Gdańsk, Wrocław",
            "likes": 1628,
            "star_rating": "pięciogwiazdkowy"
        },
        {
            "page": 5,
            "wakacjeplURL": "https://www.wakacje.pl/wczasy?str-5/",
            "hotel": "Sbh Monica Zanzibar",
            "location": "Tanzania / Zanzibar",
            "date": "07.01.2026- 15.01.2026",
            "formated_date": "2026-01-07",
            "price_per_person": "12658zł",
            "image_url": "https://i.wakacje.pl/no-index/hotel/titanic-palace-resort-zjezdzalnia-aquapark-826304261-343-228.jpg",
            "offer_url": "https://www.wakacje.pl/oferty/tanzania/zanzibar/sbh-monica-zanzibar-790672.html?-od-2026-01-07,7-dni,all-inclusive&utm_source=travellead&utm_medium=cps&utm_campaign=1656-vacccation.com&a_aid=1656&chan=code5",
            "short_url": "https://is.gd/JYQVBS",
            "airport": "Itaka",
            "likes": 1069,
            "star_rating": "pięciogwiazdkowy"
        },
        {
            "page": 5,
            "wakacjeplURL": "https://www.wakacje.pl/wczasy?str-5/",
            "hotel": "Royal Brayka Beach Resort (ex Zee Brayka)",
            "location": "Egipt / Marsa El Alam",
            "date": "06.01.2026- 13.01.2026",
            "formated_date": "2026-01-06",
            "price_per_person": "4058zł",
            "image_url": "https://i.wakacje.pl/no-index/hotel/titanic-palace-resort-recepcja-lobby-826304269-343-228.jpg",
            "offer_url": "https://www.wakacje.pl/oferty/egipt/marsa-el-alam/royal-brayka-beach-resort-ex-zee-brayka-412313.html?-od-2026-01-06,7-dni,all-inclusive&utm_source=travellead&utm_medium=cps&utm_campaign=1656-vacccation.com&a_aid=1656&chan=code5",
            "short_url": "https://is.gd/CKuqVv",
            "airport": "Katowice, Warszawa, Poznań",
            "likes": 1032,
            "star_rating": "pięciogwiazdkowy"
        },
        {
            "page": 5,
            "wakacjeplURL": "https://www.wakacje.pl/wczasy?str-5/",
            "hotel": "Royal Horizon Ponta Sino",
            "location": "Wyspy Zielonego Przylądka / Sal / Santa Maria",
            "date": "02.03.2026- 10.03.2026",
            "formated_date": "2026-03-02",
            "price_per_person": "11198zł",
            "image_url": "https://i.wakacje.pl/no-index/hotel/titanic-palace-resort-recepcja-lobby-1764511630-343-228.jpg",
            "offer_url": "https://www.wakacje.pl/oferty/wyspy-zielonego-przyladka/sal/santa-maria/royal-horizon-ponta-sino-854712.html?-od-2026-03-02,7-dni,all-inclusive&utm_source=travellead&utm_medium=cps&utm_campaign=1656-vacccation.com&a_aid=1656&chan=code5",
            "short_url": "https://is.gd/9q5BCD",
            "airport": "Anex Poland",
            "likes": 1470,
            "star_rating": "pięciogwiazdkowy"
        },
        {
            "page": 5,
            "wakacjeplURL": "https://www.wakacje.pl/wczasy?str-5/",
            "hotel": "Calimera Blend Paradise",
            "location": "Egipt / Hurghada",
            "date": "11.01.2026- 19.01.2026",
            "formated_date": "2026-01-11",
            "price_per_person": "4658zł",
            "image_url": "https://i.wakacje.pl/no-index/hotel/titanic-palace-resort-pokoj-1764511610-343-228.jpg",
            "offer_url": "https://www.wakacje.pl/oferty/egipt/hurghada/hurghada/calimera-blend-paradise-733939.html?-od-2026-01-11,7-dni,all-inclusive&utm_source=travellead&utm_medium=cps&utm_campaign=1656-vacccation.com&a_aid=1656&chan=code5",
            "short_url": "https://is.gd/1sEeth",
            "airport": "Katowice, Warszawa, Wrocław",
            "likes": 1738,
            "star_rating": "pięciogwiazdkowy"
        },
        {
            "page": 5,
            "wakacjeplURL": "https://www.wakacje.pl/wczasy?str-5/",
            "hotel": "Hampton by Hilton Marjan Island",
            "location": "Emiraty Arabskie / Ras al-Khaimah",
            "date": "08.06.2026- 15.06.2026",
            "formated_date": "2026-06-08",
            "price_per_person": "5952zł",
            "image_url": "https://i.wakacje.pl/no-index/hotel/titanic-palace-resort-pokoj-1764511609-343-228.jpg",
            "offer_url": "https://www.wakacje.pl/oferty/emiraty-arabskie/ras-al-khaimah/ras-al-khaimah/hampton-by-hilton-marjan-island-1039710.html?-od-2026-06-08,7-dni,all-inclusive&utm_source=travellead&utm_medium=cps&utm_campaign=1656-vacccation.com&a_aid=1656&chan=code5",
            "short_url": "https://is.gd/liKXjo",
            "airport": "Join UP",
            "likes": 1517,
            "star_rating": "czterogwiazdkowy"
        },
        {
            "page": 6,
            "wakacjeplURL": "https://www.wakacje.pl/wczasy?str-6/",
            "hotel": "Rehana Sharm Resort",
            "location": "Egipt / Sharm el Sheikh",
            "date": "04.01.2026- 11.01.2026",
            "formated_date": "2026-01-04",
            "price_per_person": "3519zł",
            "image_url": "https://i.wakacje.pl/no-index/hotel/rehana-sharm-resort-basen-826528101-343-228.jpg",
            "offer_url": "https://www.wakacje.pl/oferty/egipt/sharm-el-sheikh/rehana-sharm-resort-779690.html?-od-2026-01-04,7-dni,all-inclusive&utm_source=travellead&utm_medium=cps&utm_campaign=1656-vacccation.com&a_aid=1656&chan=code5",
            "short_url": "https://is.gd/cKzcnO",
            "airport": "Katowice, Warszawa, Wrocław",
            "likes": 1030,
            "star_rating": "czterogwiazdkowy"
        },
        {
            "page": 6,
            "wakacjeplURL": "https://www.wakacje.pl/wczasy?str-6/",
            "hotel": "Casa Mare Resort (ex. Royal Tulip Beach Resort)",
            "location": "Egipt / Marsa El Alam / Port Ghalib",
            "date": "09.01.2026- 16.01.2026",
            "formated_date": "2026-01-09",
            "price_per_person": "4058zł",
            "image_url": "https://i.wakacje.pl/no-index/hotel/rehana-sharm-resort-zjezdzalnia-aquapark-826528102-343-228.jpg",
            "offer_url": "https://www.wakacje.pl/oferty/egipt/marsa-el-alam/port-ghalib/casa-mare-resort-ex-royal-tulip-beach-resort-412351.html?-od-2026-01-09,7-dni,all-inclusive&utm_source=travellead&utm_medium=cps&utm_campaign=1656-vacccation.com&a_aid=1656&chan=code5",
            "short_url": "https://is.gd/9Oka69",
            "airport": "Anex Poland",
            "likes": 831,
            "star_rating": "pięciogwiazdkowy"
        },
        {
            "page": 6,
            "wakacjeplURL": "https://www.wakacje.pl/wczasy?str-6/",
            "hotel": "Palm Beach Resort (Hurghada)",
            "location": "Egipt / Hurghada",
            "date": "26.02.2026- 05.03.2026",
            "formated_date": "2026-02-26",
            "price_per_person": "4865zł",
            "image_url": "https://i.wakacje.pl/no-index/hotel/rehana-sharm-resort-plac-zabaw-dla-dzieci-826528066-343-228.jpg",
            "offer_url": "https://www.wakacje.pl/oferty/egipt/hurghada/hurghada/palm-beach-resort-hurghada-784993.html?-od-2026-02-26,7-dni,all-inclusive&utm_source=travellead&utm_medium=cps&utm_campaign=1656-vacccation.com&a_aid=1656&chan=code5",
            "short_url": "https://is.gd/dSeNeP",
            "airport": "Warszawa, Gdańsk, Wrocław",
            "likes": 2197,
            "star_rating": "czterogwiazdkowy"
        },
        {
            "page": 6,
            "wakacjeplURL": "https://www.wakacje.pl/wczasy?str-6/",
            "hotel": "Delphin Imperial Lara",
            "location": "Turcja / Riwiera Turecka / Antalya",
            "date": "17.01.2026- 24.01.2026",
            "formated_date": "2026-01-17",
            "price_per_person": "6445zł",
            "image_url": "https://i.wakacje.pl/no-index/hotel/rehana-sharm-resort-basen-1468125916-343-228.jpg",
            "offer_url": "https://www.wakacje.pl/oferty/turcja/riwiera-turecka/antalya/delphin-imperial-lara-209938.html?-od-2026-01-17,7-dni,all-inclusive&utm_source=travellead&utm_medium=cps&utm_campaign=1656-vacccation.com&a_aid=1656&chan=code5",
            "short_url": "https://is.gd/PTjUhv",
            "airport": "Itaka",
            "likes": 1697,
            "star_rating": "pięciogwiazdkowy"
        },
        {
            "page": 6,
            "wakacjeplURL": "https://www.wakacje.pl/wczasy?str-6/",
            "hotel": "Bodrum Holiday Resort",
            "location": "Turcja / Wybrzeże Egejskie / Icmeler",
            "date": "22.10.2026- 29.10.2026",
            "formated_date": "2026-10-22",
            "price_per_person": "4519zł",
            "image_url": "https://i.wakacje.pl/no-index/hotel/rehana-sharm-resort-basen-1468125932-343-228.jpg",
            "offer_url": "https://www.wakacje.pl/oferty/turcja/wybrzeze-egejskie/icmeler/bodrum-holiday-resort-181453.html?-od-2026-10-22,7-dni,all-inclusive&utm_source=travellead&utm_medium=cps&utm_campaign=1656-vacccation.com&a_aid=1656&chan=code5",
            "short_url": "https://is.gd/AxSKPA",
            "airport": "Katowice, Warszawa, Poznań",
            "likes": 340,
            "star_rating": "pięciogwiazdkowy"
        },
        {
            "page": 6,
            "wakacjeplURL": "https://www.wakacje.pl/wczasy?str-6/",
            "hotel": "Mitsis Messonghi Beach",
            "location": "Grecja / Korfu / Moraitika",
            "date": "25.04.2026- 03.05.2026",
            "formated_date": "2026-04-25",
            "price_per_person": "4660zł",
            "image_url": "https://i.wakacje.pl/no-index/hotel/rehana-sharm-resort-rodzinny-826528058-343-228.jpg",
            "offer_url": "https://www.wakacje.pl/oferty/grecja/korfu/moraitika/mitsis-messonghi-beach-941044.html?-od-2026-04-25,7-dni,all-inclusive&utm_source=travellead&utm_medium=cps&utm_campaign=1656-vacccation.com&a_aid=1656&chan=code5",
            "short_url": "https://is.gd/Osmp3m",
            "airport": "Anex Poland",
            "likes": 233,
            "star_rating": "czterogwiazdkowy"
        },
        {
            "page": 6,
            "wakacjeplURL": "https://www.wakacje.pl/wczasy?str-6/",
            "hotel": "Sataya Resort (ex. Labranda Sataya Marsa Alam)",
            "location": "Egipt / Marsa El Alam / Port Ghalib",
            "date": "06.01.2026- 13.01.2026",
            "formated_date": "2026-01-06",
            "price_per_person": "4458zł",
            "image_url": "https://i.wakacje.pl/no-index/hotel/rehana-sharm-resort-pokoj-826528100-343-228.jpg",
            "offer_url": "https://www.wakacje.pl/oferty/egipt/marsa-el-alam/port-ghalib/sataya-resort-ex-labranda-sataya-marsa-alam-665425.html?-od-2026-01-06,7-dni,all-inclusive&utm_source=travellead&utm_medium=cps&utm_campaign=1656-vacccation.com&a_aid=1656&chan=code5",
            "short_url": "https://is.gd/Zm4evZ",
            "airport": "Rzeszów, Zielona Góra, Gdańsk",
            "likes": 2397,
            "star_rating": "pięciogwiazdkowy"
        },
        {
            "page": 6,
            "wakacjeplURL": "https://www.wakacje.pl/wczasy?str-6/",
            "hotel": "Parrotel Beach Resort (ex Radisson Blu)",
            "location": "Egipt / Sharm el Sheikh",
            "date": "08.01.2026- 16.01.2026",
            "formated_date": "2026-01-08",
            "price_per_person": "4490zł",
            "image_url": "https://i.wakacje.pl/no-index/hotel/rehana-sharm-resort-pokoj-1789896194-343-228.jpg",
            "offer_url": "https://www.wakacje.pl/oferty/egipt/sharm-el-sheikh/parrotel-beach-resort-ex-radisson-blu-1042390.html?-od-2026-01-08,7-dni,all-inclusive&utm_source=travellead&utm_medium=cps&utm_campaign=1656-vacccation.com&a_aid=1656&chan=code5",
            "short_url": "https://is.gd/wwdTm3",
            "airport": "Coral Travel",
            "likes": 1845,
            "star_rating": "pięciogwiazdkowy"
        },
        {
            "page": 6,
            "wakacjeplURL": "https://www.wakacje.pl/wczasy?str-6/",
            "hotel": "Sirena Beach Resort & Spa",
            "location": "Egipt / Marsa El Alam / Al-Kusajr",
            "date": "13.01.2026- 20.01.2026",
            "formated_date": "2026-01-13",
            "price_per_person": "4844zł",
            "image_url": "https://i.wakacje.pl/no-index/hotel/rehana-sharm-resort-pokoj-teren-hotelu-826528080-343-228.jpg",
            "offer_url": "https://www.wakacje.pl/oferty/egipt/marsa-el-alam/al-kusajr/sirena-beach-resort-spa-813153.html?-od-2026-01-13,7-dni,all-inclusive&utm_source=travellead&utm_medium=cps&utm_campaign=1656-vacccation.com&a_aid=1656&chan=code5",
            "short_url": "https://is.gd/nruTct",
            "airport": "Rzeszów, Gdańsk, Wrocław",
            "likes": 2255,
            "star_rating": "pięciogwiazdkowy"
        },
        {
            "page": 6,
            "wakacjeplURL": "https://www.wakacje.pl/wczasy?str-6/",
            "hotel": "Pickalbatros Jungle Aqua Park by Neverland",
            "location": "Egipt / Hurghada",
            "date": "08.01.2026- 15.01.2026",
            "formated_date": "2026-01-08",
            "price_per_person": "5151zł",
            "image_url": "https://i.wakacje.pl/no-index/hotel/rehana-sharm-resort-lazienka-1789896200-343-228.jpg",
            "offer_url": "https://www.wakacje.pl/oferty/egipt/hurghada/hurghada/pickalbatros-jungle-aqua-park-by-neverland-406360.html?-od-2026-01-08,7-dni,all-inclusive&utm_source=travellead&utm_medium=cps&utm_campaign=1656-vacccation.com&a_aid=1656&chan=code5",
            "short_url": "https://is.gd/tLth8T",
            "airport": "Coral Travel",
            "likes": 608,
            "star_rating": "czterogwiazdkowy"
        },
        {
            "page": 7,
            "wakacjeplURL": "https://www.wakacje.pl/wczasy?str-7/",
            "hotel": "Royal Beach Nosy Be",
            "location": "Madagaskar",
            "date": "05.01.2026- 14.01.2026",
            "formated_date": "2026-01-05",
            "price_per_person": "11658zł",
            "image_url": "https://i.wakacje.pl/no-index/zdjecie/id/20001439914-343-228.jpg",
            "offer_url": "https://www.wakacje.pl/oferty/madagaskar/royal-beach-nosy-be-484532.html?-od-2026-01-05,7-dni,all-inclusive&utm_source=travellead&utm_medium=cps&utm_campaign=1656-vacccation.com&a_aid=1656&chan=code5",
            "short_url": "https://is.gd/ZRG2d7",
            "airport": "Warszawa, Katowice, Poznań",
            "likes": 231,
            "star_rating": "czterogwiazdkowy"
        },
        {
            "page": 7,
            "wakacjeplURL": "https://www.wakacje.pl/wczasy?str-7/",
            "hotel": "Hilton Nuweiba Coral Resort",
            "location": "Egipt / Taba / Nuweiba",
            "date": "16.05.2026- 24.05.2026",
            "formated_date": "2026-05-16",
            "price_per_person": "4624zł",
            "image_url": "https://i.wakacje.pl/no-index/zdjecie/id/20001439915-343-228.jpg",
            "offer_url": "https://www.wakacje.pl/oferty/egipt/taba/nuweiba/hilton-nuweiba-coral-resort-1076214.html?-od-2026-05-16,7-dni,all-inclusive&utm_source=travellead&utm_medium=cps&utm_campaign=1656-vacccation.com&a_aid=1656&chan=code5",
            "short_url": "https://is.gd/40rqNT",
            "airport": "Itaka",
            "likes": 2406,
            "star_rating": "czterogwiazdkowy"
        },
        {
            "page": 7,
            "wakacjeplURL": "https://www.wakacje.pl/wczasy?str-7/",
            "hotel": "Red Sea Makadi Palace",
            "location": "Egipt / Hurghada / Makadi Bay",
            "date": "10.01.2026- 18.01.2026",
            "formated_date": "2026-01-10",
            "price_per_person": "3660zł",
            "image_url": "https://i.wakacje.pl/no-index/zdjecie/id/20001439916-343-228.jpg",
            "offer_url": "https://www.wakacje.pl/oferty/egipt/hurghada/makadi-bay/red-sea-makadi-palace-458104.html?-od-2026-01-10,7-dni,all-inclusive&utm_source=travellead&utm_medium=cps&utm_campaign=1656-vacccation.com&a_aid=1656&chan=code5",
            "short_url": "https://is.gd/GA7NVN",
            "airport": "Katowice, Warszawa, Wrocław",
            "likes": 2027,
            "star_rating": "czteroipółgwiazdkowy"
        },
        {
            "page": 7,
            "wakacjeplURL": "https://www.wakacje.pl/wczasy?str-7/",
            "hotel": "Prestige Alanya",
            "location": "Turcja / Riwiera Turecka / Mahmutlar",
            "date": "07.05.2026- 14.05.2026",
            "formated_date": "2026-05-07",
            "price_per_person": "3227zł",
            "image_url": "https://i.wakacje.pl/no-index/zdjecie/id/20001439917-343-228.jpg",
            "offer_url": "https://www.wakacje.pl/oferty/turcja/riwiera-turecka/mahmutlar/prestige-alanya-956826.html?-od-2026-05-07,7-dni,all-inclusive&utm_source=travellead&utm_medium=cps&utm_campaign=1656-vacccation.com&a_aid=1656&chan=code5",
            "short_url": "https://is.gd/SSPtoz",
            "airport": "Join UP",
            "likes": 2250,
            "star_rating": "pięciogwiazdkowy"
        },
        {
            "page": 7,
            "wakacjeplURL": "https://www.wakacje.pl/wczasy?str-7/",
            "hotel": "Caretta Paradise",
            "location": "Grecja / Zakynthos / Tragaki",
            "date": "28.04.2026- 05.05.2026",
            "formated_date": "2026-04-28",
            "price_per_person": "4824zł",
            "image_url": "https://i.wakacje.pl/no-index/zdjecie/id/20001439918-343-228.jpg",
            "offer_url": "https://www.wakacje.pl/oferty/grecja/zakynthos/tragaki/caretta-paradise-472857.html?-od-2026-04-28,7-dni,all-inclusive&utm_source=travellead&utm_medium=cps&utm_campaign=1656-vacccation.com&a_aid=1656&chan=code5",
            "short_url": "https://is.gd/gQR6MP",
            "airport": "Berlin, Katowice, Warszawa",
            "likes": 1705,
            "star_rating": "czteroipółgwiazdkowy"
        },
        {
            "page": 7,
            "wakacjeplURL": "https://www.wakacje.pl/wczasy?str-7/",
            "hotel": "Pickalbatros Royal Moderna",
            "location": "Egipt / Sharm el Sheikh",
            "date": "08.01.2026- 16.01.2026",
            "formated_date": "2026-01-08",
            "price_per_person": "5068zł",
            "image_url": "https://i.wakacje.pl/no-index/zdjecie/id/20001439919-343-228.jpg",
            "offer_url": "https://www.wakacje.pl/oferty/egipt/sharm-el-sheikh/pickalbatros-royal-moderna-876998.html?-od-2026-01-08,7-dni,all-inclusive&utm_source=travellead&utm_medium=cps&utm_campaign=1656-vacccation.com&a_aid=1656&chan=code5",
            "short_url": "https://is.gd/yD3WPQ",
            "airport": "ETI",
            "likes": 250,
            "star_rating": "pięciogwiazdkowy"
        },
        {
            "page": 7,
            "wakacjeplURL": "https://www.wakacje.pl/wczasy?str-7/",
            "hotel": "Fuerteventura Princess",
            "location": "Hiszpania / Fuerteventura / Playa Esquinzo",
            "date": "05.01.2026- 12.01.2026",
            "formated_date": "2026-01-05",
            "price_per_person": "6858zł",
            "image_url": "https://i.wakacje.pl/no-index/zdjecie/id/20001439920-343-228.jpg",
            "offer_url": "https://www.wakacje.pl/oferty/hiszpania/fuerteventura/playa-esquinzo/fuerteventura-princess-480073.html?-od-2026-01-05,7-dni,all-inclusive&utm_source=travellead&utm_medium=cps&utm_campaign=1656-vacccation.com&a_aid=1656&chan=code5",
            "short_url": "https://is.gd/NDZ1z8",
            "airport": "Kraków, Bydgoszcz, Katowice",
            "likes": 2298,
            "star_rating": "czterogwiazdkowy"
        },
        {
            "page": 7,
            "wakacjeplURL": "https://www.wakacje.pl/wczasy?str-7/",
            "hotel": "Bliss Nada Beach Resort (ex. Hotelux Jolie Beach Resort Marsa Alam)",
            "location": "Egipt / Marsa El Alam",
            "date": "12.01.2026- 19.01.2026",
            "formated_date": "2026-01-12",
            "price_per_person": "3710zł",
            "image_url": "https://i.wakacje.pl/no-index/zdjecie/id/20001439921-343-228.jpg",
            "offer_url": "https://www.wakacje.pl/oferty/egipt/marsa-el-alam/bliss-nada-beach-resort-ex-hotelux-jolie-beach-resort-marsa-alam-910446.html?-od-2026-01-12,7-dni,all-inclusive&utm_source=travellead&utm_medium=cps&utm_campaign=1656-vacccation.com&a_aid=1656&chan=code5",
            "short_url": "https://is.gd/ngyaQt",
            "airport": "Anex Poland",
            "likes": 1520,
            "star_rating": "czterogwiazdkowy"
        },
        {
            "page": 7,
            "wakacjeplURL": "https://www.wakacje.pl/wczasy?str-7/",
            "hotel": "Holiday Beach Djerba",
            "location": "Tunezja / Djerba / Midoun",
            "date": "08.01.2026- 15.01.2026",
            "formated_date": "2026-01-08",
            "price_per_person": "2522zł",
            "image_url": "https://i.wakacje.pl/no-index/zdjecie/id/20001439922-343-228.jpg",
            "offer_url": "https://www.wakacje.pl/oferty/tunezja/djerba/midoun/holiday-beach-djerba-473804.html?-od-2026-01-08,7-dni,all-inclusive&utm_source=travellead&utm_medium=cps&utm_campaign=1656-vacccation.com&a_aid=1656&chan=code5",
            "short_url": "https://is.gd/rAmnm3",
            "airport": "Warszawa, Katowice, Wrocław",
            "likes": 2162,
            "star_rating": "czterogwiazdkowy"
        },
        {
            "page": 7,
            "wakacjeplURL": "https://www.wakacje.pl/wczasy?str-7/",
            "hotel": "Jaz Solaya (ex Sol Y Mar Solaya)",
            "location": "Egipt / Marsa El Alam",
            "date": "12.01.2026- 19.01.2026",
            "formated_date": "2026-01-12",
            "price_per_person": "6634zł",
            "image_url": "https://i.wakacje.pl/no-index/zdjecie/id/20001439923-343-228.jpg",
            "offer_url": "https://www.wakacje.pl/oferty/egipt/marsa-el-alam/jaz-solaya-ex-sol-y-mar-solaya-910405.html?-od-2026-01-12,7-dni,all-inclusive&utm_source=travellead&utm_medium=cps&utm_campaign=1656-vacccation.com&a_aid=1656&chan=code5",
            "short_url": "https://is.gd/iDUowT",
            "airport": "Grecos",
            "likes": 289,
            "star_rating": "pięciogwiazdkowy"
        },
        {
            "page": 8,
            "wakacjeplURL": "https://www.wakacje.pl/wczasy?str-8/",
            "hotel": "Salamis Bay Conti",
            "location": "Cypr / Cypr Północny / Famagusta (Gazimagusa)",
            "date": "13.01.2026- 20.01.2026",
            "formated_date": "2026-01-13",
            "price_per_person": "5538zł",
            "image_url": "https://i.wakacje.pl/no-index/hotel/salamis-bay-conti-plaza-sport-i-rekreacja-beach-bar-824358483-343-228.jpg",
            "offer_url": "https://www.wakacje.pl/oferty/cypr/cypr-polnocny/famagusta-gazimagusa/salamis-bay-conti-1009735.html?-od-2026-01-13,7-dni,all-inclusive&utm_source=travellead&utm_medium=cps&utm_campaign=1656-vacccation.com&a_aid=1656&chan=code5",
            "short_url": "https://is.gd/QfBTVU",
            "airport": "Berlin, Warszawa, Katowice",
            "likes": 725,
            "star_rating": "pięciogwiazdkowy"
        },
        {
            "page": 8,
            "wakacjeplURL": "https://www.wakacje.pl/wczasy?str-8/",
            "hotel": "R2 Rio Calma",
            "location": "Hiszpania / Fuerteventura / Costa Calma",
            "date": "05.01.2026- 12.01.2026",
            "formated_date": "2026-01-05",
            "price_per_person": "5258zł",
            "image_url": "https://i.wakacje.pl/no-index/hotel/salamis-bay-conti-plaza-obiekt-767563804-343-228.jpg",
            "offer_url": "https://www.wakacje.pl/oferty/hiszpania/fuerteventura/costa-calma/r2-rio-calma-442072.html?-od-2026-01-05,7-dni,all-inclusive&utm_source=travellead&utm_medium=cps&utm_campaign=1656-vacccation.com&a_aid=1656&chan=code5",
            "short_url": "https://is.gd/WJPx50",
            "airport": "Exim Tours",
            "likes": 1263,
            "star_rating": "czterogwiazdkowy"
        },
        {
            "page": 8,
            "wakacjeplURL": "https://www.wakacje.pl/wczasy?str-8/",
            "hotel": "Sea Gull Beach Resort (Hurghada)",
            "location": "Egipt / Hurghada",
            "date": "14.01.2026- 21.01.2026",
            "formated_date": "2026-01-14",
            "price_per_person": "4407zł",
            "image_url": "https://i.wakacje.pl/no-index/hotel/salamis-bay-conti-aquapark-teren-hotelu-767563807-343-228.jpg",
            "offer_url": "https://www.wakacje.pl/oferty/egipt/hurghada/hurghada/sea-gull-beach-resort-hurghada-17600.html?-od-2026-01-14,7-dni,all-inclusive&utm_source=travellead&utm_medium=cps&utm_campaign=1656-vacccation.com&a_aid=1656&chan=code5",
            "short_url": "https://is.gd/kyTCIv",
            "airport": "Warszawa, Gdańsk, Katowice",
            "likes": 496,
            "star_rating": "czterogwiazdkowy"
        },
        {
            "page": 8,
            "wakacjeplURL": "https://www.wakacje.pl/wczasy?str-8/",
            "hotel": "Pickalbatros Laguna Vista Beach",
            "location": "Egipt / Sharm el Sheikh",
            "date": "08.01.2026- 16.01.2026",
            "formated_date": "2026-01-08",
            "price_per_person": "5440zł",
            "image_url": "https://i.wakacje.pl/no-index/hotel/salamis-bay-conti-teren-hotelu-1466317866-343-228.jpg",
            "offer_url": "https://www.wakacje.pl/oferty/egipt/sharm-el-sheikh/pickalbatros-laguna-vista-beach-876996.html?-od-2026-01-08,7-dni,all-inclusive&utm_source=travellead&utm_medium=cps&utm_campaign=1656-vacccation.com&a_aid=1656&chan=code5",
            "short_url": "https://is.gd/0nFPOe",
            "airport": "Itaka",
            "likes": 828,
            "star_rating": "pięciogwiazdkowy"
        },
        {
            "page": 8,
            "wakacjeplURL": "https://www.wakacje.pl/wczasy?str-8/",
            "hotel": "Gypsophila Holiday Village",
            "location": "Turcja / Riwiera Turecka / Okurcalar",
            "date": "08.04.2026- 15.04.2026",
            "formated_date": "2026-04-08",
            "price_per_person": "4741zł",
            "image_url": "https://i.wakacje.pl/no-index/hotel/salamis-bay-conti-balkon-taras-pokoj-1771428077-343-228.jpg",
            "offer_url": "https://www.wakacje.pl/oferty/turcja/riwiera-turecka/okurcalar/gypsophila-holiday-village-20956.html?-od-2026-04-08,7-dni,all-inclusive&utm_source=travellead&utm_medium=cps&utm_campaign=1656-vacccation.com&a_aid=1656&chan=code5",
            "short_url": "https://is.gd/uOkGWZ",
            "airport": "Katowice, Warszawa, Gdańsk",
            "likes": 2033,
            "star_rating": "pięciogwiazdkowy"
        },
        {
            "page": 8,
            "wakacjeplURL": "https://www.wakacje.pl/wczasy?str-8/",
            "hotel": "Cleopatra Luxury Resort Sharm Adults Only",
            "location": "Egipt / Sharm el Sheikh",
            "date": "15.01.2026- 22.01.2026",
            "formated_date": "2026-01-15",
            "price_per_person": "6098zł",
            "image_url": "https://i.wakacje.pl/no-index/hotel/salamis-bay-conti-balkon-taras-pokoj-1771428079-343-228.jpg",
            "offer_url": "https://www.wakacje.pl/oferty/egipt/sharm-el-sheikh/cleopatra-luxury-resort-sharm-adults-only-877042.html?-od-2026-01-15,7-dni,all-inclusive&utm_source=travellead&utm_medium=cps&utm_campaign=1656-vacccation.com&a_aid=1656&chan=code5",
            "short_url": "https://is.gd/zQyhSu",
            "airport": "Coral Travel",
            "likes": 1113,
            "star_rating": "pięciogwiazdkowy"
        },
        {
            "page": 8,
            "wakacjeplURL": "https://www.wakacje.pl/wczasy?str-8/",
            "hotel": "Jaz Aquamarine (ex. Iberotel Aquamarine)",
            "location": "Egipt / Hurghada",
            "date": "11.01.2026- 18.01.2026",
            "formated_date": "2026-01-11",
            "price_per_person": "5679zł",
            "image_url": "https://i.wakacje.pl/no-index/hotel/salamis-bay-conti-pokoj-z-widokiem-na-morze-balkon-taras-pokoj-1771428073-343-228.jpg",
            "offer_url": "https://www.wakacje.pl/oferty/egipt/hurghada/hurghada/jaz-aquamarine-ex-iberotel-aquamarine-757168.html?-od-2026-01-11,7-dni,all-inclusive&utm_source=travellead&utm_medium=cps&utm_campaign=1656-vacccation.com&a_aid=1656&chan=code5",
            "short_url": "https://is.gd/7bp2ui",
            "airport": "Katowice, Warszawa, Wrocław",
            "likes": 1596,
            "star_rating": "pięciogwiazdkowy"
        },
        {
            "page": 8,
            "wakacjeplURL": "https://www.wakacje.pl/wczasy?str-8/",
            "hotel": "Jaz Mirabel Park",
            "location": "Egipt / Sharm el Sheikh",
            "date": "08.01.2026- 16.01.2026",
            "formated_date": "2026-01-08",
            "price_per_person": "4256zł",
            "image_url": "https://i.wakacje.pl/no-index/hotel/salamis-bay-conti-pokoj-843334641-343-228.jpg",
            "offer_url": "https://www.wakacje.pl/oferty/egipt/sharm-el-sheikh/jaz-mirabel-park-1053498.html?-od-2026-01-08,7-dni,all-inclusive&utm_source=travellead&utm_medium=cps&utm_campaign=1656-vacccation.com&a_aid=1656&chan=code5",
            "short_url": "https://is.gd/rSo5Kv",
            "airport": "Join UP",
            "likes": 851,
            "star_rating": "pięciogwiazdkowy"
        },
        {
            "page": 8,
            "wakacjeplURL": "https://www.wakacje.pl/wczasy?str-8/",
            "hotel": "Sunshine Rhodes (Ialyssos)",
            "location": "Grecja / Rodos / Ialyssos",
            "date": "08.05.2026- 15.05.2026",
            "formated_date": "2026-05-08",
            "price_per_person": "6252zł",
            "image_url": "https://i.wakacje.pl/no-index/hotel/salamis-bay-conti-pokoj-824358491-343-228.jpg",
            "offer_url": "https://www.wakacje.pl/oferty/grecja/rodos/ialyssos/sunshine-rhodes-ialyssos-472908.html?-od-2026-05-08,7-dni,all-inclusive&utm_source=travellead&utm_medium=cps&utm_campaign=1656-vacccation.com&a_aid=1656&chan=code5",
            "short_url": "https://is.gd/CNnwCw",
            "airport": "Rzeszów, Zielona Góra, Gdańsk",
            "likes": 1225,
            "star_rating": "czterogwiazdkowy"
        },
        {
            "page": 8,
            "wakacjeplURL": "https://www.wakacje.pl/wczasy?str-8/",
            "hotel": "Albatros Palace Port Ghalib (ex. Red Sea The Palace)",
            "location": "Egipt / Marsa El Alam / Port Ghalib",
            "date": "08.01.2026- 15.01.2026",
            "formated_date": "2026-01-08",
            "price_per_person": "6768zł",
            "image_url": "https://i.wakacje.pl/no-index/hotel/salamis-bay-conti-pokoj-1771428081-343-228.jpg",
            "offer_url": "https://www.wakacje.pl/oferty/egipt/marsa-el-alam/port-ghalib/albatros-palace-port-ghalib-ex-red-sea-the-palace-795027.html?-od-2026-01-08,7-dni,all-inclusive&utm_source=travellead&utm_medium=cps&utm_campaign=1656-vacccation.com&a_aid=1656&chan=code5",
            "short_url": "https://is.gd/dco5hk",
            "airport": "Coral Travel",
            "likes": 1442,
            "star_rating": "pięciogwiazdkowy"
        },
        {
            "page": 9,
            "wakacjeplURL": "https://www.wakacje.pl/wczasy?str-9/",
            "hotel": "Saint George Palace (Agios Georgios)",
            "location": "Grecja / Korfu / Aghios Georgios",
            "date": "25.04.2026- 03.05.2026",
            "formated_date": "2026-04-25",
            "price_per_person": "4692zł",
            "image_url": "https://i.wakacje.pl/no-index/hotel/saint-george-palace-agios-georgios-teren-hotelu-budynek-glowny-812514071-343-228.jpg",
            "offer_url": "https://www.wakacje.pl/oferty/grecja/korfu/aghios-georgios/saint-george-palace-agios-georgios-472940.html?-od-2026-04-25,7-dni,all-inclusive&utm_source=travellead&utm_medium=cps&utm_campaign=1656-vacccation.com&a_aid=1656&chan=code5",
            "short_url": "https://is.gd/68rnm3",
            "airport": "Warszawa, Katowice, Wrocław",
            "likes": 2274,
            "star_rating": "czterogwiazdkowy"
        },
        {
            "page": 9,
            "wakacjeplURL": "https://www.wakacje.pl/wczasy?str-9/",
            "hotel": "King Evelthon Beach Hotel and Resort",
            "location": "Cypr / Cypr Południowy / Paphos",
            "date": "10.01.2026- 17.01.2026",
            "formated_date": "2026-01-10",
            "price_per_person": "4318zł",
            "image_url": "https://i.wakacje.pl/no-index/hotel/saint-george-palace-agios-georgios-plaza-812512665-343-228.jpg",
            "offer_url": "https://www.wakacje.pl/oferty/cypr/cypr-poludniowy/paphos/king-evelthon-beach-hotel-and-resort-993441.html?-od-2026-01-10,7-dni,all-inclusive&utm_source=travellead&utm_medium=cps&utm_campaign=1656-vacccation.com&a_aid=1656&chan=code5",
            "short_url": "https://is.gd/dJld3B",
            "airport": "Grecos",
            "likes": 1282,
            "star_rating": "pięciogwiazdkowy"
        },
        {
            "page": 9,
            "wakacjeplURL": "https://www.wakacje.pl/wczasy?str-9/",
            "hotel": "Rixos Premium Alamein (ex. Regal Heights)",
            "location": "Egipt / Dolny Egipt",
            "date": "09.10.2026- 16.10.2026",
            "formated_date": "2026-10-09",
            "price_per_person": "9283zł",
            "image_url": "https://i.wakacje.pl/no-index/hotel/saint-george-palace-agios-georgios-pokoj-812512673-343-228.jpg",
            "offer_url": "https://www.wakacje.pl/oferty/egipt/dolny-egipt/rixos-premium-alamein-ex-regal-heights-1044842.html?-od-2026-10-09,7-dni,all-inclusive&utm_source=travellead&utm_medium=cps&utm_campaign=1656-vacccation.com&a_aid=1656&chan=code5",
            "short_url": "https://is.gd/cU5ZjH",
            "airport": "Katowice, Warszawa, Poznań",
            "likes": 1957,
            "star_rating": "pięciogwiazdkowy"
        },
        {
            "page": 9,
            "wakacjeplURL": "https://www.wakacje.pl/wczasy?str-9/",
            "hotel": "Hilton Marsa Alam Nubian Resort",
            "location": "Egipt / Marsa El Alam",
            "date": "12.01.2026- 19.01.2026",
            "formated_date": "2026-01-12",
            "price_per_person": "5372zł",
            "image_url": "https://i.wakacje.pl/no-index/hotel/saint-george-palace-agios-georgios-teren-hotelu-812512663-343-228.jpg",
            "offer_url": "https://www.wakacje.pl/oferty/egipt/marsa-el-alam/hilton-marsa-alam-nubian-resort-910396.html?-od-2026-01-12,7-dni,all-inclusive&utm_source=travellead&utm_medium=cps&utm_campaign=1656-vacccation.com&a_aid=1656&chan=code5",
            "short_url": "https://is.gd/vqYKGI",
            "airport": "Exim Tours",
            "likes": 2325,
            "star_rating": "pięciogwiazdkowy"
        },
        {
            "page": 9,
            "wakacjeplURL": "https://www.wakacje.pl/wczasy?str-9/",
            "hotel": "db Seabank Resort & Spa (ex RIU Seabank)",
            "location": "Malta / Wyspa Malta / Mellieha",
            "date": "08.01.2026- 15.01.2026",
            "formated_date": "2026-01-08",
            "price_per_person": "3658zł",
            "image_url": "https://i.wakacje.pl/no-index/hotel/saint-george-palace-agios-georgios-restauracja-812512669-343-228.jpg",
            "offer_url": "https://www.wakacje.pl/oferty/malta/wyspa-malta/mellieha/db-seabank-resort-spa-ex-riu-seabank-985884.html?-od-2026-01-08,7-dni,all-inclusive&utm_source=travellead&utm_medium=cps&utm_campaign=1656-vacccation.com&a_aid=1656&chan=code5",
            "short_url": "https://is.gd/iDPgdd",
            "airport": "Katowice, Warszawa, Poznań",
            "likes": 1744,
            "star_rating": "czterogwiazdkowy"
        },
        {
            "page": 9,
            "wakacjeplURL": "https://www.wakacje.pl/wczasy?str-9/",
            "hotel": "Rewaya Majestic Resort",
            "location": "Egipt / Hurghada",
            "date": "08.01.2026- 15.01.2026",
            "formated_date": "2026-01-08",
            "price_per_person": "4883zł",
            "image_url": "https://i.wakacje.pl/no-index/hotel/saint-george-palace-agios-georgios-teren-hotelu-812512662-343-228.jpg",
            "offer_url": "https://www.wakacje.pl/oferty/egipt/hurghada/hurghada/rewaya-majestic-resort-1032876.html?-od-2026-01-08,7-dni,all-inclusive&utm_source=travellead&utm_medium=cps&utm_campaign=1656-vacccation.com&a_aid=1656&chan=code5",
            "short_url": "https://is.gd/lH9pa7",
            "airport": "Coral Travel",
            "likes": 1313,
            "star_rating": "pięciogwiazdkowy"
        },
        {
            "page": 9,
            "wakacjeplURL": "https://www.wakacje.pl/wczasy?str-9/",
            "hotel": "Albatros Sea World Resort Marsa Alam",
            "location": "Egipt / Marsa El Alam / Al-Kusajr",
            "date": "11.01.2026- 18.01.2026",
            "formated_date": "2026-01-11",
            "price_per_person": "5702zł",
            "image_url": "https://i.wakacje.pl/no-index/hotel/saint-george-palace-agios-georgios-recepcja-lobby-812512666-343-228.jpg",
            "offer_url": "https://www.wakacje.pl/oferty/egipt/marsa-el-alam/al-kusajr/albatros-sea-world-resort-marsa-alam-659828.html?-od-2026-01-11,7-dni,all-inclusive&utm_source=travellead&utm_medium=cps&utm_campaign=1656-vacccation.com&a_aid=1656&chan=code5",
            "short_url": "https://is.gd/uf3qxE",
            "airport": "Katowice, Warszawa, Poznań",
            "likes": 670,
            "star_rating": "pięciogwiazdkowy"
        },
        {
            "page": 9,
            "wakacjeplURL": "https://www.wakacje.pl/wczasy?str-9/",
            "hotel": "Regency Plaza Aqua Park Spa",
            "location": "Egipt / Sharm el Sheikh",
            "date": "22.01.2026- 29.01.2026",
            "formated_date": "2026-01-22",
            "price_per_person": "4316zł",
            "image_url": "https://i.wakacje.pl/no-index/hotel/saint-george-palace-agios-georgios-recepcja-lobby-812512667-343-228.jpg",
            "offer_url": "https://www.wakacje.pl/oferty/egipt/sharm-el-sheikh/sharm-el-sheikh/regency-plaza-aqua-park-spa-879297.html?-od-2026-01-22,7-dni,all-inclusive&utm_source=travellead&utm_medium=cps&utm_campaign=1656-vacccation.com&a_aid=1656&chan=code5",
            "short_url": "https://is.gd/UpPLum",
            "airport": "Join UP",
            "likes": 2279,
            "star_rating": "pięciogwiazdkowy"
        },
        {
            "page": 9,
            "wakacjeplURL": "https://www.wakacje.pl/wczasy?str-9/",
            "hotel": "Sunrise (Pefkos)",
            "location": "Grecja / Rodos / Pefkos",
            "date": "04.05.2026- 12.05.2026",
            "formated_date": "2026-05-04",
            "price_per_person": "5842zł",
            "image_url": "https://i.wakacje.pl/no-index/hotel/saint-george-palace-agios-georgios-pokoj-812512670-343-228.jpg",
            "offer_url": "https://www.wakacje.pl/oferty/grecja/rodos/pefkos/sunrise-pefkos-476759.html?-od-2026-05-04,7-dni,all-inclusive&utm_source=travellead&utm_medium=cps&utm_campaign=1656-vacccation.com&a_aid=1656&chan=code5",
            "short_url": "https://is.gd/JINNnX",
            "airport": "Katowice, Warszawa, Poznań",
            "likes": 1721,
            "star_rating": "czterogwiazdkowy"
        },
        {
            "page": 9,
            "wakacjeplURL": "https://www.wakacje.pl/wczasy?str-9/",
            "hotel": "Pickalbatros Citadel Sahl Hasheesh (ex. Citadel Azur Resort)",
            "location": "Egipt / Hurghada",
            "date": "08.01.2026- 15.01.2026",
            "formated_date": "2026-01-08",
            "price_per_person": "5778zł",
            "image_url": "https://i.wakacje.pl/no-index/hotel/saint-george-palace-agios-georgios-pokoj-812512671-343-228.jpg",
            "offer_url": "https://www.wakacje.pl/oferty/egipt/hurghada/hurghada/pickalbatros-citadel-sahl-hasheesh-ex-citadel-azur-resort-75.html?-od-2026-01-08,7-dni,all-inclusive&utm_source=travellead&utm_medium=cps&utm_campaign=1656-vacccation.com&a_aid=1656&chan=code5",
            "short_url": "https://is.gd/rBEf9p",
            "airport": "Exim Tours",
            "likes": 2209,
            "star_rating": "pięciogwiazdkowy"
        }
    ]
}