{
    "offers": [
        {
            "page": 2,
            "wakacjeplURL": "https://www.wakacje.pl/wczasy/egipt?str-2,7-dni,do-3990zl,samolotem,3-gwiazdkowe,ocena-8,za-osobe",
            "hotel": "Rewaya Majestic Resort",
            "location": "Egipt / Hurghada",
            "date": "09.01.2026- 16.01.2026",
            "formated_date": "2026-01-09",
            "price_per_person": "2007",
            "image_url": "https://i.wakacje.pl/no-index/hotel/rewaya-majestic-resort-basen-teren-hotelu-obiekt-1777145318-343-228.jpg",
            "offer_url": "https://www.wakacje.pl/oferty/egipt/hurghada/hurghada/rewaya-majestic-resort-1010785.html?-od-2026-01-09,7-dni,all-inclusive&utm_source=travellead&utm_medium=cps&utm_campaign=1656-vacccation.com&a_aid=1656&chan=code5",
            "short_url": "https://is.gd/d51VXX",
            "airport": "Katowice, Warszawa, Poznań",
            "likes": 277,
            "star_rating": "pięciogwiazdkowy",
            "food": "All Inclusive"
        },
        {
            "page": 2,
            "wakacjeplURL": "https://www.wakacje.pl/wczasy/egipt?str-2,7-dni,do-3990zl,samolotem,3-gwiazdkowe,ocena-8,za-osobe",
            "hotel": "Tropitel Sahl Hasheesh",
            "location": "Egipt / Hurghada / Sahl Hasheesh",
            "date": "30.04.2026- 07.05.2026",
            "formated_date": "2026-04-30",
            "price_per_person": "2421",
            "image_url": "https://i.wakacje.pl/no-index/hotel/rewaya-majestic-resort-plaza-teren-hotelu-obiekt-1777145319-343-228.jpg",
            "offer_url": "https://www.wakacje.pl/oferty/egipt/hurghada/sahl-hasheesh/tropitel-sahl-hasheesh-202458.html?-od-2026-04-30,7-dni,all-inclusive&utm_source=travellead&utm_medium=cps&utm_campaign=1656-vacccation.com&a_aid=1656&chan=code5",
            "short_url": "https://is.gd/LJgrLt",
            "airport": "Warszawa, Katowice, Poznań",
            "likes": 1251,
            "star_rating": "pięciogwiazdkowy",
            "food": "All Inclusive Ultra"
        },
        {
            "page": 2,
            "wakacjeplURL": "https://www.wakacje.pl/wczasy/egipt?str-2,7-dni,do-3990zl,samolotem,3-gwiazdkowe,ocena-8,za-osobe",
            "hotel": "Utopia Beach Club",
            "location": "Egipt / Marsa El Alam / Al-Kusajr",
            "date": "13.01.2026- 20.01.2026",
            "formated_date": "2026-01-13",
            "price_per_person": "1866",
            "image_url": "https://i.wakacje.pl/no-index/hotel/rewaya-majestic-resort-basen-teren-hotelu-obiekt-1777145320-343-228.jpg",
            "offer_url": "https://www.wakacje.pl/oferty/egipt/marsa-el-alam/al-kusajr/utopia-beach-club-660096.html?-od-2026-01-13,7-dni,all-inclusive&utm_source=travellead&utm_medium=cps&utm_campaign=1656-vacccation.com&a_aid=1656&chan=code5",
            "short_url": "https://is.gd/53B7Ao",
            "airport": "Katowice, Warszawa, Rzeszów",
            "likes": 1374,
            "star_rating": "czterogwiazdkowy",
            "food": "All Inclusive"
        },
        {
            "page": 2,
            "wakacjeplURL": "https://www.wakacje.pl/wczasy/egipt?str-2,7-dni,do-3990zl,samolotem,3-gwiazdkowe,ocena-8,za-osobe",
            "hotel": "Akassia Swiss Resort (ex. Calimera Club Akassia Swiss Resort)",
            "location": "Egipt / Marsa El Alam / Al-Kusajr",
            "date": "13.01.2026- 20.01.2026",
            "formated_date": "2026-01-13",
            "price_per_person": "2317",
            "image_url": "https://i.wakacje.pl/no-index/hotel/rewaya-majestic-resort-basen-teren-hotelu-obiekt-1777145321-343-228.jpg",
            "offer_url": "https://www.wakacje.pl/oferty/egipt/marsa-el-alam/al-kusajr/akassia-swiss-resort-ex-calimera-club-akassia-swiss-resort-254866.html?-od-2026-01-13,7-dni,all-inclusive&utm_source=travellead&utm_medium=cps&utm_campaign=1656-vacccation.com&a_aid=1656&chan=code5",
            "short_url": "https://is.gd/ODX1cr",
            "airport": "Katowice, Warszawa, Rzeszów",
            "likes": 1474,
            "star_rating": "pięciogwiazdkowy",
            "food": "All Inclusive"
        },
        {
            "page": 2,
            "wakacjeplURL": "https://www.wakacje.pl/wczasy/egipt?str-2,7-dni,do-3990zl,samolotem,3-gwiazdkowe,ocena-8,za-osobe",
            "hotel": "Sentido Akassia Beach (ex. LTI Akassia Beach)",
            "location": "Egipt / Marsa El Alam",
            "date": "08.01.2026- 15.01.2026",
            "formated_date": "2026-01-08",
            "price_per_person": "2205",
            "image_url": "https://i.wakacje.pl/no-index/hotel/rewaya-majestic-resort-basen-teren-hotelu-obiekt-1777145322-343-228.jpg",
            "offer_url": "https://www.wakacje.pl/oferty/egipt/marsa-el-alam/sentido-akassia-beach-ex-lti-akassia-beach-799112.html?-od-2026-01-08,7-dni,all-inclusive&utm_source=travellead&utm_medium=cps&utm_campaign=1656-vacccation.com&a_aid=1656&chan=code5",
            "short_url": "https://is.gd/wFVdxZ",
            "airport": "Katowice, Warszawa",
            "likes": 1574,
            "star_rating": "pięciogwiazdkowy",
            "food": "All Inclusive"
        },
        {
            "page": 2,
            "wakacjeplURL": "https://www.wakacje.pl/wczasy/egipt?str-2,7-dni,do-3990zl,samolotem,3-gwiazdkowe,ocena-8,za-osobe",
            "hotel": "Albatros Sea World Resort Marsa Alam",
            "location": "Egipt / Marsa El Alam / Al-Kusajr",
            "date": "08.01.2026- 15.01.2026",
            "formated_date": "2026-01-08",
            "price_per_person": "2596",
            "image_url": "https://i.wakacje.pl/no-index/hotel/rewaya-majestic-resort-basen-teren-hotelu-obiekt-1777145334-343-228.jpg",
            "offer_url": "https://www.wakacje.pl/oferty/egipt/marsa-el-alam/al-kusajr/albatros-sea-world-resort-marsa-alam-795035.html?-od-2026-01-08,7-dni,all-inclusive&utm_source=travellead&utm_medium=cps&utm_campaign=1656-vacccation.com&a_aid=1656&chan=code5",
            "short_url": "https://is.gd/VUdtg2",
            "airport": "Katowice, Warszawa",
            "likes": 1714,
            "star_rating": "pięciogwiazdkowy",
            "food": "All Inclusive"
        },
        {
            "page": 2,
            "wakacjeplURL": "https://www.wakacje.pl/wczasy/egipt?str-2,7-dni,do-3990zl,samolotem,3-gwiazdkowe,ocena-8,za-osobe",
            "hotel": "Radisson Individuals Marina Port Ghalib (ex. Sunrise Marina Resort)",
            "location": "Egipt / Marsa El Alam / Port Ghalib",
            "date": "13.01.2026- 20.01.2026",
            "formated_date": "2026-01-13",
            "price_per_person": "2229",
            "image_url": "https://i.wakacje.pl/no-index/hotel/rewaya-majestic-resort-teren-hotelu-obiekt-1777145337-343-228.jpg",
            "offer_url": "https://www.wakacje.pl/oferty/egipt/marsa-el-alam/port-ghalib/radisson-individuals-marina-port-ghalib-ex-sunrise-marina-resort-282238.html?-od-2026-01-13,7-dni,all-inclusive&utm_source=travellead&utm_medium=cps&utm_campaign=1656-vacccation.com&a_aid=1656&chan=code5",
            "short_url": "https://is.gd/OAiCoG",
            "airport": "Katowice, Warszawa, Rzeszów",
            "likes": 1385,
            "star_rating": "pięciogwiazdkowy",
            "food": "All Inclusive"
        },
        {
            "page": 2,
            "wakacjeplURL": "https://www.wakacje.pl/wczasy/egipt?str-2,7-dni,do-3990zl,samolotem,3-gwiazdkowe,ocena-8,za-osobe",
            "hotel": "Jaz Grand Marsa (ex Resta Grand Resort)",
            "location": "Egipt / Marsa El Alam / Madinat Coraya",
            "date": "10.01.2026- 17.01.2026",
            "formated_date": "2026-01-10",
            "price_per_person": "2980",
            "image_url": "https://i.wakacje.pl/no-index/hotel/rewaya-majestic-resort-teren-hotelu-plaza-1777145338-343-228.jpg",
            "offer_url": "https://www.wakacje.pl/oferty/egipt/marsa-el-alam/madinat-coraya/jaz-grand-marsa-ex-resta-grand-resort-216993.html?-od-2026-01-10,7-dni,all-inclusive&utm_source=travellead&utm_medium=cps&utm_campaign=1656-vacccation.com&a_aid=1656&chan=code5",
            "short_url": "https://is.gd/ZiHDwm",
            "airport": "Warszawa, Gdańsk, Katowice",
            "likes": 2299,
            "star_rating": "pięciogwiazdkowy",
            "food": "All Inclusive"
        },
        {
            "page": 2,
            "wakacjeplURL": "https://www.wakacje.pl/wczasy/egipt?str-2,7-dni,do-3990zl,samolotem,3-gwiazdkowe,ocena-8,za-osobe",
            "hotel": "Calimera Blend Paradise",
            "location": "Egipt / Hurghada",
            "date": "09.01.2026- 16.01.2026",
            "formated_date": "2026-01-09",
            "price_per_person": "2232",
            "image_url": "https://i.wakacje.pl/no-index/hotel/rewaya-majestic-resort-teren-hotelu-plaza-1777145339-343-228.jpg",
            "offer_url": "https://www.wakacje.pl/oferty/egipt/hurghada/hurghada/calimera-blend-paradise-846455.html?-od-2026-01-09,7-dni,all-inclusive&utm_source=travellead&utm_medium=cps&utm_campaign=1656-vacccation.com&a_aid=1656&chan=code5",
            "short_url": "https://is.gd/ICGEbz",
            "airport": "Katowice, Warszawa, Poznań",
            "likes": 699,
            "star_rating": "pięciogwiazdkowy",
            "food": "All Inclusive"
        },
        {
            "page": 2,
            "wakacjeplURL": "https://www.wakacje.pl/wczasy/egipt?str-2,7-dni,do-3990zl,samolotem,3-gwiazdkowe,ocena-8,za-osobe",
            "hotel": "Casa Blue Luxury Resort",
            "location": "Egipt / Marsa El Alam / Port Ghalib",
            "date": "10.01.2026- 18.01.2026",
            "formated_date": "2026-01-10",
            "price_per_person": "3628",
            "image_url": "https://i.wakacje.pl/no-index/hotel/rewaya-majestic-resort-teren-hotelu-obiekt-1777145340-343-228.jpg",
            "offer_url": "https://www.wakacje.pl/oferty/egipt/marsa-el-alam/port-ghalib/casa-blue-luxury-resort-752736.html?-od-2026-01-10,7-dni,all-inclusive&utm_source=travellead&utm_medium=cps&utm_campaign=1656-vacccation.com&a_aid=1656&chan=code5",
            "short_url": "https://is.gd/okT9Rs",
            "airport": "Gdańsk, Katowice, Poznań",
            "likes": 569,
            "star_rating": "pięciogwiazdkowy",
            "food": "All Inclusive 24h"
        },
        {
            "page": 3,
            "wakacjeplURL": "https://www.wakacje.pl/wczasy/egipt?str-3,7-dni,do-3990zl,samolotem,3-gwiazdkowe,ocena-8,za-osobe",
            "hotel": "Pickalbatros Sands Port Ghalib (ex. Red Sea Siva Sands)",
            "location": "Egipt / Marsa El Alam / Port Ghalib",
            "date": "13.01.2026- 20.01.2026",
            "formated_date": "2026-01-13",
            "price_per_person": "2639",
            "image_url": "https://i.wakacje.pl/no-index/hotel/pickalbatros-sands-port-ghalib-ex-red-sea-siva-sands-basen-1595081930-343-228.jpg",
            "offer_url": "https://www.wakacje.pl/oferty/egipt/marsa-el-alam/port-ghalib/pickalbatros-sands-port-ghalib-ex-red-sea-siva-sands-958505.html?-od-2026-01-13,7-dni,all-inclusive&utm_source=travellead&utm_medium=cps&utm_campaign=1656-vacccation.com&a_aid=1656&chan=code5",
            "short_url": "https://is.gd/EBW71I",
            "airport": "Katowice, Warszawa, Rzeszów",
            "likes": 324,
            "star_rating": "pięciogwiazdkowy",
            "food": "All Inclusive"
        },
        {
            "page": 3,
            "wakacjeplURL": "https://www.wakacje.pl/wczasy/egipt?str-3,7-dni,do-3990zl,samolotem,3-gwiazdkowe,ocena-8,za-osobe",
            "hotel": "Three Corners Sea Beach",
            "location": "Egipt / Marsa El Alam",
            "date": "20.01.2026- 28.01.2026",
            "formated_date": "2026-01-20",
            "price_per_person": "2031",
            "image_url": "https://i.wakacje.pl/no-index/hotel/pickalbatros-sands-port-ghalib-ex-red-sea-siva-sands-teren-hotelu-1595100053-343-228.jpg",
            "offer_url": "https://www.wakacje.pl/oferty/egipt/marsa-el-alam/three-corners-sea-beach-910366.html?-od-2026-01-20,7-dni,all-inclusive&utm_source=travellead&utm_medium=cps&utm_campaign=1656-vacccation.com&a_aid=1656&chan=code5",
            "short_url": "https://is.gd/88iIwU",
            "airport": "Katowice, Warszawa, Poznań",
            "likes": 1094,
            "star_rating": "czterogwiazdkowy",
            "food": "All Inclusive"
        },
        {
            "page": 3,
            "wakacjeplURL": "https://www.wakacje.pl/wczasy/egipt?str-3,7-dni,do-3990zl,samolotem,3-gwiazdkowe,ocena-8,za-osobe",
            "hotel": "Gravity Sahl Hasheesh (Ex. Ocean Breeze)",
            "location": "Egipt / Hurghada",
            "date": "11.01.2026- 18.01.2026",
            "formated_date": "2026-01-11",
            "price_per_person": "2826",
            "image_url": "https://i.wakacje.pl/no-index/hotel/pickalbatros-sands-port-ghalib-ex-red-sea-siva-sands-plaza-1595081917-343-228.jpg",
            "offer_url": "https://www.wakacje.pl/oferty/egipt/hurghada/hurghada/gravity-sahl-hasheesh-ex-ocean-breeze-550585.html?-od-2026-01-11,7-dni,all-inclusive&utm_source=travellead&utm_medium=cps&utm_campaign=1656-vacccation.com&a_aid=1656&chan=code5",
            "short_url": "https://is.gd/FLvvcn",
            "airport": "Warszawa, Gdańsk, Katowice",
            "likes": 1752,
            "star_rating": "pięciogwiazdkowy",
            "food": "All Inclusive"
        },
        {
            "page": 3,
            "wakacjeplURL": "https://www.wakacje.pl/wczasy/egipt?str-3,7-dni,do-3990zl,samolotem,3-gwiazdkowe,ocena-8,za-osobe",
            "hotel": "Albatros Palace Port Ghalib (ex. Red Sea The Palace)",
            "location": "Egipt / Marsa El Alam / Port Ghalib",
            "date": "24.03.2026- 31.03.2026",
            "formated_date": "2026-03-24",
            "price_per_person": "3599",
            "image_url": "https://i.wakacje.pl/no-index/hotel/pickalbatros-sands-port-ghalib-ex-red-sea-siva-sands-teren-hotelu-1595100054-343-228.jpg",
            "offer_url": "https://www.wakacje.pl/oferty/egipt/marsa-el-alam/port-ghalib/albatros-palace-port-ghalib-ex-red-sea-the-palace-708540.html?-od-2026-03-24,7-dni,all-inclusive&utm_source=travellead&utm_medium=cps&utm_campaign=1656-vacccation.com&a_aid=1656&chan=code5",
            "short_url": "https://is.gd/hsKohh",
            "airport": "Katowice, Warszawa, Rzeszów",
            "likes": 489,
            "star_rating": "pięciogwiazdkowy",
            "food": "All Inclusive"
        },
        {
            "page": 3,
            "wakacjeplURL": "https://www.wakacje.pl/wczasy/egipt?str-3,7-dni,do-3990zl,samolotem,3-gwiazdkowe,ocena-8,za-osobe",
            "hotel": "Sataya Resort (ex. Labranda Sataya Marsa Alam)",
            "location": "Egipt / Marsa El Alam / Port Ghalib",
            "date": "10.01.2026- 17.01.2026",
            "formated_date": "2026-01-10",
            "price_per_person": "2429",
            "image_url": "https://i.wakacje.pl/no-index/hotel/pickalbatros-sands-port-ghalib-ex-red-sea-siva-sands-pokoj-1595100122-343-228.jpg",
            "offer_url": "https://www.wakacje.pl/oferty/egipt/marsa-el-alam/port-ghalib/sataya-resort-ex-labranda-sataya-marsa-alam-665425.html?-od-2026-01-10,7-dni,all-inclusive&utm_source=travellead&utm_medium=cps&utm_campaign=1656-vacccation.com&a_aid=1656&chan=code5",
            "short_url": "https://is.gd/SGgxSv",
            "airport": "Warszawa, Katowice, Poznań",
            "likes": 1341,
            "star_rating": "pięciogwiazdkowy",
            "food": "All Inclusive"
        },
        {
            "page": 3,
            "wakacjeplURL": "https://www.wakacje.pl/wczasy/egipt?str-3,7-dni,do-3990zl,samolotem,3-gwiazdkowe,ocena-8,za-osobe",
            "hotel": "Jaz Aquamarine (ex. Iberotel Aquamarine)",
            "location": "Egipt / Hurghada",
            "date": "10.01.2026- 17.01.2026",
            "formated_date": "2026-01-10",
            "price_per_person": "2731",
            "image_url": "https://i.wakacje.pl/no-index/hotel/pickalbatros-sands-port-ghalib-ex-red-sea-siva-sands-obiekt-1595081943-343-228.jpg",
            "offer_url": "https://www.wakacje.pl/oferty/egipt/hurghada/hurghada/jaz-aquamarine-ex-iberotel-aquamarine-910415.html?-od-2026-01-10,7-dni,all-inclusive&utm_source=travellead&utm_medium=cps&utm_campaign=1656-vacccation.com&a_aid=1656&chan=code5",
            "short_url": "https://is.gd/TybpsN",
            "airport": "Katowice, Warszawa, Wrocław",
            "likes": 107,
            "star_rating": "pięciogwiazdkowy",
            "food": "All Inclusive"
        },
        {
            "page": 3,
            "wakacjeplURL": "https://www.wakacje.pl/wczasy/egipt?str-3,7-dni,do-3990zl,samolotem,3-gwiazdkowe,ocena-8,za-osobe",
            "hotel": "Jaz Aquamarine (ex. Iberotel Aquamarine)",
            "location": "Egipt / Hurghada",
            "date": "15.01.2026- 22.01.2026",
            "formated_date": "2026-01-15",
            "price_per_person": "2868",
            "image_url": "https://i.wakacje.pl/no-index/hotel/pickalbatros-sands-port-ghalib-ex-red-sea-siva-sands-obiekt-1595100056-343-228.jpg",
            "offer_url": "https://www.wakacje.pl/oferty/egipt/hurghada/hurghada/jaz-aquamarine-ex-iberotel-aquamarine-12693.html?-od-2026-01-15,7-dni,all-inclusive&utm_source=travellead&utm_medium=cps&utm_campaign=1656-vacccation.com&a_aid=1656&chan=code5",
            "short_url": "https://is.gd/dOaIQb",
            "airport": "Katowice, Warszawa, Gdańsk",
            "likes": 1790,
            "star_rating": "pięciogwiazdkowy",
            "food": "All Inclusive"
        },
        {
            "page": 3,
            "wakacjeplURL": "https://www.wakacje.pl/wczasy/egipt?str-3,7-dni,do-3990zl,samolotem,3-gwiazdkowe,ocena-8,za-osobe",
            "hotel": "Long Beach Resort (ex Hilton Long Beach)",
            "location": "Egipt / Hurghada",
            "date": "08.01.2026- 15.01.2026",
            "formated_date": "2026-01-08",
            "price_per_person": "2304",
            "image_url": "https://i.wakacje.pl/no-index/hotel/pickalbatros-sands-port-ghalib-ex-red-sea-siva-sands-obiekt-1595081945-343-228.jpg",
            "offer_url": "https://www.wakacje.pl/oferty/egipt/hurghada/hurghada/long-beach-resort-ex-hilton-long-beach-180566.html?-od-2026-01-08,7-dni,all-inclusive&utm_source=travellead&utm_medium=cps&utm_campaign=1656-vacccation.com&a_aid=1656&chan=code5",
            "short_url": "https://is.gd/spL9KZ",
            "airport": "Warszawa, Gdańsk, Katowice",
            "likes": 2379,
            "star_rating": "czterogwiazdkowy",
            "food": "All Inclusive"
        },
        {
            "page": 3,
            "wakacjeplURL": "https://www.wakacje.pl/wczasy/egipt?str-3,7-dni,do-3990zl,samolotem,3-gwiazdkowe,ocena-8,za-osobe",
            "hotel": "Pickalbatros Portofino Marsa Alam",
            "location": "Egipt / Marsa El Alam",
            "date": "10.01.2026- 18.01.2026",
            "formated_date": "2026-01-10",
            "price_per_person": "2628",
            "image_url": "https://i.wakacje.pl/no-index/hotel/pickalbatros-sands-port-ghalib-ex-red-sea-siva-sands-pokoj-1595100090-343-228.jpg",
            "offer_url": "https://www.wakacje.pl/oferty/egipt/marsa-el-alam/pickalbatros-portofino-marsa-alam-776034.html?-od-2026-01-10,7-dni,all-inclusive&utm_source=travellead&utm_medium=cps&utm_campaign=1656-vacccation.com&a_aid=1656&chan=code5",
            "short_url": "https://is.gd/PhAyQd",
            "airport": "Warszawa, Katowice, Poznań",
            "likes": 803,
            "star_rating": "czterogwiazdkowy",
            "food": "All Inclusive"
        },
        {
            "page": 3,
            "wakacjeplURL": "https://www.wakacje.pl/wczasy/egipt?str-3,7-dni,do-3990zl,samolotem,3-gwiazdkowe,ocena-8,za-osobe",
            "hotel": "Hilton Marsa Alam Nubian Resort",
            "location": "Egipt / Marsa El Alam",
            "date": "13.01.2026- 20.01.2026",
            "formated_date": "2026-01-13",
            "price_per_person": "2668",
            "image_url": "https://i.wakacje.pl/no-index/hotel/pickalbatros-sands-port-ghalib-ex-red-sea-siva-sands-pokoj-1595100094-343-228.jpg",
            "offer_url": "https://www.wakacje.pl/oferty/egipt/marsa-el-alam/hilton-marsa-alam-nubian-resort-259156.html?-od-2026-01-13,7-dni,all-inclusive&utm_source=travellead&utm_medium=cps&utm_campaign=1656-vacccation.com&a_aid=1656&chan=code5",
            "short_url": "https://is.gd/3Izmxe",
            "airport": "Katowice, Warszawa, Rzeszów",
            "likes": 594,
            "star_rating": "pięciogwiazdkowy",
            "food": "All Inclusive"
        },
        {
            "page": 4,
            "wakacjeplURL": "https://www.wakacje.pl/wczasy/egipt?str-4,7-dni,do-3990zl,samolotem,3-gwiazdkowe,ocena-8,za-osobe",
            "hotel": "Jaz Lamaya Resort (ex Iberotel)",
            "location": "Egipt / Marsa El Alam / Madinat Coraya",
            "date": "13.01.2026- 20.01.2026",
            "formated_date": "2026-01-13",
            "price_per_person": "3033",
            "image_url": "https://i.wakacje.pl/no-index/hotel/jaz-lamaya-resort-ex-iberotel-basen-1488480975-343-228.jpg",
            "offer_url": "https://www.wakacje.pl/oferty/egipt/marsa-el-alam/madinat-coraya/jaz-lamaya-resort-ex-iberotel-351089.html?-od-2026-01-13,7-dni,all-inclusive&utm_source=travellead&utm_medium=cps&utm_campaign=1656-vacccation.com&a_aid=1656&chan=code5",
            "short_url": "https://is.gd/LmepQh",
            "airport": "Katowice, Warszawa, Rzeszów",
            "likes": 1215,
            "star_rating": "pięciogwiazdkowy",
            "food": "All Inclusive"
        },
        {
            "page": 4,
            "wakacjeplURL": "https://www.wakacje.pl/wczasy/egipt?str-4,7-dni,do-3990zl,samolotem,3-gwiazdkowe,ocena-8,za-osobe",
            "hotel": "Pickalbatros Royal Moderna",
            "location": "Egipt / Sharm el Sheikh",
            "date": "11.01.2026- 18.01.2026",
            "formated_date": "2026-01-11",
            "price_per_person": "2297",
            "image_url": "https://i.wakacje.pl/no-index/hotel/jaz-lamaya-resort-ex-iberotel-basen-1488480896-343-228.jpg",
            "offer_url": "https://www.wakacje.pl/oferty/egipt/sharm-el-sheikh/pickalbatros-royal-moderna-876998.html?-od-2026-01-11,7-dni,all-inclusive&utm_source=travellead&utm_medium=cps&utm_campaign=1656-vacccation.com&a_aid=1656&chan=code5",
            "short_url": "https://is.gd/uEt3T8",
            "airport": "Katowice, Warszawa, Wrocław",
            "likes": 1456,
            "star_rating": "pięciogwiazdkowy",
            "food": "All Inclusive"
        },
        {
            "page": 4,
            "wakacjeplURL": "https://www.wakacje.pl/wczasy/egipt?str-4,7-dni,do-3990zl,samolotem,3-gwiazdkowe,ocena-8,za-osobe",
            "hotel": "Albatros Sea World Resort Marsa Alam",
            "location": "Egipt / Marsa El Alam / Al-Kusajr",
            "date": "17.01.2026- 24.01.2026",
            "formated_date": "2026-01-17",
            "price_per_person": "2347",
            "image_url": "https://i.wakacje.pl/no-index/hotel/jaz-lamaya-resort-ex-iberotel-aquapark-646026517-343-228.jpg",
            "offer_url": "https://www.wakacje.pl/oferty/egipt/marsa-el-alam/al-kusajr/albatros-sea-world-resort-marsa-alam-498417.html?-od-2026-01-17,7-dni,all-inclusive&utm_source=travellead&utm_medium=cps&utm_campaign=1656-vacccation.com&a_aid=1656&chan=code5",
            "short_url": "https://is.gd/gRAv4u",
            "airport": "Warszawa, Katowice, Poznań",
            "likes": 358,
            "star_rating": "pięciogwiazdkowy",
            "food": "All Inclusive"
        },
        {
            "page": 4,
            "wakacjeplURL": "https://www.wakacje.pl/wczasy/egipt?str-4,7-dni,do-3990zl,samolotem,3-gwiazdkowe,ocena-8,za-osobe",
            "hotel": "Stella Gardens Resort & Spa (ex Stella Di Mare Gardens)",
            "location": "Egipt / Hurghada / Makadi Bay",
            "date": "06.01.2026- 13.01.2026",
            "formated_date": "2026-01-06",
            "price_per_person": "1844",
            "image_url": "https://i.wakacje.pl/no-index/hotel/jaz-lamaya-resort-ex-iberotel-basen-1488480849-343-228.jpg",
            "offer_url": "https://www.wakacje.pl/oferty/egipt/hurghada/makadi-bay/stella-gardens-resort-spa-ex-stella-di-mare-gardens-910357.html?-od-2026-01-06,7-dni,all-inclusive&utm_source=travellead&utm_medium=cps&utm_campaign=1656-vacccation.com&a_aid=1656&chan=code5",
            "short_url": "https://is.gd/TNQ6bn",
            "airport": "Katowice, Warszawa, Wrocław",
            "likes": 234,
            "star_rating": "pięciogwiazdkowy",
            "food": "All Inclusive"
        },
        {
            "page": 4,
            "wakacjeplURL": "https://www.wakacje.pl/wczasy/egipt?str-4,7-dni,do-3990zl,samolotem,3-gwiazdkowe,ocena-8,za-osobe",
            "hotel": "Palm Beach Resort (Hurghada)",
            "location": "Egipt / Hurghada",
            "date": "29.01.2026- 05.02.2026",
            "formated_date": "2026-01-29",
            "price_per_person": "2466",
            "image_url": "https://i.wakacje.pl/no-index/hotel/jaz-lamaya-resort-ex-iberotel-aquapark-646025740-343-228.jpg",
            "offer_url": "https://www.wakacje.pl/oferty/egipt/hurghada/hurghada/palm-beach-resort-hurghada-784993.html?-od-2026-01-29,7-dni,all-inclusive&utm_source=travellead&utm_medium=cps&utm_campaign=1656-vacccation.com&a_aid=1656&chan=code5",
            "short_url": "https://is.gd/2v7qjP",
            "airport": "Katowice, Warszawa, Poznań",
            "likes": 2261,
            "star_rating": "czterogwiazdkowy",
            "food": "All Inclusive"
        },
        {
            "page": 4,
            "wakacjeplURL": "https://www.wakacje.pl/wczasy/egipt?str-4,7-dni,do-3990zl,samolotem,3-gwiazdkowe,ocena-8,za-osobe",
            "hotel": "Casa Mare Resort (ex. Royal Tulip Beach Resort)",
            "location": "Egipt / Marsa El Alam / Port Ghalib",
            "date": "06.01.2026- 13.01.2026",
            "formated_date": "2026-01-06",
            "price_per_person": "1929",
            "image_url": "https://i.wakacje.pl/no-index/hotel/jaz-lamaya-resort-ex-iberotel-teren-hotelu-809220048-343-228.jpg",
            "offer_url": "https://www.wakacje.pl/oferty/egipt/marsa-el-alam/port-ghalib/casa-mare-resort-ex-royal-tulip-beach-resort-412351.html?-od-2026-01-06,7-dni,all-inclusive&utm_source=travellead&utm_medium=cps&utm_campaign=1656-vacccation.com&a_aid=1656&chan=code5",
            "short_url": "https://is.gd/V3x0s7",
            "airport": "Gdańsk, Katowice, Poznań",
            "likes": 2278,
            "star_rating": "pięciogwiazdkowy",
            "food": "All Inclusive"
        },
        {
            "page": 4,
            "wakacjeplURL": "https://www.wakacje.pl/wczasy/egipt?str-4,7-dni,do-3990zl,samolotem,3-gwiazdkowe,ocena-8,za-osobe",
            "hotel": "Reef Oasis Suakin Resort",
            "location": "Egipt / Marsa El Alam",
            "date": "09.01.2026- 16.01.2026",
            "formated_date": "2026-01-09",
            "price_per_person": "2728",
            "image_url": "https://i.wakacje.pl/no-index/hotel/jaz-lamaya-resort-ex-iberotel-teren-hotelu-826769957-343-228.jpg",
            "offer_url": "https://www.wakacje.pl/oferty/egipt/marsa-el-alam/reef-oasis-suakin-resort-810970.html?-od-2026-01-09,7-dni,all-inclusive&utm_source=travellead&utm_medium=cps&utm_campaign=1656-vacccation.com&a_aid=1656&chan=code5",
            "short_url": "https://is.gd/159o8O",
            "airport": "Gdańsk, Katowice, Poznań",
            "likes": 1121,
            "star_rating": "pięciogwiazdkowy",
            "food": "All Inclusive"
        },
        {
            "page": 4,
            "wakacjeplURL": "https://www.wakacje.pl/wczasy/egipt?str-4,7-dni,do-3990zl,samolotem,3-gwiazdkowe,ocena-8,za-osobe",
            "hotel": "Pickalbatros Jungle Aqua Park by Neverland",
            "location": "Egipt / Hurghada",
            "date": "29.01.2026- 05.02.2026",
            "formated_date": "2026-01-29",
            "price_per_person": "3728",
            "image_url": "https://i.wakacje.pl/no-index/hotel/jaz-lamaya-resort-ex-iberotel-teren-hotelu-964587091-343-228.jpg",
            "offer_url": "https://www.wakacje.pl/oferty/egipt/hurghada/hurghada/pickalbatros-jungle-aqua-park-by-neverland-296427.html?-od-2026-01-29,7-dni,all-inclusive&utm_source=travellead&utm_medium=cps&utm_campaign=1656-vacccation.com&a_aid=1656&chan=code5",
            "short_url": "https://is.gd/oqIJxH",
            "airport": "Warszawa, Katowice, Poznań",
            "likes": 778,
            "star_rating": "czteroipółgwiazdkowy",
            "food": "All Inclusive"
        },
        {
            "page": 4,
            "wakacjeplURL": "https://www.wakacje.pl/wczasy/egipt?str-4,7-dni,do-3990zl,samolotem,3-gwiazdkowe,ocena-8,za-osobe",
            "hotel": "Mercure Hurghada (ex. Sofitel)",
            "location": "Egipt / Hurghada",
            "date": "11.01.2026- 18.01.2026",
            "formated_date": "2026-01-11",
            "price_per_person": "2579",
            "image_url": "https://i.wakacje.pl/no-index/hotel/jaz-lamaya-resort-ex-iberotel-teren-hotelu-1762566262-343-228.jpg",
            "offer_url": "https://www.wakacje.pl/oferty/egipt/hurghada/hurghada/mercure-hurghada-ex-sofitel-673277.html?-od-2026-01-11,7-dni,all-inclusive&utm_source=travellead&utm_medium=cps&utm_campaign=1656-vacccation.com&a_aid=1656&chan=code5",
            "short_url": "https://is.gd/cwH1fa",
            "airport": "Warszawa, Katowice, Poznań",
            "likes": 923,
            "star_rating": "czterogwiazdkowy",
            "food": "All Inclusive"
        },
        {
            "page": 4,
            "wakacjeplURL": "https://www.wakacje.pl/wczasy/egipt?str-4,7-dni,do-3990zl,samolotem,3-gwiazdkowe,ocena-8,za-osobe",
            "hotel": "Sea Gull Beach Resort (Hurghada)",
            "location": "Egipt / Hurghada",
            "date": "11.01.2026- 18.01.2026",
            "formated_date": "2026-01-11",
            "price_per_person": "2340",
            "image_url": "https://i.wakacje.pl/no-index/hotel/jaz-lamaya-resort-ex-iberotel-recepcja-lobby-1762566260-343-228.jpg",
            "offer_url": "https://www.wakacje.pl/oferty/egipt/hurghada/hurghada/sea-gull-beach-resort-hurghada-17600.html?-od-2026-01-11,7-dni,all-inclusive&utm_source=travellead&utm_medium=cps&utm_campaign=1656-vacccation.com&a_aid=1656&chan=code5",
            "short_url": "https://is.gd/AGytjL",
            "airport": "Katowice, Warszawa, Gdańsk",
            "likes": 1904,
            "star_rating": "czterogwiazdkowy",
            "food": "All Inclusive"
        },
        {
            "page": 5,
            "wakacjeplURL": "https://www.wakacje.pl/wczasy/egipt?str-5,7-dni,do-3990zl,samolotem,3-gwiazdkowe,ocena-8,za-osobe",
            "hotel": "Pickalbatros Laguna Vista Beach",
            "location": "Egipt / Sharm el Sheikh",
            "date": "11.01.2026- 18.01.2026",
            "formated_date": "2026-01-11",
            "price_per_person": "2445",
            "image_url": "https://i.wakacje.pl/no-index/hotel/pickalbatros-laguna-vista-beach-teren-hotelu-1581761134-343-228.jpg",
            "offer_url": "https://www.wakacje.pl/oferty/egipt/sharm-el-sheikh/pickalbatros-laguna-vista-beach-876996.html?-od-2026-01-11,7-dni,all-inclusive&utm_source=travellead&utm_medium=cps&utm_campaign=1656-vacccation.com&a_aid=1656&chan=code5",
            "short_url": "https://is.gd/AgcTfj",
            "airport": "Katowice, Warszawa, Wrocław",
            "likes": 1288,
            "star_rating": "pięciogwiazdkowy",
            "food": "All Inclusive"
        },
        {
            "page": 5,
            "wakacjeplURL": "https://www.wakacje.pl/wczasy/egipt?str-5,7-dni,do-3990zl,samolotem,3-gwiazdkowe,ocena-8,za-osobe",
            "hotel": "Calimera Blend Paradise",
            "location": "Egipt / Hurghada",
            "date": "08.01.2026- 16.01.2026",
            "formated_date": "2026-01-08",
            "price_per_person": "2229",
            "image_url": "https://i.wakacje.pl/no-index/hotel/pickalbatros-laguna-vista-beach-basen-1581761224-343-228.jpg",
            "offer_url": "https://www.wakacje.pl/oferty/egipt/hurghada/hurghada/calimera-blend-paradise-733939.html?-od-2026-01-08,7-dni,all-inclusive&utm_source=travellead&utm_medium=cps&utm_campaign=1656-vacccation.com&a_aid=1656&chan=code5",
            "short_url": "https://is.gd/Y9RIzM",
            "airport": "Gdańsk, Katowice, Poznań",
            "likes": 286,
            "star_rating": "pięciogwiazdkowy",
            "food": "All Inclusive"
        },
        {
            "page": 5,
            "wakacjeplURL": "https://www.wakacje.pl/wczasy/egipt?str-5,7-dni,do-3990zl,samolotem,3-gwiazdkowe,ocena-8,za-osobe",
            "hotel": "Jaz Elite Casa Del Mar Beach (ex. Grand Plaza)",
            "location": "Egipt / Hurghada",
            "date": "08.01.2026- 15.01.2026",
            "formated_date": "2026-01-08",
            "price_per_person": "3750",
            "image_url": "https://i.wakacje.pl/no-index/hotel/pickalbatros-laguna-vista-beach-basen-1581761138-343-228.jpg",
            "offer_url": "https://www.wakacje.pl/oferty/egipt/hurghada/hurghada/jaz-elite-casa-del-mar-beach-ex-grand-plaza-665084.html?-od-2026-01-08,7-dni,all-inclusive&utm_source=travellead&utm_medium=cps&utm_campaign=1656-vacccation.com&a_aid=1656&chan=code5",
            "short_url": "https://is.gd/QvTEOe",
            "airport": "Warszawa, Gdańsk, Katowice",
            "likes": 1990,
            "star_rating": "pięciogwiazdkowy",
            "food": "All Inclusive"
        },
        {
            "page": 5,
            "wakacjeplURL": "https://www.wakacje.pl/wczasy/egipt?str-5,7-dni,do-3990zl,samolotem,3-gwiazdkowe,ocena-8,za-osobe",
            "hotel": "Hilton Marsa Alam Nubian Resort",
            "location": "Egipt / Marsa El Alam",
            "date": "13.01.2026- 20.01.2026",
            "formated_date": "2026-01-13",
            "price_per_person": "2266",
            "image_url": "https://i.wakacje.pl/no-index/hotel/pickalbatros-laguna-vista-beach-teren-hotelu-1581761099-343-228.jpg",
            "offer_url": "https://www.wakacje.pl/oferty/egipt/marsa-el-alam/hilton-marsa-alam-nubian-resort-910396.html?-od-2026-01-13,7-dni,all-inclusive&utm_source=travellead&utm_medium=cps&utm_campaign=1656-vacccation.com&a_aid=1656&chan=code5",
            "short_url": "https://is.gd/XLhKoz",
            "airport": "Katowice, Warszawa, Poznań",
            "likes": 714,
            "star_rating": "pięciogwiazdkowy",
            "food": "All Inclusive"
        },
        {
            "page": 5,
            "wakacjeplURL": "https://www.wakacje.pl/wczasy/egipt?str-5,7-dni,do-3990zl,samolotem,3-gwiazdkowe,ocena-8,za-osobe",
            "hotel": "Calimera Blend Paradise",
            "location": "Egipt / Hurghada",
            "date": "08.01.2026- 15.01.2026",
            "formated_date": "2026-01-08",
            "price_per_person": "2001",
            "image_url": "https://i.wakacje.pl/no-index/hotel/pickalbatros-laguna-vista-beach-basen-1581761004-343-228.jpg",
            "offer_url": "https://www.wakacje.pl/oferty/egipt/hurghada/hurghada/calimera-blend-paradise-1076792.html?-od-2026-01-08,7-dni,all-inclusive&utm_source=travellead&utm_medium=cps&utm_campaign=1656-vacccation.com&a_aid=1656&chan=code5",
            "short_url": "https://is.gd/32aHT9L",
            "airport": "Poznań, Wrocław, Lublin",
            "likes": 1900,
            "star_rating": "pięciogwiazdkowy",
            "food": "All Inclusive"
        },
        {
            "page": 5,
            "wakacjeplURL": "https://www.wakacje.pl/wczasy/egipt?str-5,7-dni,do-3990zl,samolotem,3-gwiazdkowe,ocena-8,za-osobe",
            "hotel": "Jaz Mirabel Park",
            "location": "Egipt / Sharm el Sheikh",
            "date": "08.01.2026- 15.01.2026",
            "formated_date": "2026-01-08",
            "price_per_person": "1951",
            "image_url": "https://i.wakacje.pl/no-index/hotel/pickalbatros-laguna-vista-beach-basen-1581761139-343-228.jpg",
            "offer_url": "https://www.wakacje.pl/oferty/egipt/sharm-el-sheikh/jaz-mirabel-park-1053498.html?-od-2026-01-08,7-dni,all-inclusive&utm_source=travellead&utm_medium=cps&utm_campaign=1656-vacccation.com&a_aid=1656&chan=code5",
            "short_url": "https://is.gd/rSo5Kv",
            "airport": "Katowice, Warszawa, Wrocław",
            "likes": 1562,
            "star_rating": "pięciogwiazdkowy",
            "food": "All Inclusive"
        },
        {
            "page": 5,
            "wakacjeplURL": "https://www.wakacje.pl/wczasy/egipt?str-5,7-dni,do-3990zl,samolotem,3-gwiazdkowe,ocena-8,za-osobe",
            "hotel": "Bellagio Beach Resort & Spa (ex. Panorama Bungalows Hurghada)",
            "location": "Egipt / Hurghada",
            "date": "14.01.2026- 21.01.2026",
            "formated_date": "2026-01-14",
            "price_per_person": "2279",
            "image_url": "https://i.wakacje.pl/no-index/hotel/pickalbatros-laguna-vista-beach-recepcja-lobby-1581761116-343-228.jpg",
            "offer_url": "https://www.wakacje.pl/oferty/egipt/hurghada/hurghada/bellagio-beach-resort-spa-ex-panorama-bungalows-hurghada-909550.html?-od-2026-01-14,7-dni,all-inclusive&utm_source=travellead&utm_medium=cps&utm_campaign=1656-vacccation.com&a_aid=1656&chan=code5",
            "short_url": "https://is.gd/r7GSnh",
            "airport": "Katowice, Warszawa, Wrocław",
            "likes": 2455,
            "star_rating": "pięciogwiazdkowy",
            "food": "All Inclusive"
        },
        {
            "page": 5,
            "wakacjeplURL": "https://www.wakacje.pl/wczasy/egipt?str-5,7-dni,do-3990zl,samolotem,3-gwiazdkowe,ocena-8,za-osobe",
            "hotel": "Sirena Beach Resort & Spa",
            "location": "Egipt / Marsa El Alam / Al-Kusajr",
            "date": "13.01.2026- 20.01.2026",
            "formated_date": "2026-01-13",
            "price_per_person": "2451",
            "image_url": "https://i.wakacje.pl/no-index/hotel/pickalbatros-laguna-vista-beach-pokoj-1581761064-343-228.jpg",
            "offer_url": "https://www.wakacje.pl/oferty/egipt/marsa-el-alam/al-kusajr/sirena-beach-resort-spa-813153.html?-od-2026-01-13,7-dni,all-inclusive&utm_source=travellead&utm_medium=cps&utm_campaign=1656-vacccation.com&a_aid=1656&chan=code5",
            "short_url": "https://is.gd/nruTct",
            "airport": "Katowice, Warszawa, Rzeszów",
            "likes": 419,
            "star_rating": "pięciogwiazdkowy",
            "food": "All Inclusive"
        },
        {
            "page": 5,
            "wakacjeplURL": "https://www.wakacje.pl/wczasy/egipt?str-5,7-dni,do-3990zl,samolotem,3-gwiazdkowe,ocena-8,za-osobe",
            "hotel": "Sunrise Anjum Resort",
            "location": "Egipt / Marsa El Alam",
            "date": "13.01.2026- 20.01.2026",
            "formated_date": "2026-01-13",
            "price_per_person": "3442",
            "image_url": "https://i.wakacje.pl/no-index/hotel/pickalbatros-laguna-vista-beach-pokoj-1581761100-343-228.jpg",
            "offer_url": "https://www.wakacje.pl/oferty/egipt/marsa-el-alam/sunrise-anjum-resort-893480.html?-od-2026-01-13,7-dni,all-inclusive&utm_source=travellead&utm_medium=cps&utm_campaign=1656-vacccation.com&a_aid=1656&chan=code5",
            "short_url": "https://is.gd/a7RGvf",
            "airport": "Katowice, Warszawa, Rzeszów",
            "likes": 2108,
            "star_rating": "pięciogwiazdkowy",
            "food": "All Inclusive"
        },
        {
            "page": 5,
            "wakacjeplURL": "https://www.wakacje.pl/wczasy/egipt?str-5,7-dni,do-3990zl,samolotem,3-gwiazdkowe,ocena-8,za-osobe",
            "hotel": "Three Corners Equinox Beach",
            "location": "Egipt / Marsa El Alam",
            "date": "10.01.2026- 17.01.2026",
            "formated_date": "2026-01-10",
            "price_per_person": "2500",
            "image_url": "https://i.wakacje.pl/no-index/hotel/pickalbatros-laguna-vista-beach-pokoj-1581761217-343-228.jpg",
            "offer_url": "https://www.wakacje.pl/oferty/egipt/marsa-el-alam/three-corners-equinox-beach-259185.html?-od-2026-01-10,7-dni,all-inclusive&utm_source=travellead&utm_medium=cps&utm_campaign=1656-vacccation.com&a_aid=1656&chan=code5",
            "short_url": "https://is.gd/vYKGbY",
            "airport": "Warszawa, Gdańsk, Katowice",
            "likes": 1387,
            "star_rating": "czteroipółgwiazdkowy",
            "food": "All Inclusive"
        },
        {
            "page": 6,
            "wakacjeplURL": "https://www.wakacje.pl/wczasy/egipt?str-6,7-dni,do-3990zl,samolotem,3-gwiazdkowe,ocena-8,za-osobe",
            "hotel": "Rewaya Majestic Resort",
            "location": "Egipt / Hurghada",
            "date": "11.01.2026- 18.01.2026",
            "formated_date": "2026-01-11",
            "price_per_person": "2490",
            "image_url": "https://i.wakacje.pl/no-index/hotel/rewaya-majestic-resort-basen-teren-hotelu-obiekt-1777145318-343-228.jpg",
            "offer_url": "https://www.wakacje.pl/oferty/egipt/hurghada/hurghada/rewaya-majestic-resort-1032876.html?-od-2026-01-11,7-dni,all-inclusive&utm_source=travellead&utm_medium=cps&utm_campaign=1656-vacccation.com&a_aid=1656&chan=code5",
            "short_url": "https://is.gd/viHV8k",
            "airport": "Katowice, Warszawa, Gdańsk",
            "likes": 1929,
            "star_rating": "pięciogwiazdkowy",
            "food": "All Inclusive"
        },
        {
            "page": 6,
            "wakacjeplURL": "https://www.wakacje.pl/wczasy/egipt?str-6,7-dni,do-3990zl,samolotem,3-gwiazdkowe,ocena-8,za-osobe",
            "hotel": "Pickalbatros Royal Moderna",
            "location": "Egipt / Sharm el Sheikh",
            "date": "06.01.2026- 13.01.2026",
            "formated_date": "2026-01-06",
            "price_per_person": "2549",
            "image_url": "https://i.wakacje.pl/no-index/hotel/rewaya-majestic-resort-plaza-teren-hotelu-obiekt-1777145319-343-228.jpg",
            "offer_url": "https://www.wakacje.pl/oferty/egipt/sharm-el-sheikh/pickalbatros-royal-moderna-419804.html?-od-2026-01-06,7-dni,all-inclusive&utm_source=travellead&utm_medium=cps&utm_campaign=1656-vacccation.com&a_aid=1656&chan=code5",
            "short_url": "https://is.gd/lzfHo6",
            "airport": "Katowice, Warszawa",
            "likes": 1066,
            "star_rating": "pięciogwiazdkowy",
            "food": "All Inclusive"
        },
        {
            "page": 6,
            "wakacjeplURL": "https://www.wakacje.pl/wczasy/egipt?str-6,7-dni,do-3990zl,samolotem,3-gwiazdkowe,ocena-8,za-osobe",
            "hotel": "Jaz Elite Amara",
            "location": "Egipt / Marsa El Alam / Port Ghalib",
            "date": "06.01.2026- 13.01.2026",
            "formated_date": "2026-01-06",
            "price_per_person": "3833",
            "image_url": "https://i.wakacje.pl/no-index/hotel/rewaya-majestic-resort-basen-teren-hotelu-obiekt-1777145320-343-228.jpg",
            "offer_url": "https://www.wakacje.pl/oferty/egipt/marsa-el-alam/port-ghalib/jaz-elite-amara-910414.html?-od-2026-01-06,7-dni,all-inclusive&utm_source=travellead&utm_medium=cps&utm_campaign=1656-vacccation.com&a_aid=1656&chan=code5",
            "short_url": "https://is.gd/QCB3vN",
            "airport": "Katowice, Warszawa, Poznań",
            "likes": 130,
            "star_rating": "pięciogwiazdkowy",
            "food": "All Inclusive"
        },
        {
            "page": 6,
            "wakacjeplURL": "https://www.wakacje.pl/wczasy/egipt?str-6,7-dni,do-3990zl,samolotem,3-gwiazdkowe,ocena-8,za-osobe",
            "hotel": "Jaz Aquamarine (ex. Iberotel Aquamarine)",
            "location": "Egipt / Hurghada",
            "date": "08.01.2026- 15.01.2026",
            "formated_date": "2026-01-08",
            "price_per_person": "2840",
            "image_url": "https://i.wakacje.pl/no-index/hotel/rewaya-majestic-resort-basen-teren-hotelu-obiekt-1777145321-343-228.jpg",
            "offer_url": "https://www.wakacje.pl/oferty/egipt/hurghada/hurghada/jaz-aquamarine-ex-iberotel-aquamarine-757168.html?-od-2026-01-08,7-dni,all-inclusive&utm_source=travellead&utm_medium=cps&utm_campaign=1656-vacccation.com&a_aid=1656&chan=code5",
            "short_url": "https://is.gd/P4QGyv",
            "airport": "Katowice, Warszawa, Poznań",
            "likes": 229,
            "star_rating": "pięciogwiazdkowy",
            "food": "All Inclusive"
        },
        {
            "page": 6,
            "wakacjeplURL": "https://www.wakacje.pl/wczasy/egipt?str-6,7-dni,do-3990zl,samolotem,3-gwiazdkowe,ocena-8,za-osobe",
            "hotel": "Pickalbatros Jungle Aqua Park by Neverland",
            "location": "Egipt / Hurghada",
            "date": "11.01.2026- 18.01.2026",
            "formated_date": "2026-01-11",
            "price_per_person": "2494",
            "image_url": "https://i.wakacje.pl/no-index/hotel/rewaya-majestic-resort-basen-teren-hotelu-obiekt-1777145322-343-228.jpg",
            "offer_url": "https://www.wakacje.pl/oferty/egipt/hurghada/hurghada/pickalbatros-jungle-aqua-park-by-neverland-406360.html?-od-2026-01-11,7-dni,all-inclusive&utm_source=travellead&utm_medium=cps&utm_campaign=1656-vacccation.com&a_aid=1656&chan=code5",
            "short_url": "https://is.gd/Nl3VxM",
            "airport": "Katowice, Warszawa, Gdańsk",
            "likes": 193,
            "star_rating": "czterogwiazdkowy",
            "food": "All Inclusive"
        },
        {
            "page": 6,
            "wakacjeplURL": "https://www.wakacje.pl/wczasy/egipt?str-6,7-dni,do-3990zl,samolotem,3-gwiazdkowe,ocena-8,za-osobe",
            "hotel": "Albatros Palace Port Ghalib (ex. Red Sea The Palace)",
            "location": "Egipt / Marsa El Alam / Port Ghalib",
            "date": "13.01.2026- 20.01.2026",
            "formated_date": "2026-01-13",
            "price_per_person": "3276",
            "image_url": "https://i.wakacje.pl/no-index/hotel/rewaya-majestic-resort-basen-teren-hotelu-obiekt-1777145334-343-228.jpg",
            "offer_url": "https://www.wakacje.pl/oferty/egipt/marsa-el-alam/port-ghalib/albatros-palace-port-ghalib-ex-red-sea-the-palace-795027.html?-od-2026-01-13,7-dni,all-inclusive&utm_source=travellead&utm_medium=cps&utm_campaign=1656-vacccation.com&a_aid=1656&chan=code5",
            "short_url": "https://is.gd/7Zz71G",
            "airport": "Katowice, Warszawa",
            "likes": 1725,
            "star_rating": "pięciogwiazdkowy",
            "food": "All Inclusive"
        },
        {
            "page": 6,
            "wakacjeplURL": "https://www.wakacje.pl/wczasy/egipt?str-6,7-dni,do-3990zl,samolotem,3-gwiazdkowe,ocena-8,za-osobe",
            "hotel": "Albatros Sea World Resort Marsa Alam",
            "location": "Egipt / Marsa El Alam / Al-Kusajr",
            "date": "08.01.2026- 15.01.2026",
            "formated_date": "2026-01-08",
            "price_per_person": "2741",
            "image_url": "https://i.wakacje.pl/no-index/hotel/rewaya-majestic-resort-teren-hotelu-obiekt-1777145337-343-228.jpg",
            "offer_url": "https://www.wakacje.pl/oferty/egipt/marsa-el-alam/al-kusajr/albatros-sea-world-resort-marsa-alam-659828.html?-od-2026-01-08,7-dni,all-inclusive&utm_source=travellead&utm_medium=cps&utm_campaign=1656-vacccation.com&a_aid=1656&chan=code5",
            "short_url": "https://is.gd/bdXynN",
            "airport": "Warszawa, Katowice",
            "likes": 2206,
            "star_rating": "pięciogwiazdkowy",
            "food": "All Inclusive"
        },
        {
            "page": 6,
            "wakacjeplURL": "https://www.wakacje.pl/wczasy/egipt?str-6,7-dni,do-3990zl,samolotem,3-gwiazdkowe,ocena-8,za-osobe",
            "hotel": "Hilton Marsa Alam Nubian Resort",
            "location": "Egipt / Marsa El Alam",
            "date": "06.06.2026- 13.06.2026",
            "formated_date": "2026-06-06",
            "price_per_person": "3528",
            "image_url": "https://i.wakacje.pl/no-index/hotel/rewaya-majestic-resort-teren-hotelu-plaza-1777145338-343-228.jpg",
            "offer_url": "https://www.wakacje.pl/oferty/egipt/marsa-el-alam/hilton-marsa-alam-nubian-resort-216925.html?-od-2026-06-06,7-dni,all-inclusive&utm_source=travellead&utm_medium=cps&utm_campaign=1656-vacccation.com&a_aid=1656&chan=code5",
            "short_url": "https://is.gd/SWR3y9",
            "airport": "Warszawa, Katowice, Poznań",
            "likes": 2347,
            "star_rating": "pięciogwiazdkowy",
            "food": "All Inclusive"
        },
        {
            "page": 6,
            "wakacjeplURL": "https://www.wakacje.pl/wczasy/egipt?str-6,7-dni,do-3990zl,samolotem,3-gwiazdkowe,ocena-8,za-osobe",
            "hotel": "Sea Gull Beach Resort (Hurghada)",
            "location": "Egipt / Hurghada",
            "date": "11.01.2026- 18.01.2026",
            "formated_date": "2026-01-11",
            "price_per_person": "2556",
            "image_url": "https://i.wakacje.pl/no-index/hotel/rewaya-majestic-resort-teren-hotelu-plaza-1777145339-343-228.jpg",
            "offer_url": "https://www.wakacje.pl/oferty/egipt/hurghada/hurghada/sea-gull-beach-resort-hurghada-180528.html?-od-2026-01-11,7-dni,all-inclusive&utm_source=travellead&utm_medium=cps&utm_campaign=1656-vacccation.com&a_aid=1656&chan=code5",
            "short_url": "https://is.gd/qPVNtI",
            "airport": "Warszawa, Gdańsk, Katowice",
            "likes": 384,
            "star_rating": "czterogwiazdkowy",
            "food": "All Inclusive"
        },
        {
            "page": 6,
            "wakacjeplURL": "https://www.wakacje.pl/wczasy/egipt?str-6,7-dni,do-3990zl,samolotem,3-gwiazdkowe,ocena-8,za-osobe",
            "hotel": "Hilton Marsa Alam Nubian Resort",
            "location": "Egipt / Marsa El Alam",
            "date": "08.01.2026- 15.01.2026",
            "formated_date": "2026-01-08",
            "price_per_person": "2680",
            "image_url": "https://i.wakacje.pl/no-index/hotel/rewaya-majestic-resort-teren-hotelu-obiekt-1777145340-343-228.jpg",
            "offer_url": "https://www.wakacje.pl/oferty/egipt/marsa-el-alam/hilton-marsa-alam-nubian-resort-798073.html?-od-2026-01-08,7-dni,all-inclusive&utm_source=travellead&utm_medium=cps&utm_campaign=1656-vacccation.com&a_aid=1656&chan=code5",
            "short_url": "https://is.gd/Gxhc9V",
            "airport": "Katowice, Warszawa",
            "likes": 487,
            "star_rating": "pięciogwiazdkowy",
            "food": "All Inclusive"
        }
    ]
}