{
    "offers": [
        {
            "page": 2,
            "wakacjeplURL": "https://www.wakacje.pl/wczasy/?str-2,firstminute,7-dni,do-3990zl,samolotem,3-gwiazdkowe,ocena-8,za-osobe",
            "hotel": "Sentido Asterias Beach Resort",
            "location": "Grecja / Rodos / Afandou",
            "date": "23.10.2026- 30.10.2026",
            "formated_date": "2026-10-23",
            "price_per_person": "3272",
            "image_url": "https://i.wakacje.pl/no-index/hotel/sentido-asterias-beach-resort-basen-obiekt-755637360-343-228.jpg",
            "offer_url": "https://www.wakacje.pl/oferty/grecja/rodos/afandou/sentido-asterias-beach-resort-1023966.html?od-2026-10-23,7-dni&utm_source=travellead&utm_medium=cps&utm_campaign=1656-vacccation.com&a_aid=1656&chan=code5",
            "short_url": "https://is.gd/4dBi2D",
            "airport": "Poznań, Katowice, Wrocław",
            "likes": 1720,
            "star_rating": "pięciogwiazdkowy",
            "food": "All Inclusive"
        },
        {
            "page": 2,
            "wakacjeplURL": "https://www.wakacje.pl/wczasy/?str-2,firstminute,7-dni,do-3990zl,samolotem,3-gwiazdkowe,ocena-8,za-osobe",
            "hotel": "Akassia Swiss Resort (ex. Calimera Club Akassia Swiss Resort)",
            "location": "Egipt / Marsa El Alam / Al-Kusajr",
            "date": "15.09.2026- 22.09.2026",
            "formated_date": "2026-09-15",
            "price_per_person": "2977",
            "image_url": "https://i.wakacje.pl/no-index/hotel/akassia-swiss-resort-ex-calimera-club-akassia-swiss-resort-dla-dzieci-1440127917-343-228.jpg",
            "offer_url": "https://www.wakacje.pl/oferty/egipt/marsa-el-alam/al-kusajr/akassia-swiss-resort-ex-calimera-club-akassia-swiss-resort-254866.html?od-2026-09-15,7-dni&utm_source=travellead&utm_medium=cps&utm_campaign=1656-vacccation.com&a_aid=1656&chan=code5",
            "short_url": "https://is.gd/E6iS4u",
            "airport": "Katowice, Warszawa, Rzeszów",
            "likes": 317,
            "star_rating": "pięciogwiazdkowy",
            "food": "All Inclusive"
        },
        {
            "page": 2,
            "wakacjeplURL": "https://www.wakacje.pl/wczasy/?str-2,firstminute,7-dni,do-3990zl,samolotem,3-gwiazdkowe,ocena-8,za-osobe",
            "hotel": "Casa Blue Luxury Resort",
            "location": "Egipt / Marsa El Alam / Port Ghalib",
            "date": "29.08.2026- 05.09.2026",
            "formated_date": "2026-08-29",
            "price_per_person": "3979",
            "image_url": "https://i.wakacje.pl/no-index/zdjecie/id/20001399376-343-228.jpg",
            "offer_url": "https://www.wakacje.pl/oferty/egipt/marsa-el-alam/port-ghalib/casa-blue-luxury-resort-752736.html?od-2026-08-29,7-dni&utm_source=travellead&utm_medium=cps&utm_campaign=1656-vacccation.com&a_aid=1656&chan=code5",
            "short_url": "https://is.gd/UTnb8H",
            "airport": "Gdańsk, Katowice, Warszawa",
            "likes": 1993,
            "star_rating": "pięciogwiazdkowy",
            "food": "All Inclusive 24h"
        },
        {
            "page": 2,
            "wakacjeplURL": "https://www.wakacje.pl/wczasy/?str-2,firstminute,7-dni,do-3990zl,samolotem,3-gwiazdkowe,ocena-8,za-osobe",
            "hotel": "Selectum Family Resort Side (ex. Silence Beach Resort)",
            "location": "Turcja / Riwiera Turecka / Side",
            "date": "16.04.2026- 23.04.2026",
            "formated_date": "2026-04-16",
            "price_per_person": "2822",
            "image_url": "https://i.wakacje.pl/no-index/hotel/selectum-family-resort-side-ex-silence-beach-resort-teren-hotelu-basen-1341455024-343-228.jpg",
            "offer_url": "https://www.wakacje.pl/oferty/turcja/riwiera-turecka/side/selectum-family-resort-side-ex-silence-beach-resort-759526.html?od-2026-04-16,7-dni&utm_source=travellead&utm_medium=cps&utm_campaign=1656-vacccation.com&a_aid=1656&chan=code5",
            "short_url": "https://is.gd/yWjAfZ",
            "airport": "Kraków, Bydgoszcz, Katowice",
            "likes": 1193,
            "star_rating": "pięciogwiazdkowy",
            "food": "Ultra Ai"
        },
        {
            "page": 2,
            "wakacjeplURL": "https://www.wakacje.pl/wczasy/?str-2,firstminute,7-dni,do-3990zl,samolotem,3-gwiazdkowe,ocena-8,za-osobe",
            "hotel": "Jaz Aquamarine (ex. Iberotel Aquamarine)",
            "location": "Egipt / Hurghada",
            "date": "26.05.2026- 02.06.2026",
            "formated_date": "2026-05-26",
            "price_per_person": "3484",
            "image_url": "https://i.wakacje.pl/no-index/hotel/jaz-aquamarine-ex-iberotel-aquamarine-basen-826761969-343-228.jpg",
            "offer_url": "https://www.wakacje.pl/oferty/egipt/hurghada/hurghada/jaz-aquamarine-ex-iberotel-aquamarine-12693.html?od-2026-05-26,7-dni&utm_source=travellead&utm_medium=cps&utm_campaign=1656-vacccation.com&a_aid=1656&chan=code5",
            "short_url": "https://is.gd/3glAIb",
            "airport": "Katowice, Warszawa, Gdańsk",
            "likes": 757,
            "star_rating": "pięciogwiazdkowy",
            "food": "All Inclusive"
        },
        {
            "page": 2,
            "wakacjeplURL": "https://www.wakacje.pl/wczasy/?str-2,firstminute,7-dni,do-3990zl,samolotem,3-gwiazdkowe,ocena-8,za-osobe",
            "hotel": "Calimera Blend Paradise",
            "location": "Egipt / Hurghada",
            "date": "16.04.2026- 23.04.2026",
            "formated_date": "2026-04-16",
            "price_per_person": "2916",
            "image_url": "https://i.wakacje.pl/no-index/hotel/calimera-blend-paradise-zjezdzalnia-plaza-aquapark-1415763011-343-228.jpg",
            "offer_url": "https://www.wakacje.pl/oferty/egipt/hurghada/hurghada/calimera-blend-paradise-846455.html?od-2026-04-16,7-dni&utm_source=travellead&utm_medium=cps&utm_campaign=1656-vacccation.com&a_aid=1656&chan=code5",
            "short_url": "https://is.gd/LqUlj6",
            "airport": "Katowice, Warszawa, Poznań",
            "likes": 1361,
            "star_rating": "pięciogwiazdkowy",
            "food": "All Inclusive"
        },
        {
            "page": 2,
            "wakacjeplURL": "https://www.wakacje.pl/wczasy/?str-2,firstminute,7-dni,do-3990zl,samolotem,3-gwiazdkowe,ocena-8,za-osobe",
            "hotel": "Pickalbatros Sands Port Ghalib (ex. Red Sea Siva Sands)",
            "location": "Egipt / Marsa El Alam / Port Ghalib",
            "date": "12.05.2026- 19.05.2026",
            "formated_date": "2026-05-12",
            "price_per_person": "3362",
            "image_url": "https://i.wakacje.pl/no-index/hotel/pickalbatros-sands-port-ghalib-ex-red-sea-siva-sands-basen-1595081930-343-228.jpg",
            "offer_url": "https://www.wakacje.pl/oferty/egipt/marsa-el-alam/port-ghalib/pickalbatros-sands-port-ghalib-ex-red-sea-siva-sands-958505.html?od-2026-05-12,7-dni&utm_source=travellead&utm_medium=cps&utm_campaign=1656-vacccation.com&a_aid=1656&chan=code5",
            "short_url": "https://is.gd/MAMwp1",
            "airport": "Katowice, Warszawa, Rzeszów",
            "likes": 356,
            "star_rating": "pięciogwiazdkowy",
            "food": "All Inclusive"
        },
        {
            "page": 2,
            "wakacjeplURL": "https://www.wakacje.pl/wczasy/?str-2,firstminute,7-dni,do-3990zl,samolotem,3-gwiazdkowe,ocena-8,za-osobe",
            "hotel": "Rewaya Majestic Resort",
            "location": "Egipt / Hurghada",
            "date": "08.06.2026- 15.06.2026",
            "formated_date": "2026-06-08",
            "price_per_person": "2641",
            "image_url": "https://i.wakacje.pl/no-index/hotel/rewaya-majestic-resort-basen-teren-hotelu-obiekt-1777145318-343-228.jpg",
            "offer_url": "https://www.wakacje.pl/oferty/egipt/hurghada/hurghada/rewaya-majestic-resort-1009701.html?od-2026-06-08,7-dni&utm_source=travellead&utm_medium=cps&utm_campaign=1656-vacccation.com&a_aid=1656&chan=code5",
            "short_url": "https://is.gd/NExvVO",
            "airport": "Katowice, Warszawa, Wrocław",
            "likes": 654,
            "star_rating": "pięciogwiazdkowy",
            "food": "All Inclusive Ultra"
        },
        {
            "page": 2,
            "wakacjeplURL": "https://www.wakacje.pl/wczasy/?str-2,firstminute,7-dni,do-3990zl,samolotem,3-gwiazdkowe,ocena-8,za-osobe",
            "hotel": "Titanic Palace Resort",
            "location": "Egipt / Hurghada",
            "date": "15.04.2026- 22.04.2026",
            "formated_date": "2026-04-15",
            "price_per_person": "2840",
            "image_url": "https://i.wakacje.pl/no-index/hotel/titanic-palace-resort-basen-1764511626-343-228.jpg",
            "offer_url": "https://www.wakacje.pl/oferty/egipt/hurghada/hurghada/titanic-palace-resort-14032.html?od-2026-04-15,7-dni&utm_source=travellead&utm_medium=cps&utm_campaign=1656-vacccation.com&a_aid=1656&chan=code5",
            "short_url": "https://is.gd/cfjSkC",
            "airport": "Katowice, Warszawa, Gdańsk",
            "likes": 343,
            "star_rating": "pięciogwiazdkowy",
            "food": "Ultra All Inclusive"
        },
        {
            "page": 2,
            "wakacjeplURL": "https://www.wakacje.pl/wczasy/?str-2,firstminute,7-dni,do-3990zl,samolotem,3-gwiazdkowe,ocena-8,za-osobe",
            "hotel": "Casa Mare Resort (ex. Royal Tulip Beach Resort)",
            "location": "Egipt / Marsa El Alam / Port Ghalib",
            "date": "19.05.2026- 26.05.2026",
            "formated_date": "2026-05-19",
            "price_per_person": "2789",
            "image_url": "https://i.wakacje.pl/no-index/zdjecie/id/20001397302-343-228.jpg",
            "offer_url": "https://www.wakacje.pl/oferty/egipt/marsa-el-alam/port-ghalib/casa-mare-resort-ex-royal-tulip-beach-resort-412351.html?od-2026-05-19,7-dni&utm_source=travellead&utm_medium=cps&utm_campaign=1656-vacccation.com&a_aid=1656&chan=code5",
            "short_url": "https://is.gd/4WNyE3",
            "airport": "Gdańsk, Katowice, Warszawa",
            "likes": 517,
            "star_rating": "pięciogwiazdkowy",
            "food": "All Inclusive"
        },
        {
            "page": 3,
            "wakacjeplURL": "https://www.wakacje.pl/wczasy/?str-3,firstminute,7-dni,do-3990zl,samolotem,3-gwiazdkowe,ocena-8,za-osobe",
            "hotel": "Pickalbatros Portofino Marsa Alam",
            "location": "Egipt / Marsa El Alam",
            "date": "23.05.2026- 30.05.2026",
            "formated_date": "2026-05-23",
            "price_per_person": "3589",
            "image_url": "https://i.wakacje.pl/no-index/zdjecie/id/20001397263-343-228.jpg",
            "offer_url": "https://www.wakacje.pl/oferty/egipt/marsa-el-alam/pickalbatros-portofino-marsa-alam-776034.html?od-2026-05-23,7-dni&utm_source=travellead&utm_medium=cps&utm_campaign=1656-vacccation.com&a_aid=1656&chan=code5",
            "short_url": "https://is.gd/abuNM6",
            "airport": "Poznań, Rzeszów, Wrocław",
            "likes": 447,
            "star_rating": "czterogwiazdkowy",
            "food": "All Inclusive"
        },
        {
            "page": 3,
            "wakacjeplURL": "https://www.wakacje.pl/wczasy/?str-3,firstminute,7-dni,do-3990zl,samolotem,3-gwiazdkowe,ocena-8,za-osobe",
            "hotel": "Rose Rayhaan by Rotana",
            "location": "Emiraty Arabskie / Dubaj",
            "date": "03.09.2026- 10.09.2026",
            "formated_date": "2026-09-03",
            "price_per_person": "2917",
            "image_url": "https://i.wakacje.pl/no-index/hotel/rose-rayhaan-by-rotana-basen-teren-hotelu-1787607923-343-228.jpg",
            "offer_url": "https://www.wakacje.pl/oferty/emiraty-arabskie/dubaj/dubaj/rose-rayhaan-by-rotana-801703.html?od-2026-09-03,7-dni&utm_source=travellead&utm_medium=cps&utm_campaign=1656-vacccation.com&a_aid=1656&chan=code5",
            "short_url": "https://is.gd/KgznKs",
            "airport": "Rzeszów, Gdańsk, Wrocław",
            "likes": 1587,
            "star_rating": "czterogwiazdkowy",
            "food": "Śniadania (BB)"
        },
        {
            "page": 3,
            "wakacjeplURL": "https://www.wakacje.pl/wczasy/?str-3,firstminute,7-dni,do-3990zl,samolotem,3-gwiazdkowe,ocena-8,za-osobe",
            "hotel": "db Seabank Resort & Spa (ex RIU Seabank)",
            "location": "Malta / Wyspa Malta / Mellieha",
            "date": "15.04.2026- 22.04.2026",
            "formated_date": "2026-04-15",
            "price_per_person": "3139",
            "image_url": "https://i.wakacje.pl/no-index/hotel/db-seabank-resort-spa-ex-riu-seabank-pool-bar-basen-1459929990-343-228.jpg",
            "offer_url": "https://www.wakacje.pl/oferty/malta/wyspa-malta/mellieha/db-seabank-resort-spa-ex-riu-seabank-1028417.html?od-2026-04-15,7-dni&utm_source=travellead&utm_medium=cps&utm_campaign=1656-vacccation.com&a_aid=1656&chan=code5",
            "short_url": "https://is.gd/U8ODcP",
            "airport": "Warszawa, Katowice, Poznań",
            "likes": 318,
            "star_rating": "czterogwiazdkowy",
            "food": "All Inclusive"
        },
        {
            "page": 3,
            "wakacjeplURL": "https://www.wakacje.pl/wczasy/?str-3,firstminute,7-dni,do-3990zl,samolotem,3-gwiazdkowe,ocena-8,za-osobe",
            "hotel": "Albatros Palace Port Ghalib (ex. Red Sea The Palace)",
            "location": "Egipt / Marsa El Alam / Port Ghalib",
            "date": "19.05.2026- 26.05.2026",
            "formated_date": "2026-05-19",
            "price_per_person": "3748",
            "image_url": "https://i.wakacje.pl/no-index/hotel/albatros-palace-port-ghalib-ex-red-sea-the-palace-teren-hotelu-1579971923-343-228.jpg",
            "offer_url": "https://www.wakacje.pl/oferty/egipt/marsa-el-alam/port-ghalib/albatros-palace-port-ghalib-ex-red-sea-the-palace-708540.html?od-2026-05-19,7-dni&utm_source=travellead&utm_medium=cps&utm_campaign=1656-vacccation.com&a_aid=1656&chan=code5",
            "short_url": "https://is.gd/qbzw41",
            "airport": "Katowice, Warszawa, Rzeszów",
            "likes": 369,
            "star_rating": "pięciogwiazdkowy",
            "food": "All Inclusive"
        },
        {
            "page": 3,
            "wakacjeplURL": "https://www.wakacje.pl/wczasy/?str-3,firstminute,7-dni,do-3990zl,samolotem,3-gwiazdkowe,ocena-8,za-osobe",
            "hotel": "Three Corners Sea Beach",
            "location": "Egipt / Marsa El Alam",
            "date": "10.06.2026- 17.06.2026",
            "formated_date": "2026-06-10",
            "price_per_person": "3075",
            "image_url": "https://i.wakacje.pl/no-index/hotel/three-corners-sea-beach-teren-hotelu-1492977953-343-228.jpg",
            "offer_url": "https://www.wakacje.pl/oferty/egipt/marsa-el-alam/three-corners-sea-beach-875448.html?od-2026-06-10,7-dni&utm_source=travellead&utm_medium=cps&utm_campaign=1656-vacccation.com&a_aid=1656&chan=code5",
            "short_url": "https://is.gd/2nGHNI",
            "airport": "Katowice, Warszawa, Wrocław",
            "likes": 2435,
            "star_rating": "czterogwiazdkowy",
            "food": "All Inclusive"
        },
        {
            "page": 3,
            "wakacjeplURL": "https://www.wakacje.pl/wczasy/?str-3,firstminute,7-dni,do-3990zl,samolotem,3-gwiazdkowe,ocena-8,za-osobe",
            "hotel": "Laur Experience & Elegance",
            "location": "Turcja / Wybrzeże Egejskie / Didim",
            "date": "24.04.2026- 01.05.2026",
            "formated_date": "2026-04-24",
            "price_per_person": "2397",
            "image_url": "https://i.wakacje.pl/no-index/hotel/laur-experience-elegance-teren-hotelu-basen-1274790402-343-228.jpg",
            "offer_url": "https://www.wakacje.pl/oferty/turcja/wybrzeze-egejskie/didim/laur-experience-elegance-211281.html?od-2026-04-24,7-dni&utm_source=travellead&utm_medium=cps&utm_campaign=1656-vacccation.com&a_aid=1656&chan=code5",
            "short_url": "https://is.gd/lr02BF",
            "airport": "Rzeszów, Gdańsk, Wrocław",
            "likes": 1328,
            "star_rating": "pięciogwiazdkowy",
            "food": "Ultra All Inclusive"
        },
        {
            "page": 3,
            "wakacjeplURL": "https://www.wakacje.pl/wczasy/?str-3,firstminute,7-dni,do-3990zl,samolotem,3-gwiazdkowe,ocena-8,za-osobe",
            "hotel": "Gypsophila Holiday Village",
            "location": "Turcja / Riwiera Turecka / Okurcalar",
            "date": "16.04.2026- 23.04.2026",
            "formated_date": "2026-04-16",
            "price_per_person": "2203",
            "image_url": "https://i.wakacje.pl/no-index/hotel/gypsophila-holiday-village-zjezdzalnia-aquapark-basen-teren-hotelu-825805675-343-228.jpg",
            "offer_url": "https://www.wakacje.pl/oferty/turcja/riwiera-turecka/okurcalar/gypsophila-holiday-village-767709.html?od-2026-04-16,7-dni&utm_source=travellead&utm_medium=cps&utm_campaign=1656-vacccation.com&a_aid=1656&chan=code5",
            "short_url": "https://is.gd/7HBnoO",
            "airport": "Kraków, Bydgoszcz, Katowice",
            "likes": 2146,
            "star_rating": "pięciogwiazdkowy",
            "food": "Ultra Ai"
        },
        {
            "page": 3,
            "wakacjeplURL": "https://www.wakacje.pl/wczasy/?str-3,firstminute,7-dni,do-3990zl,samolotem,3-gwiazdkowe,ocena-8,za-osobe",
            "hotel": "Hilton Marsa Alam Nubian Resort",
            "location": "Egipt / Marsa El Alam",
            "date": "16.04.2026- 23.04.2026",
            "formated_date": "2026-04-16",
            "price_per_person": "3337",
            "image_url": "https://i.wakacje.pl/no-index/hotel/hilton-marsa-alam-nubian-resort-basen-teren-hotelu-obiekt-826422005-343-228.jpg",
            "offer_url": "https://www.wakacje.pl/oferty/egipt/marsa-el-alam/hilton-marsa-alam-nubian-resort-875439.html?od-2026-04-16,7-dni&utm_source=travellead&utm_medium=cps&utm_campaign=1656-vacccation.com&a_aid=1656&chan=code5",
            "short_url": "https://is.gd/OF9agn",
            "airport": "Katowice, Warszawa, Wrocław",
            "likes": 1389,
            "star_rating": "pięciogwiazdkowy",
            "food": "All Inclusive"
        },
        {
            "page": 3,
            "wakacjeplURL": "https://www.wakacje.pl/wczasy/?str-3,firstminute,7-dni,do-3990zl,samolotem,3-gwiazdkowe,ocena-8,za-osobe",
            "hotel": "Reef Oasis Suakin Resort",
            "location": "Egipt / Marsa El Alam",
            "date": "22.05.2026- 29.05.2026",
            "formated_date": "2026-05-22",
            "price_per_person": "3159",
            "image_url": "https://i.wakacje.pl/no-index/zdjecie/id/20001424504-343-228.jpg",
            "offer_url": "https://www.wakacje.pl/oferty/egipt/marsa-el-alam/reef-oasis-suakin-resort-810970.html?od-2026-05-22,7-dni&utm_source=travellead&utm_medium=cps&utm_campaign=1656-vacccation.com&a_aid=1656&chan=code5",
            "short_url": "https://is.gd/mMH8Dd",
            "airport": "Gdańsk, Katowice, Warszawa",
            "likes": 390,
            "star_rating": "pięciogwiazdkowy",
            "food": "All Inclusive"
        },
        {
            "page": 3,
            "wakacjeplURL": "https://www.wakacje.pl/wczasy/?str-3,firstminute,7-dni,do-3990zl,samolotem,3-gwiazdkowe,ocena-8,za-osobe",
            "hotel": "Jaz Aquamarine (ex. Iberotel Aquamarine)",
            "location": "Egipt / Hurghada",
            "date": "08.06.2026- 15.06.2026",
            "formated_date": "2026-06-08",
            "price_per_person": "3524",
            "image_url": "https://i.wakacje.pl/no-index/hotel/jaz-aquamarine-ex-iberotel-aquamarine-basen-826761969-343-228.jpg",
            "offer_url": "https://www.wakacje.pl/oferty/egipt/hurghada/hurghada/jaz-aquamarine-ex-iberotel-aquamarine-875783.html?od-2026-06-08,7-dni&utm_source=travellead&utm_medium=cps&utm_campaign=1656-vacccation.com&a_aid=1656&chan=code5",
            "short_url": "https://is.gd/4t4UUv",
            "airport": "Katowice, Warszawa, Wrocław",
            "likes": 2038,
            "star_rating": "pięciogwiazdkowy",
            "food": "All Inclusive"
        },
        {
            "page": 4,
            "wakacjeplURL": "https://www.wakacje.pl/wczasy/?str-4,firstminute,7-dni,do-3990zl,samolotem,3-gwiazdkowe,ocena-8,za-osobe",
            "hotel": "Gypsophila Holiday Village",
            "location": "Turcja / Riwiera Turecka / Okurcalar",
            "date": "15.04.2026- 22.04.2026",
            "formated_date": "2026-04-15",
            "price_per_person": "2503",
            "image_url": "https://i.wakacje.pl/no-index/hotel/gypsophila-holiday-village-zjezdzalnia-aquapark-basen-teren-hotelu-825805675-343-228.jpg",
            "offer_url": "https://www.wakacje.pl/oferty/turcja/riwiera-turecka/okurcalar/gypsophila-holiday-village-20956.html?od-2026-04-15,7-dni&utm_source=travellead&utm_medium=cps&utm_campaign=1656-vacccation.com&a_aid=1656&chan=code5",
            "short_url": "https://is.gd/eWT5Ee",
            "airport": "Rzeszów, Zielona Góra, Gdańsk",
            "likes": 1182,
            "star_rating": "pięciogwiazdkowy",
            "food": "Ultra All Inclusive"
        },
        {
            "page": 4,
            "wakacjeplURL": "https://www.wakacje.pl/wczasy/?str-4,firstminute,7-dni,do-3990zl,samolotem,3-gwiazdkowe,ocena-8,za-osobe",
            "hotel": "Jaz Lamaya Resort (ex Iberotel)",
            "location": "Egipt / Marsa El Alam / Madinat Coraya",
            "date": "19.04.2026- 26.04.2026",
            "formated_date": "2026-04-19",
            "price_per_person": "3674",
            "image_url": "https://i.wakacje.pl/no-index/hotel/jaz-lamaya-resort-ex-iberotel-basen-1488480975-343-228.jpg",
            "offer_url": "https://www.wakacje.pl/oferty/egipt/marsa-el-alam/madinat-coraya/jaz-lamaya-resort-ex-iberotel-351089.html?od-2026-04-19,7-dni&utm_source=travellead&utm_medium=cps&utm_campaign=1656-vacccation.com&a_aid=1656&chan=code5",
            "short_url": "https://is.gd/0AxU1j",
            "airport": "Katowice, Warszawa, Rzeszów",
            "likes": 283,
            "star_rating": "pięciogwiazdkowy",
            "food": "All Inclusive"
        },
        {
            "page": 4,
            "wakacjeplURL": "https://www.wakacje.pl/wczasy/?str-4,firstminute,7-dni,do-3990zl,samolotem,3-gwiazdkowe,ocena-8,za-osobe",
            "hotel": "Aladdin Beach Resort",
            "location": "Egipt / Hurghada",
            "date": "30.04.2026- 07.05.2026",
            "formated_date": "2026-04-30",
            "price_per_person": "2956",
            "image_url": "https://i.wakacje.pl/no-index/hotel/aladdin-beach-resort-teren-hotelu-basen-aquapark-zjezdzalnia-rozrywka-1333449171-343-228.jpg",
            "offer_url": "https://www.wakacje.pl/oferty/egipt/hurghada/hurghada/aladdin-beach-resort-757106.html?od-2026-04-30,7-dni&utm_source=travellead&utm_medium=cps&utm_campaign=1656-vacccation.com&a_aid=1656&chan=code5",
            "short_url": "https://is.gd/sRCSFI",
            "airport": "Katowice, Warszawa, Poznań",
            "likes": 325,
            "star_rating": "czterogwiazdkowy",
            "food": "All Inclusive"
        },
        {
            "page": 4,
            "wakacjeplURL": "https://www.wakacje.pl/wczasy/?str-4,firstminute,7-dni,do-3990zl,samolotem,3-gwiazdkowe,ocena-8,za-osobe",
            "hotel": "Bodrum Holiday Resort",
            "location": "Turcja / Wybrzeże Egejskie / Icmeler",
            "date": "15.10.2026- 22.10.2026",
            "formated_date": "2026-10-15",
            "price_per_person": "2262",
            "image_url": "https://i.wakacje.pl/no-index/hotel/bodrum-holiday-resort-obiekt-1676066737-343-228.jpg",
            "offer_url": "https://www.wakacje.pl/oferty/turcja/wybrzeze-egejskie/icmeler/bodrum-holiday-resort-181453.html?od-2026-10-15,7-dni&utm_source=travellead&utm_medium=cps&utm_campaign=1656-vacccation.com&a_aid=1656&chan=code5",
            "short_url": "https://is.gd/NuC5kF",
            "airport": "Rzeszów, Gdańsk, Wrocław",
            "likes": 255,
            "star_rating": "pięciogwiazdkowy",
            "food": "Ultra All Inclusive"
        },
        {
            "page": 4,
            "wakacjeplURL": "https://www.wakacje.pl/wczasy/?str-4,firstminute,7-dni,do-3990zl,samolotem,3-gwiazdkowe,ocena-8,za-osobe",
            "hotel": "Sataya Resort (ex. Labranda Sataya Marsa Alam)",
            "location": "Egipt / Marsa El Alam / Port Ghalib",
            "date": "17.04.2026- 24.04.2026",
            "formated_date": "2026-04-17",
            "price_per_person": "3139",
            "image_url": "https://i.wakacje.pl/no-index/zdjecie/id/20001396770-343-228.jpg",
            "offer_url": "https://www.wakacje.pl/oferty/egipt/marsa-el-alam/port-ghalib/sataya-resort-ex-labranda-sataya-marsa-alam-665425.html?od-2026-04-17,7-dni&utm_source=travellead&utm_medium=cps&utm_campaign=1656-vacccation.com&a_aid=1656&chan=code5",
            "short_url": "https://is.gd/QM1Z4I",
            "airport": "Poznań, Rzeszów, Wrocław",
            "likes": 1668,
            "star_rating": "pięciogwiazdkowy",
            "food": "All Inclusive"
        },
        {
            "page": 4,
            "wakacjeplURL": "https://www.wakacje.pl/wczasy/?str-4,firstminute,7-dni,do-3990zl,samolotem,3-gwiazdkowe,ocena-8,za-osobe",
            "hotel": "Caretta Paradise",
            "location": "Grecja / Zakynthos / Tragaki",
            "date": "24.04.2026- 01.05.2026",
            "formated_date": "2026-04-24",
            "price_per_person": "2467",
            "image_url": "https://i.wakacje.pl/no-index/hotel/caretta-paradise-zjezdzalnia-aquapark-basen-826726888-343-228.jpg",
            "offer_url": "https://www.wakacje.pl/oferty/grecja/zakynthos/tragaki/caretta-paradise-472857.html?od-2026-04-24,7-dni&utm_source=travellead&utm_medium=cps&utm_campaign=1656-vacccation.com&a_aid=1656&chan=code5",
            "short_url": "https://is.gd/MvguSB",
            "airport": "Poznań, Katowice, Wrocław",
            "likes": 1490,
            "star_rating": "czteroipółgwiazdkowy",
            "food": "All Inclusive"
        },
        {
            "page": 4,
            "wakacjeplURL": "https://www.wakacje.pl/wczasy/?str-4,firstminute,7-dni,do-3990zl,samolotem,3-gwiazdkowe,ocena-8,za-osobe",
            "hotel": "Pickalbatros Laguna Vista Beach",
            "location": "Egipt / Sharm el Sheikh",
            "date": "22.05.2026- 29.05.2026",
            "formated_date": "2026-05-22",
            "price_per_person": "3880",
            "image_url": "https://i.wakacje.pl/no-index/hotel/pickalbatros-laguna-vista-beach-teren-hotelu-1581761134-343-228.jpg",
            "offer_url": "https://www.wakacje.pl/oferty/egipt/sharm-el-sheikh/pickalbatros-laguna-vista-beach-875927.html?od-2026-05-22,7-dni&utm_source=travellead&utm_medium=cps&utm_campaign=1656-vacccation.com&a_aid=1656&chan=code5",
            "short_url": "https://is.gd/AeEJ3t",
            "airport": "Katowice, Warszawa, Wrocław",
            "likes": 1561,
            "star_rating": "pięciogwiazdkowy",
            "food": "All Inclusive"
        },
        {
            "page": 4,
            "wakacjeplURL": "https://www.wakacje.pl/wczasy/?str-4,firstminute,7-dni,do-3990zl,samolotem,3-gwiazdkowe,ocena-8,za-osobe",
            "hotel": "Jaz Elite Maraya",
            "location": "Egipt / Marsa El Alam",
            "date": "16.04.2026- 23.04.2026",
            "formated_date": "2026-04-16",
            "price_per_person": "3949",
            "image_url": "https://i.wakacje.pl/no-index/hotel/jaz-elite-maraya-basen-teren-hotelu-815608636-343-228.jpg",
            "offer_url": "https://www.wakacje.pl/oferty/egipt/marsa-el-alam/jaz-elite-maraya-600118.html?od-2026-04-16,7-dni&utm_source=travellead&utm_medium=cps&utm_campaign=1656-vacccation.com&a_aid=1656&chan=code5",
            "short_url": "https://is.gd/JUVdfL",
            "airport": "Katowice, Warszawa, Rzeszów",
            "likes": 264,
            "star_rating": "pięciogwiazdkowy",
            "food": "All Inclusive"
        },
        {
            "page": 4,
            "wakacjeplURL": "https://www.wakacje.pl/wczasy/?str-4,firstminute,7-dni,do-3990zl,samolotem,3-gwiazdkowe,ocena-8,za-osobe",
            "hotel": "Catamaran Quality Times (ex. Catamaran Resort)",
            "location": "Turcja / Riwiera Turecka / Kemer",
            "date": "15.04.2026- 22.04.2026",
            "formated_date": "2026-04-15",
            "price_per_person": "1984",
            "image_url": "https://i.wakacje.pl/no-index/hotel/catamaran-quality-times-ex-catamaran-resort-basen-1501603208-343-228.jpg",
            "offer_url": "https://www.wakacje.pl/oferty/turcja/riwiera-turecka/kemer/catamaran-quality-times-ex-catamaran-resort-769680.html?od-2026-04-15,7-dni&utm_source=travellead&utm_medium=cps&utm_campaign=1656-vacccation.com&a_aid=1656&chan=code5",
            "short_url": "https://is.gd/gHxy8w",
            "airport": "Kraków, Bydgoszcz, Katowice",
            "likes": 1774,
            "star_rating": "pięciogwiazdkowy",
            "food": "All Inclusive"
        },
        {
            "page": 4,
            "wakacjeplURL": "https://www.wakacje.pl/wczasy/?str-4,firstminute,7-dni,do-3990zl,samolotem,3-gwiazdkowe,ocena-8,za-osobe",
            "hotel": "Salamis Bay Conti",
            "location": "Cypr / Cypr Północny / Famagusta (Gazimagusa)",
            "date": "16.04.2026- 23.04.2026",
            "formated_date": "2026-04-16",
            "price_per_person": "2949",
            "image_url": "https://i.wakacje.pl/no-index/hotel/salamis-bay-conti-plaza-sport-i-rekreacja-beach-bar-824358483-343-228.jpg",
            "offer_url": "https://www.wakacje.pl/oferty/cypr/cypr-polnocny/famagusta-gazimagusa/salamis-bay-conti-1026879.html?od-2026-04-16,7-dni&utm_source=travellead&utm_medium=cps&utm_campaign=1656-vacccation.com&a_aid=1656&chan=code5",
            "short_url": "https://is.gd/9q5fxq",
            "airport": "Berlin, Warszawa, Katowice",
            "likes": 1241,
            "star_rating": "pięciogwiazdkowy",
            "food": "Ultra All Inclusive"
        },
        {
            "page": 5,
            "wakacjeplURL": "https://www.wakacje.pl/wczasy/?str-5,firstminute,7-dni,do-3990zl,samolotem,3-gwiazdkowe,ocena-8,za-osobe",
            "hotel": "Hilton Marsa Alam Nubian Resort",
            "location": "Egipt / Marsa El Alam",
            "date": "19.04.2026- 26.04.2026",
            "formated_date": "2026-04-19",
            "price_per_person": "3348",
            "image_url": "https://i.wakacje.pl/no-index/hotel/hilton-marsa-alam-nubian-resort-basen-teren-hotelu-obiekt-826422005-343-228.jpg",
            "offer_url": "https://www.wakacje.pl/oferty/egipt/marsa-el-alam/hilton-marsa-alam-nubian-resort-259156.html?od-2026-04-19,7-dni&utm_source=travellead&utm_medium=cps&utm_campaign=1656-vacccation.com&a_aid=1656&chan=code5",
            "short_url": "https://is.gd/GakCEZ",
            "airport": "Katowice, Warszawa, Rzeszów",
            "likes": 296,
            "star_rating": "pięciogwiazdkowy",
            "food": "All Inclusive"
        },
        {
            "page": 5,
            "wakacjeplURL": "https://www.wakacje.pl/wczasy/?str-5,firstminute,7-dni,do-3990zl,samolotem,3-gwiazdkowe,ocena-8,za-osobe",
            "hotel": "Pickalbatros Royal Moderna",
            "location": "Egipt / Sharm el Sheikh",
            "date": "12.06.2026- 19.06.2026",
            "formated_date": "2026-06-12",
            "price_per_person": "3749",
            "image_url": "https://i.wakacje.pl/no-index/hotel/pickalbatros-royal-moderna-basen-teren-hotelu-1487523124-343-228.jpg",
            "offer_url": "https://www.wakacje.pl/oferty/egipt/sharm-el-sheikh/pickalbatros-royal-moderna-880639.html?od-2026-06-12,7-dni&utm_source=travellead&utm_medium=cps&utm_campaign=1656-vacccation.com&a_aid=1656&chan=code5",
            "short_url": "https://is.gd/1jc9YM",
            "airport": "Katowice, Warszawa, Wrocław",
            "likes": 1415,
            "star_rating": "pięciogwiazdkowy",
            "food": "All Inclusive"
        },
        {
            "page": 5,
            "wakacjeplURL": "https://www.wakacje.pl/wczasy/?str-5,firstminute,7-dni,do-3990zl,samolotem,3-gwiazdkowe,ocena-8,za-osobe",
            "hotel": "Gypsophila Club Marine (ex. Amara Club Marine Nature)",
            "location": "Turcja / Riwiera Turecka / Kemer",
            "date": "16.04.2026- 23.04.2026",
            "formated_date": "2026-04-16",
            "price_per_person": "2352",
            "image_url": "https://i.wakacje.pl/no-index/hotel/gypsophila-club-marine-ex-amara-club-marine-nature-basen-obiekt-826521660-343-228.jpg",
            "offer_url": "https://www.wakacje.pl/oferty/turcja/riwiera-turecka/kemer/gypsophila-club-marine-ex-amara-club-marine-nature-759392.html?od-2026-04-16,7-dni&utm_source=travellead&utm_medium=cps&utm_campaign=1656-vacccation.com&a_aid=1656&chan=code5",
            "short_url": "https://is.gd/LcP8L4",
            "airport": "Kraków, Bydgoszcz, Katowice",
            "likes": 526,
            "star_rating": "pięciogwiazdkowy",
            "food": "Ultra Ai"
        },
        {
            "page": 5,
            "wakacjeplURL": "https://www.wakacje.pl/wczasy/?str-5,firstminute,7-dni,do-3990zl,samolotem,3-gwiazdkowe,ocena-8,za-osobe",
            "hotel": "Calimera Blend Paradise",
            "location": "Egipt / Hurghada",
            "date": "16.04.2026- 23.04.2026",
            "formated_date": "2026-04-16",
            "price_per_person": "3001",
            "image_url": "https://i.wakacje.pl/no-index/hotel/calimera-blend-paradise-zjezdzalnia-plaza-aquapark-1415763011-343-228.jpg",
            "offer_url": "https://www.wakacje.pl/oferty/egipt/hurghada/hurghada/calimera-blend-paradise-1076792.html?od-2026-04-16,7-dni&utm_source=travellead&utm_medium=cps&utm_campaign=1656-vacccation.com&a_aid=1656&chan=code5",
            "short_url": "https://is.gd/KPucGG",
            "airport": "Poznań, Lublin, Wrocław",
            "likes": 2293,
            "star_rating": "pięciogwiazdkowy",
            "food": "All Inclusive"
        },
        {
            "page": 5,
            "wakacjeplURL": "https://www.wakacje.pl/wczasy/?str-5,firstminute,7-dni,do-3990zl,samolotem,3-gwiazdkowe,ocena-8,za-osobe",
            "hotel": "Sea Gull Beach Resort (Hurghada)",
            "location": "Egipt / Hurghada",
            "date": "09.06.2026- 16.06.2026",
            "formated_date": "2026-06-09",
            "price_per_person": "2851",
            "image_url": "https://i.wakacje.pl/no-index/hotel/sea-gull-beach-resort-hurghada-teren-hotelu-1459219975-343-228.jpg",
            "offer_url": "https://www.wakacje.pl/oferty/egipt/hurghada/hurghada/sea-gull-beach-resort-hurghada-17600.html?od-2026-06-09,7-dni&utm_source=travellead&utm_medium=cps&utm_campaign=1656-vacccation.com&a_aid=1656&chan=code5",
            "short_url": "https://is.gd/K3UxPZ",
            "airport": "Katowice, Warszawa, Gdańsk",
            "likes": 2078,
            "star_rating": "czterogwiazdkowy",
            "food": "All Inclusive"
        },
        {
            "page": 5,
            "wakacjeplURL": "https://www.wakacje.pl/wczasy/?str-5,firstminute,7-dni,do-3990zl,samolotem,3-gwiazdkowe,ocena-8,za-osobe",
            "hotel": "Sentido Akassia Beach (ex. LTI Akassia Beach)",
            "location": "Egipt / Marsa El Alam",
            "date": "29.08.2026- 06.09.2026",
            "formated_date": "2026-08-29",
            "price_per_person": "3056",
            "image_url": "https://i.wakacje.pl/no-index/hotel/sentido-akassia-beach-ex-lti-akassia-beach-zjezdzalnia-basen-1789895266-343-228.jpg",
            "offer_url": "https://www.wakacje.pl/oferty/egipt/marsa-el-alam/sentido-akassia-beach-ex-lti-akassia-beach-799112.html?od-2026-08-29,7-dni&utm_source=travellead&utm_medium=cps&utm_campaign=1656-vacccation.com&a_aid=1656&chan=code5",
            "short_url": "https://is.gd/k86Yau",
            "airport": "Katowice, Warszawa",
            "likes": 189,
            "star_rating": "pięciogwiazdkowy",
            "food": "All Inclusive"
        },
        {
            "page": 5,
            "wakacjeplURL": "https://www.wakacje.pl/wczasy/?str-5,firstminute,7-dni,do-3990zl,samolotem,3-gwiazdkowe,ocena-8,za-osobe",
            "hotel": "Constantinos The Great Beach",
            "location": "Cypr / Cypr Południowy / Protaras",
            "date": "25.04.2026- 02.05.2026",
            "formated_date": "2026-04-25",
            "price_per_person": "3881",
            "image_url": "https://i.wakacje.pl/no-index/hotel/constantinos-the-great-beach-basen-obiekt-796852731-343-228.jpg",
            "offer_url": "https://www.wakacje.pl/oferty/cypr/cypr-poludniowy/protaras/constantinos-the-great-beach-515424.html?od-2026-04-25,7-dni&utm_source=travellead&utm_medium=cps&utm_campaign=1656-vacccation.com&a_aid=1656&chan=code5",
            "short_url": "https://is.gd/w21htD",
            "airport": "Poznań, Katowice, Wrocław",
            "likes": 327,
            "star_rating": "pięciogwiazdkowy",
            "food": "All Inclusive"
        },
        {
            "page": 5,
            "wakacjeplURL": "https://www.wakacje.pl/wczasy/?str-5,firstminute,7-dni,do-3990zl,samolotem,3-gwiazdkowe,ocena-8,za-osobe",
            "hotel": "Sunrise Anjum Resort",
            "location": "Egipt / Marsa El Alam",
            "date": "19.05.2026- 26.05.2026",
            "formated_date": "2026-05-19",
            "price_per_person": "3751",
            "image_url": "https://i.wakacje.pl/no-index/hotel/sunrise-anjum-resort-basen-1621285579-343-228.jpg",
            "offer_url": "https://www.wakacje.pl/oferty/egipt/marsa-el-alam/sunrise-anjum-resort-893480.html?od-2026-05-19,7-dni&utm_source=travellead&utm_medium=cps&utm_campaign=1656-vacccation.com&a_aid=1656&chan=code5",
            "short_url": "https://is.gd/CeSsL3",
            "airport": "Katowice, Warszawa, Rzeszów",
            "likes": 741,
            "star_rating": "pięciogwiazdkowy",
            "food": "All Inclusive"
        },
        {
            "page": 5,
            "wakacjeplURL": "https://www.wakacje.pl/wczasy/?str-5,firstminute,7-dni,do-3990zl,samolotem,3-gwiazdkowe,ocena-8,za-osobe",
            "hotel": "King Evelthon Beach Hotel and Resort",
            "location": "Cypr / Cypr Południowy / Paphos",
            "date": "17.04.2026- 24.04.2026",
            "formated_date": "2026-04-17",
            "price_per_person": "2559",
            "image_url": "https://i.wakacje.pl/no-index/hotel/king-evelthon-beach-hotel-and-resort-basen-826617683-343-228.jpg",
            "offer_url": "https://www.wakacje.pl/oferty/cypr/cypr-poludniowy/paphos/king-evelthon-beach-hotel-and-resort-1044256.html?od-2026-04-17,7-dni&utm_source=travellead&utm_medium=cps&utm_campaign=1656-vacccation.com&a_aid=1656&chan=code5",
            "short_url": "https://is.gd/MI7v1o",
            "airport": "Warszawa, Katowice, Poznań",
            "likes": 1210,
            "star_rating": "pięciogwiazdkowy",
            "food": "Śniadania i obiadokolacje (HB)"
        },
        {
            "page": 5,
            "wakacjeplURL": "https://www.wakacje.pl/wczasy/?str-5,firstminute,7-dni,do-3990zl,samolotem,3-gwiazdkowe,ocena-8,za-osobe",
            "hotel": "Caretta Beach (Kalamaki)",
            "location": "Grecja / Zakynthos / Kalamaki",
            "date": "24.04.2026- 01.05.2026",
            "formated_date": "2026-04-24",
            "price_per_person": "2238",
            "image_url": "https://i.wakacje.pl/no-index/hotel/caretta-beach-kalamaki-basen-1489117202-343-228.jpg",
            "offer_url": "https://www.wakacje.pl/oferty/grecja/zakynthos/kalamaki/caretta-beach-kalamaki-472858.html?od-2026-04-24,7-dni&utm_source=travellead&utm_medium=cps&utm_campaign=1656-vacccation.com&a_aid=1656&chan=code5",
            "short_url": "https://is.gd/XHM6bh",
            "airport": "Poznań, Katowice, Wrocław",
            "likes": 934,
            "star_rating": "czterogwiazdkowy",
            "food": "All Inclusive"
        },
        {
            "page": 6,
            "wakacjeplURL": "https://www.wakacje.pl/wczasy/?str-6,firstminute,7-dni,do-3990zl,samolotem,3-gwiazdkowe,ocena-8,za-osobe",
            "hotel": "Sunis Kumkoy Beach Resort",
            "location": "Turcja / Riwiera Turecka / Side",
            "date": "15.04.2026- 22.04.2026",
            "formated_date": "2026-04-15",
            "price_per_person": "3460",
            "image_url": "https://i.wakacje.pl/no-index/hotel/sunis-kumkoy-beach-resort-basen-1558825644-343-228.jpg",
            "offer_url": "https://www.wakacje.pl/oferty/turcja/riwiera-turecka/side/sunis-kumkoy-beach-resort-357825.html?od-2026-04-15,7-dni&utm_source=travellead&utm_medium=cps&utm_campaign=1656-vacccation.com&a_aid=1656&chan=code5",
            "short_url": "https://is.gd/y5Wsg4",
            "airport": "Rzeszów, Zielona Góra, Gdańsk",
            "likes": 342,
            "star_rating": "pięciogwiazdkowy",
            "food": "Ultra All Inclusive"
        },
        {
            "page": 6,
            "wakacjeplURL": "https://www.wakacje.pl/wczasy/?str-6,firstminute,7-dni,do-3990zl,samolotem,3-gwiazdkowe,ocena-8,za-osobe",
            "hotel": "Gold Island Selected",
            "location": "Turcja / Riwiera Turecka / Alanya",
            "date": "15.04.2026- 22.04.2026",
            "formated_date": "2026-04-15",
            "price_per_person": "2759",
            "image_url": "https://i.wakacje.pl/no-index/hotel/gold-island-selected-basen-obiekt-1772344681-343-228.jpg",
            "offer_url": "https://www.wakacje.pl/oferty/turcja/riwiera-turecka/alanya/gold-island-selected-817781.html?od-2026-04-15,7-dni&utm_source=travellead&utm_medium=cps&utm_campaign=1656-vacccation.com&a_aid=1656&chan=code5",
            "short_url": "https://is.gd/o763hd",
            "airport": "Rzeszów, Zielona Góra, Gdańsk",
            "likes": 332,
            "star_rating": "pięciogwiazdkowy",
            "food": "Ultra All Inclusive"
        },
        {
            "page": 6,
            "wakacjeplURL": "https://www.wakacje.pl/wczasy/?str-6,firstminute,7-dni,do-3990zl,samolotem,3-gwiazdkowe,ocena-8,za-osobe",
            "hotel": "Palm Beach Resort (Hurghada)",
            "location": "Egipt / Hurghada",
            "date": "06.05.2026- 14.05.2026",
            "formated_date": "2026-05-06",
            "price_per_person": "2596",
            "image_url": "https://i.wakacje.pl/no-index/hotel/palm-beach-resort-hurghada-teren-hotelu-1465734788-343-228.jpg",
            "offer_url": "https://www.wakacje.pl/oferty/egipt/hurghada/hurghada/palm-beach-resort-hurghada-784993.html?od-2026-05-06,7-dni&utm_source=travellead&utm_medium=cps&utm_campaign=1656-vacccation.com&a_aid=1656&chan=code5",
            "short_url": "https://is.gd/hP35cu",
            "airport": "Katowice, Warszawa, Poznań",
            "likes": 573,
            "star_rating": "czterogwiazdkowy",
            "food": "All Inclusive"
        },
        {
            "page": 6,
            "wakacjeplURL": "https://www.wakacje.pl/wczasy/?str-6,firstminute,7-dni,do-3990zl,samolotem,3-gwiazdkowe,ocena-8,za-osobe",
            "hotel": "Pickalbatros Royal Moderna",
            "location": "Egipt / Sharm el Sheikh",
            "date": "13.06.2026- 20.06.2026",
            "formated_date": "2026-06-13",
            "price_per_person": "3897",
            "image_url": "https://i.wakacje.pl/no-index/hotel/pickalbatros-royal-moderna-basen-teren-hotelu-1487523124-343-228.jpg",
            "offer_url": "https://www.wakacje.pl/oferty/egipt/sharm-el-sheikh/pickalbatros-royal-moderna-419804.html?od-2026-06-13,7-dni&utm_source=travellead&utm_medium=cps&utm_campaign=1656-vacccation.com&a_aid=1656&chan=code5",
            "short_url": "https://is.gd/QfTFMP",
            "airport": "Katowice, Warszawa",
            "likes": 397,
            "star_rating": "pięciogwiazdkowy",
            "food": "All Inclusive"
        },
        {
            "page": 6,
            "wakacjeplURL": "https://www.wakacje.pl/wczasy/?str-6,firstminute,7-dni,do-3990zl,samolotem,3-gwiazdkowe,ocena-8,za-osobe",
            "hotel": "Minos Mare",
            "location": "Grecja / Kreta / Platanes",
            "date": "26.04.2026- 03.05.2026",
            "formated_date": "2026-04-26",
            "price_per_person": "3380",
            "image_url": "https://i.wakacje.pl/no-index/hotel/minos-mare-basen-1259968708-343-228.jpg",
            "offer_url": "https://www.wakacje.pl/oferty/grecja/kreta/platanes/minos-mare-574300.html?od-2026-04-26,7-dni&utm_source=travellead&utm_medium=cps&utm_campaign=1656-vacccation.com&a_aid=1656&chan=code5",
            "short_url": "https://is.gd/x4rFxX",
            "airport": "Poznań, Katowice, Wrocław",
            "likes": 1233,
            "star_rating": "czteroipółgwiazdkowy",
            "food": "All Inclusive"
        },
        {
            "page": 6,
            "wakacjeplURL": "https://www.wakacje.pl/wczasy/?str-6,firstminute,7-dni,do-3990zl,samolotem,3-gwiazdkowe,ocena-8,za-osobe",
            "hotel": "Sunrise (Pefkos)",
            "location": "Grecja / Rodos / Pefkos",
            "date": "04.05.2026- 11.05.2026",
            "formated_date": "2026-05-04",
            "price_per_person": "3009",
            "image_url": "https://i.wakacje.pl/no-index/hotel/sunrise-pefkos-plaza-obiekt-936408411-343-228.jpg",
            "offer_url": "https://www.wakacje.pl/oferty/grecja/rodos/pefkos/sunrise-pefkos-476759.html?od-2026-05-04,7-dni&utm_source=travellead&utm_medium=cps&utm_campaign=1656-vacccation.com&a_aid=1656&chan=code5",
            "short_url": "https://is.gd/M6ecJx",
            "airport": "Poznań, Katowice, Wrocław",
            "likes": 618,
            "star_rating": "czterogwiazdkowy",
            "food": "All Inclusive"
        },
        {
            "page": 6,
            "wakacjeplURL": "https://www.wakacje.pl/wczasy/?str-6,firstminute,7-dni,do-3990zl,samolotem,3-gwiazdkowe,ocena-8,za-osobe",
            "hotel": "Galeri Resort",
            "location": "Turcja / Riwiera Turecka / Okurcalar",
            "date": "24.04.2026- 01.05.2026",
            "formated_date": "2026-04-24",
            "price_per_person": "2423",
            "image_url": "https://i.wakacje.pl/no-index/hotel/galeri-resort-basen-teren-hotelu-obiekt-826626527-343-228.jpg",
            "offer_url": "https://www.wakacje.pl/oferty/turcja/riwiera-turecka/okurcalar/galeri-resort-208550.html?od-2026-04-24,7-dni&utm_source=travellead&utm_medium=cps&utm_campaign=1656-vacccation.com&a_aid=1656&chan=code5",
            "short_url": "https://is.gd/KZWsNy",
            "airport": "Zielona Góra, Gdańsk, Wrocław",
            "likes": 1304,
            "star_rating": "pięciogwiazdkowy",
            "food": "Ultra All Inclusive"
        },
        {
            "page": 6,
            "wakacjeplURL": "https://www.wakacje.pl/wczasy/?str-6,firstminute,7-dni,do-3990zl,samolotem,3-gwiazdkowe,ocena-8,za-osobe",
            "hotel": "St. Constantin",
            "location": "Grecja / Kreta / Kato Gouves",
            "date": "19.04.2026- 26.04.2026",
            "formated_date": "2026-04-19",
            "price_per_person": "2529",
            "image_url": "https://i.wakacje.pl/no-index/hotel/st-constantin-obiekt-teren-hotelu-basen-1256937261-343-228.jpg",
            "offer_url": "https://www.wakacje.pl/oferty/grecja/kreta/kato-gouves/st-constantin-476668.html?od-2026-04-19,7-dni&utm_source=travellead&utm_medium=cps&utm_campaign=1656-vacccation.com&a_aid=1656&chan=code5",
            "short_url": "https://is.gd/TnpvY5",
            "airport": "Poznań, Katowice, Wrocław",
            "likes": 949,
            "star_rating": "czterogwiazdkowy",
            "food": "All Inclusive"
        },
        {
            "page": 6,
            "wakacjeplURL": "https://www.wakacje.pl/wczasy/?str-6,firstminute,7-dni,do-3990zl,samolotem,3-gwiazdkowe,ocena-8,za-osobe",
            "hotel": "Mitsis Family Village",
            "location": "Grecja / Kos / Kardamena",
            "date": "25.04.2026- 02.05.2026",
            "formated_date": "2026-04-25",
            "price_per_person": "3083",
            "image_url": "https://i.wakacje.pl/no-index/hotel/mitsis-family-village-basen-1472459670-343-228.jpg",
            "offer_url": "https://www.wakacje.pl/oferty/grecja/kos/kardamena/mitsis-family-village-515427.html?od-2026-04-25,7-dni&utm_source=travellead&utm_medium=cps&utm_campaign=1656-vacccation.com&a_aid=1656&chan=code5",
            "short_url": "https://is.gd/bwSq9R",
            "airport": "Poznań, Katowice, Wrocław",
            "likes": 880,
            "star_rating": "czterogwiazdkowy",
            "food": "All Inclusive"
        },
        {
            "page": 6,
            "wakacjeplURL": "https://www.wakacje.pl/wczasy/?str-6,firstminute,7-dni,do-3990zl,samolotem,3-gwiazdkowe,ocena-8,za-osobe",
            "hotel": "Mitsis Cretan Village (ex. Aldemar Cretan Village)",
            "location": "Grecja / Kreta / Anissaras",
            "date": "19.04.2026- 26.04.2026",
            "formated_date": "2026-04-19",
            "price_per_person": "3196",
            "image_url": "https://i.wakacje.pl/no-index/hotel/mitsis-cretan-village-ex-aldemar-cretan-village-basen-835420381-343-228.jpg",
            "offer_url": "https://www.wakacje.pl/oferty/grecja/kreta/anissaras/mitsis-cretan-village-ex-aldemar-cretan-village-735786.html?od-2026-04-19,7-dni&utm_source=travellead&utm_medium=cps&utm_campaign=1656-vacccation.com&a_aid=1656&chan=code5",
            "short_url": "https://is.gd/1B5BZ4",
            "airport": "Poznań, Katowice, Wrocław",
            "likes": 569,
            "star_rating": "czteroipółgwiazdkowy",
            "food": "All Inclusive"
        }
    ]
}