{
    "offers": [
        {
            "page": 2,
            "wakacjeplURL": "https://www.wakacje.pl/lastminute/?str-2,7-dni,do-4990zl,samolotem,3-gwiazdkowe,ocena-8,za-osobe",
            "hotel": "Albatros Sea World Resort Marsa Alam",
            "location": "Egipt / Marsa El Alam / Al-Kusajr",
            "date": "08.01.2026- 15.01.2026",
            "formated_date": "2026-01-08",
            "price_per_person": "2522",
            "image_url": "https://i.wakacje.pl/no-index/hotel/albatros-sea-world-resort-marsa-alam-basen-930476251-343-228.jpg",
            "offer_url": "https://www.wakacje.pl/oferty/egipt/marsa-el-alam/al-kusajr/albatros-sea-world-resort-marsa-alam-795035.html?-od-2026-01-08,7-dni,all-inclusive&utm_source=travellead&utm_medium=cps&utm_campaign=1656-vacccation.com&a_aid=1656&chan=code5",
            "short_url": "https://is.gd/VUdtg2",
            "airport": "Katowice, Warszawa",
            "likes": 257,
            "star_rating": "pięciogwiazdkowy",
            "food": "All Inclusive"
        },
        {
            "page": 2,
            "wakacjeplURL": "https://www.wakacje.pl/lastminute/?str-2,7-dni,do-4990zl,samolotem,3-gwiazdkowe,ocena-8,za-osobe",
            "hotel": "Rewaya Majestic Resort",
            "location": "Egipt / Hurghada",
            "date": "09.01.2026- 16.01.2026",
            "formated_date": "2026-01-09",
            "price_per_person": "2007",
            "image_url": "https://i.wakacje.pl/no-index/hotel/albatros-sea-world-resort-marsa-alam-plaza-1486617339-343-228.jpg",
            "offer_url": "https://www.wakacje.pl/oferty/egipt/hurghada/hurghada/rewaya-majestic-resort-1010785.html?-od-2026-01-09,7-dni,all-inclusive&utm_source=travellead&utm_medium=cps&utm_campaign=1656-vacccation.com&a_aid=1656&chan=code5",
            "short_url": "https://is.gd/d51VXX",
            "airport": "Katowice, Warszawa, Poznań",
            "likes": 1507,
            "star_rating": "pięciogwiazdkowy",
            "food": "All Inclusive"
        },
        {
            "page": 2,
            "wakacjeplURL": "https://www.wakacje.pl/lastminute/?str-2,7-dni,do-4990zl,samolotem,3-gwiazdkowe,ocena-8,za-osobe",
            "hotel": "Radisson Individuals Marina Port Ghalib (ex. Sunrise Marina Resort)",
            "location": "Egipt / Marsa El Alam / Port Ghalib",
            "date": "13.01.2026- 20.01.2026",
            "formated_date": "2026-01-13",
            "price_per_person": "2229",
            "image_url": "https://i.wakacje.pl/no-index/hotel/albatros-sea-world-resort-marsa-alam-pokoj-930458388-343-228.jpg",
            "offer_url": "https://www.wakacje.pl/oferty/egipt/marsa-el-alam/port-ghalib/radisson-individuals-marina-port-ghalib-ex-sunrise-marina-resort-282238.html?-od-2026-01-13,7-dni,all-inclusive&utm_source=travellead&utm_medium=cps&utm_campaign=1656-vacccation.com&a_aid=1656&chan=code5",
            "short_url": "https://is.gd/OAiCoG",
            "airport": "Katowice, Warszawa, Rzeszów",
            "likes": 508,
            "star_rating": "pięciogwiazdkowy",
            "food": "All Inclusive"
        },
        {
            "page": 2,
            "wakacjeplURL": "https://www.wakacje.pl/lastminute/?str-2,7-dni,do-4990zl,samolotem,3-gwiazdkowe,ocena-8,za-osobe",
            "hotel": "Three Corners Sea Beach",
            "location": "Egipt / Marsa El Alam",
            "date": "15.01.2026- 22.01.2026",
            "formated_date": "2026-01-15",
            "price_per_person": "2469",
            "image_url": "https://i.wakacje.pl/no-index/hotel/albatros-sea-world-resort-marsa-alam-zjezdzalnia-basen-930488277-343-228.jpg",
            "offer_url": "https://www.wakacje.pl/oferty/egipt/marsa-el-alam/three-corners-sea-beach-910366.html?-od-2026-01-15,7-dni,all-inclusive&utm_source=travellead&utm_medium=cps&utm_campaign=1656-vacccation.com&a_aid=1656&chan=code5",
            "short_url": "https://is.gd/hkOi7D",
            "airport": "Katowice, Warszawa",
            "likes": 2156,
            "star_rating": "czterogwiazdkowy",
            "food": "All Inclusive"
        },
        {
            "page": 2,
            "wakacjeplURL": "https://www.wakacje.pl/lastminute/?str-2,7-dni,do-4990zl,samolotem,3-gwiazdkowe,ocena-8,za-osobe",
            "hotel": "Hilton Marsa Alam Nubian Resort",
            "location": "Egipt / Marsa El Alam",
            "date": "13.01.2026- 20.01.2026",
            "formated_date": "2026-01-13",
            "price_per_person": "2668",
            "image_url": "https://i.wakacje.pl/no-index/hotel/albatros-sea-world-resort-marsa-alam-drink-bar-1757367737-343-228.jpg",
            "offer_url": "https://www.wakacje.pl/oferty/egipt/marsa-el-alam/hilton-marsa-alam-nubian-resort-259156.html?-od-2026-01-13,7-dni,all-inclusive&utm_source=travellead&utm_medium=cps&utm_campaign=1656-vacccation.com&a_aid=1656&chan=code5",
            "short_url": "https://is.gd/3Izmxe",
            "airport": "Katowice, Warszawa, Rzeszów",
            "likes": 1281,
            "star_rating": "pięciogwiazdkowy",
            "food": "All Inclusive"
        },
        {
            "page": 2,
            "wakacjeplURL": "https://www.wakacje.pl/lastminute/?str-2,7-dni,do-4990zl,samolotem,3-gwiazdkowe,ocena-8,za-osobe",
            "hotel": "Casa Blue Luxury Resort",
            "location": "Egipt / Marsa El Alam / Port Ghalib",
            "date": "10.01.2026- 18.01.2026",
            "formated_date": "2026-01-10",
            "price_per_person": "3178",
            "image_url": "https://i.wakacje.pl/no-index/hotel/albatros-sea-world-resort-marsa-alam-basen-1486617401-343-228.jpg",
            "offer_url": "https://www.wakacje.pl/oferty/egipt/marsa-el-alam/port-ghalib/casa-blue-luxury-resort-752736.html?-od-2026-01-10,7-dni,all-inclusive&utm_source=travellead&utm_medium=cps&utm_campaign=1656-vacccation.com&a_aid=1656&chan=code5",
            "short_url": "https://is.gd/okT9Rs",
            "airport": "Gdańsk, Poznań, Warszawa",
            "likes": 1038,
            "star_rating": "pięciogwiazdkowy",
            "food": "All Inclusive 24h"
        },
        {
            "page": 2,
            "wakacjeplURL": "https://www.wakacje.pl/lastminute/?str-2,7-dni,do-4990zl,samolotem,3-gwiazdkowe,ocena-8,za-osobe",
            "hotel": "Jaz Aquamarine (ex. Iberotel Aquamarine)",
            "location": "Egipt / Hurghada",
            "date": "11.01.2026- 18.01.2026",
            "formated_date": "2026-01-11",
            "price_per_person": "2772",
            "image_url": "https://i.wakacje.pl/no-index/hotel/albatros-sea-world-resort-marsa-alam-teren-hotelu-930458660-343-228.jpg",
            "offer_url": "https://www.wakacje.pl/oferty/egipt/hurghada/hurghada/jaz-aquamarine-ex-iberotel-aquamarine-910415.html?-od-2026-01-11,7-dni,all-inclusive&utm_source=travellead&utm_medium=cps&utm_campaign=1656-vacccation.com&a_aid=1656&chan=code5",
            "short_url": "https://is.gd/Nuof41",
            "airport": "Katowice, Warszawa, Wrocław",
            "likes": 138,
            "star_rating": "pięciogwiazdkowy",
            "food": "All Inclusive"
        },
        {
            "page": 2,
            "wakacjeplURL": "https://www.wakacje.pl/lastminute/?str-2,7-dni,do-4990zl,samolotem,3-gwiazdkowe,ocena-8,za-osobe",
            "hotel": "The Cove Rotana Resort",
            "location": "Emiraty Arabskie / Ras al-Khaimah",
            "date": "11.01.2026- 18.01.2026",
            "formated_date": "2026-01-11",
            "price_per_person": "4559",
            "image_url": "https://i.wakacje.pl/no-index/hotel/albatros-sea-world-resort-marsa-alam-recepcja-lobby-1757367735-343-228.jpg",
            "offer_url": "https://www.wakacje.pl/oferty/emiraty-arabskie/ras-al-khaimah/ras-al-khaimah/the-cove-rotana-resort-997599.html?-od-2026-01-11,7-dni,all-inclusive&utm_source=travellead&utm_medium=cps&utm_campaign=1656-vacccation.com&a_aid=1656&chan=code5",
            "short_url": "https://is.gd/yYMmAD",
            "airport": "Warszawa, Katowice, Poznań",
            "likes": 2031,
            "star_rating": "pięciogwiazdkowy",
            "food": "All Inclusive"
        },
        {
            "page": 2,
            "wakacjeplURL": "https://www.wakacje.pl/lastminute/?str-2,7-dni,do-4990zl,samolotem,3-gwiazdkowe,ocena-8,za-osobe",
            "hotel": "Jaz Aquamarine (ex. Iberotel Aquamarine)",
            "location": "Egipt / Hurghada",
            "date": "15.01.2026- 22.01.2026",
            "formated_date": "2026-01-15",
            "price_per_person": "2868",
            "image_url": "https://i.wakacje.pl/no-index/hotel/albatros-sea-world-resort-marsa-alam-recepcja-lobby-1757367736-343-228.jpg",
            "offer_url": "https://www.wakacje.pl/oferty/egipt/hurghada/hurghada/jaz-aquamarine-ex-iberotel-aquamarine-12693.html?-od-2026-01-15,7-dni,all-inclusive&utm_source=travellead&utm_medium=cps&utm_campaign=1656-vacccation.com&a_aid=1656&chan=code5",
            "short_url": "https://is.gd/dOaIQb",
            "airport": "Katowice, Warszawa, Gdańsk",
            "likes": 1081,
            "star_rating": "pięciogwiazdkowy",
            "food": "All Inclusive"
        },
        {
            "page": 2,
            "wakacjeplURL": "https://www.wakacje.pl/lastminute/?str-2,7-dni,do-4990zl,samolotem,3-gwiazdkowe,ocena-8,za-osobe",
            "hotel": "Jaz Lamaya Resort (ex Iberotel)",
            "location": "Egipt / Marsa El Alam / Madinat Coraya",
            "date": "13.01.2026- 20.01.2026",
            "formated_date": "2026-01-13",
            "price_per_person": "3033",
            "image_url": "https://i.wakacje.pl/no-index/hotel/albatros-sea-world-resort-marsa-alam-pokoj-1757367752-343-228.jpg",
            "offer_url": "https://www.wakacje.pl/oferty/egipt/marsa-el-alam/madinat-coraya/jaz-lamaya-resort-ex-iberotel-351089.html?-od-2026-01-13,7-dni,all-inclusive&utm_source=travellead&utm_medium=cps&utm_campaign=1656-vacccation.com&a_aid=1656&chan=code5",
            "short_url": "https://is.gd/LmepQh",
            "airport": "Katowice, Warszawa, Rzeszów",
            "likes": 2426,
            "star_rating": "pięciogwiazdkowy",
            "food": "All Inclusive"
        },
        {
            "page": 3,
            "wakacjeplURL": "https://www.wakacje.pl/lastminute/?str-3,7-dni,do-4990zl,samolotem,3-gwiazdkowe,ocena-8,za-osobe",
            "hotel": "Ali Baba Palace",
            "location": "Egipt / Hurghada",
            "date": "09.01.2026- 16.01.2026",
            "formated_date": "2026-01-09",
            "price_per_person": "2295",
            "image_url": "https://i.wakacje.pl/no-index/hotel/ali-baba-palace-teren-hotelu-basen-825076813-343-228.jpg",
            "offer_url": "https://www.wakacje.pl/oferty/egipt/hurghada/hurghada/ali-baba-palace-757108.html?-od-2026-01-09,7-dni,all-inclusive&utm_source=travellead&utm_medium=cps&utm_campaign=1656-vacccation.com&a_aid=1656&chan=code5",
            "short_url": "https://is.gd/y3UWFU",
            "airport": "Katowice, Warszawa, Poznań",
            "likes": 1354,
            "star_rating": "czterogwiazdkowy",
            "food": "All Inclusive"
        },
        {
            "page": 3,
            "wakacjeplURL": "https://www.wakacje.pl/lastminute/?str-3,7-dni,do-4990zl,samolotem,3-gwiazdkowe,ocena-8,za-osobe",
            "hotel": "Oasis Atlantico Belorizonte",
            "location": "Wyspy Zielonego Przylądka / Sal / Santa Maria",
            "date": "09.01.2026- 17.01.2026",
            "formated_date": "2026-01-09",
            "price_per_person": "4629",
            "image_url": "https://i.wakacje.pl/no-index/hotel/ali-baba-palace-plaza-804031152-343-228.jpg",
            "offer_url": "https://www.wakacje.pl/oferty/wyspy-zielonego-przyladka/sal/santa-maria/oasis-atlantico-belorizonte-441850.html?-od-2026-01-09,7-dni,all-inclusive&utm_source=travellead&utm_medium=cps&utm_campaign=1656-vacccation.com&a_aid=1656&chan=code5",
            "short_url": "https://is.gd/WErrYg",
            "airport": "Katowice, Warszawa",
            "likes": 1892,
            "star_rating": "czterogwiazdkowy",
            "food": "All Inclusive"
        },
        {
            "page": 3,
            "wakacjeplURL": "https://www.wakacje.pl/lastminute/?str-3,7-dni,do-4990zl,samolotem,3-gwiazdkowe,ocena-8,za-osobe",
            "hotel": "Pickalbatros Portofino Marsa Alam",
            "location": "Egipt / Marsa El Alam",
            "date": "10.01.2026- 18.01.2026",
            "formated_date": "2026-01-10",
            "price_per_person": "2429",
            "image_url": "https://i.wakacje.pl/no-index/hotel/ali-baba-palace-teren-hotelu-aquapark-789204281-343-228.jpg",
            "offer_url": "https://www.wakacje.pl/oferty/egipt/marsa-el-alam/pickalbatros-portofino-marsa-alam-776034.html?-od-2026-01-10,7-dni,all-inclusive&utm_source=travellead&utm_medium=cps&utm_campaign=1656-vacccation.com&a_aid=1656&chan=code5",
            "short_url": "https://is.gd/PhAyQd",
            "airport": "Warszawa, Katowice, Poznań",
            "likes": 1299,
            "star_rating": "czterogwiazdkowy",
            "food": "All Inclusive"
        },
        {
            "page": 3,
            "wakacjeplURL": "https://www.wakacje.pl/lastminute/?str-3,7-dni,do-4990zl,samolotem,3-gwiazdkowe,ocena-8,za-osobe",
            "hotel": "Pickalbatros Sands Port Ghalib (ex. Red Sea Siva Sands)",
            "location": "Egipt / Marsa El Alam / Port Ghalib",
            "date": "13.01.2026- 20.01.2026",
            "formated_date": "2026-01-13",
            "price_per_person": "2639",
            "image_url": "https://i.wakacje.pl/no-index/hotel/ali-baba-palace-aquapark-zjezdzalnia-789204278-343-228.jpg",
            "offer_url": "https://www.wakacje.pl/oferty/egipt/marsa-el-alam/port-ghalib/pickalbatros-sands-port-ghalib-ex-red-sea-siva-sands-958505.html?-od-2026-01-13,7-dni,all-inclusive&utm_source=travellead&utm_medium=cps&utm_campaign=1656-vacccation.com&a_aid=1656&chan=code5",
            "short_url": "https://is.gd/EBW71I",
            "airport": "Katowice, Warszawa, Rzeszów",
            "likes": 1797,
            "star_rating": "pięciogwiazdkowy",
            "food": "All Inclusive"
        },
        {
            "page": 3,
            "wakacjeplURL": "https://www.wakacje.pl/lastminute/?str-3,7-dni,do-4990zl,samolotem,3-gwiazdkowe,ocena-8,za-osobe",
            "hotel": "Rose Rayhaan by Rotana",
            "location": "Emiraty Arabskie / Dubaj",
            "date": "16.01.2026- 24.01.2026",
            "formated_date": "2026-01-16",
            "price_per_person": "4911",
            "image_url": "https://i.wakacje.pl/no-index/hotel/ali-baba-palace-teren-hotelu-1465490221-343-228.jpg",
            "offer_url": "https://www.wakacje.pl/oferty/emiraty-arabskie/dubaj/dubaj/rose-rayhaan-by-rotana-801703.html?-od-2026-01-16,7-dni,all-inclusive&utm_source=travellead&utm_medium=cps&utm_campaign=1656-vacccation.com&a_aid=1656&chan=code5",
            "short_url": "https://is.gd/b8dU0q",
            "airport": "Gdańsk, Katowice, Poznań",
            "likes": 1073,
            "star_rating": "czterogwiazdkowy",
            "food": "Śniadania (BB)"
        },
        {
            "page": 3,
            "wakacjeplURL": "https://www.wakacje.pl/lastminute/?str-3,7-dni,do-4990zl,samolotem,3-gwiazdkowe,ocena-8,za-osobe",
            "hotel": "Doubletree By Hilton Resort & Spa Marjan Island",
            "location": "Emiraty Arabskie / Ras al-Khaimah / Marjan Island",
            "date": "09.01.2026- 16.01.2026",
            "formated_date": "2026-01-09",
            "price_per_person": "4989",
            "image_url": "https://i.wakacje.pl/no-index/hotel/ali-baba-palace-teren-hotelu-1465490203-343-228.jpg",
            "offer_url": "https://www.wakacje.pl/oferty/emiraty-arabskie/ras-al-khaimah/marjan-island/doubletree-by-hilton-resort-spa-marjan-island-985651.html?-od-2026-01-09,7-dni,all-inclusive&utm_source=travellead&utm_medium=cps&utm_campaign=1656-vacccation.com&a_aid=1656&chan=code5",
            "short_url": "https://is.gd/jFgfNr",
            "airport": "Warszawa, Katowice, Poznań",
            "likes": 1618,
            "star_rating": "pięciogwiazdkowy",
            "food": "All Inclusive"
        },
        {
            "page": 3,
            "wakacjeplURL": "https://www.wakacje.pl/lastminute/?str-3,7-dni,do-4990zl,samolotem,3-gwiazdkowe,ocena-8,za-osobe",
            "hotel": "Barcelo Mussanah Resort (ex Millenium Resort Mussanah)",
            "location": "Oman / Al Batina / Al Mudayq",
            "date": "07.01.2026- 14.01.2026",
            "formated_date": "2026-01-07",
            "price_per_person": "3929",
            "image_url": "https://i.wakacje.pl/no-index/hotel/ali-baba-palace-teren-hotelu-825076807-343-228.jpg",
            "offer_url": "https://www.wakacje.pl/oferty/oman/al-batina/al-mudayq/barcelo-mussanah-resort-ex-millenium-resort-mussanah-719355.html?-od-2026-01-07,7-dni,all-inclusive&utm_source=travellead&utm_medium=cps&utm_campaign=1656-vacccation.com&a_aid=1656&chan=code5",
            "short_url": "https://is.gd/pzeSFV",
            "airport": "Warszawa, Katowice",
            "likes": 2205,
            "star_rating": "czterogwiazdkowy",
            "food": "All Inclusive"
        },
        {
            "page": 3,
            "wakacjeplURL": "https://www.wakacje.pl/lastminute/?str-3,7-dni,do-4990zl,samolotem,3-gwiazdkowe,ocena-8,za-osobe",
            "hotel": "Stella Gardens Resort & Spa (ex Stella Di Mare Gardens)",
            "location": "Egipt / Hurghada / Makadi Bay",
            "date": "11.01.2026- 18.01.2026",
            "formated_date": "2026-01-11",
            "price_per_person": "1983",
            "image_url": "https://i.wakacje.pl/no-index/hotel/ali-baba-palace-recepcja-lobby-1465490186-343-228.jpg",
            "offer_url": "https://www.wakacje.pl/oferty/egipt/hurghada/makadi-bay/stella-gardens-resort-spa-ex-stella-di-mare-gardens-910357.html?-od-2026-01-11,7-dni,all-inclusive&utm_source=travellead&utm_medium=cps&utm_campaign=1656-vacccation.com&a_aid=1656&chan=code5",
            "short_url": "https://is.gd/bhwODb",
            "airport": "Katowice, Warszawa, Wrocław",
            "likes": 1890,
            "star_rating": "pięciogwiazdkowy",
            "food": "All Inclusive"
        },
        {
            "page": 3,
            "wakacjeplURL": "https://www.wakacje.pl/lastminute/?str-3,7-dni,do-4990zl,samolotem,3-gwiazdkowe,ocena-8,za-osobe",
            "hotel": "Aladdin Beach Resort",
            "location": "Egipt / Hurghada",
            "date": "09.01.2026- 16.01.2026",
            "formated_date": "2026-01-09",
            "price_per_person": "2194",
            "image_url": "https://i.wakacje.pl/no-index/hotel/ali-baba-palace-pokoj-804031168-343-228.jpg",
            "offer_url": "https://www.wakacje.pl/oferty/egipt/hurghada/hurghada/aladdin-beach-resort-757106.html?-od-2026-01-09,7-dni,all-inclusive&utm_source=travellead&utm_medium=cps&utm_campaign=1656-vacccation.com&a_aid=1656&chan=code5",
            "short_url": "https://is.gd/D978su",
            "airport": "Katowice, Warszawa, Poznań",
            "likes": 1908,
            "star_rating": "czterogwiazdkowy",
            "food": "All Inclusive"
        },
        {
            "page": 3,
            "wakacjeplURL": "https://www.wakacje.pl/lastminute/?str-3,7-dni,do-4990zl,samolotem,3-gwiazdkowe,ocena-8,za-osobe",
            "hotel": "Reef Oasis Suakin Resort",
            "location": "Egipt / Marsa El Alam",
            "date": "09.01.2026- 16.01.2026",
            "formated_date": "2026-01-09",
            "price_per_person": "2728",
            "image_url": "https://i.wakacje.pl/no-index/hotel/ali-baba-palace-pokoj-843370346-343-228.jpg",
            "offer_url": "https://www.wakacje.pl/oferty/egipt/marsa-el-alam/reef-oasis-suakin-resort-810970.html?-od-2026-01-09,7-dni,all-inclusive&utm_source=travellead&utm_medium=cps&utm_campaign=1656-vacccation.com&a_aid=1656&chan=code5",
            "short_url": "https://is.gd/159o8O",
            "airport": "Gdańsk, Poznań, Warszawa",
            "likes": 505,
            "star_rating": "pięciogwiazdkowy",
            "food": "All Inclusive"
        },
        {
            "page": 4,
            "wakacjeplURL": "https://www.wakacje.pl/lastminute/?str-4,7-dni,do-4990zl,samolotem,3-gwiazdkowe,ocena-8,za-osobe",
            "hotel": "Calimera Blend Paradise",
            "location": "Egipt / Hurghada",
            "date": "11.01.2026- 19.01.2026",
            "formated_date": "2026-01-11",
            "price_per_person": "2229",
            "image_url": "https://i.wakacje.pl/no-index/zdjecie/id/20001403110-343-228.jpg",
            "offer_url": "https://www.wakacje.pl/oferty/egipt/hurghada/hurghada/calimera-blend-paradise-733939.html?-od-2026-01-11,7-dni,all-inclusive&utm_source=travellead&utm_medium=cps&utm_campaign=1656-vacccation.com&a_aid=1656&chan=code5",
            "short_url": "https://is.gd/1sEeth",
            "airport": "Gdańsk, Poznań, Warszawa",
            "likes": 584,
            "star_rating": "pięciogwiazdkowy",
            "food": "All Inclusive"
        },
        {
            "page": 4,
            "wakacjeplURL": "https://www.wakacje.pl/lastminute/?str-4,7-dni,do-4990zl,samolotem,3-gwiazdkowe,ocena-8,za-osobe",
            "hotel": "Hampton by Hilton Marjan Island",
            "location": "Emiraty Arabskie / Ras al-Khaimah",
            "date": "09.01.2026- 16.01.2026",
            "formated_date": "2026-01-09",
            "price_per_person": "4189",
            "image_url": "https://i.wakacje.pl/no-index/zdjecie/id/20001403111-343-228.jpg",
            "offer_url": "https://www.wakacje.pl/oferty/emiraty-arabskie/ras-al-khaimah/ras-al-khaimah/hampton-by-hilton-marjan-island-985910.html?-od-2026-01-09,7-dni,all-inclusive&utm_source=travellead&utm_medium=cps&utm_campaign=1656-vacccation.com&a_aid=1656&chan=code5",
            "short_url": "https://is.gd/Hcc392",
            "airport": "Warszawa, Katowice, Poznań",
            "likes": 1371,
            "star_rating": "czterogwiazdkowy",
            "food": "All Inclusive"
        },
        {
            "page": 4,
            "wakacjeplURL": "https://www.wakacje.pl/lastminute/?str-4,7-dni,do-4990zl,samolotem,3-gwiazdkowe,ocena-8,za-osobe",
            "hotel": "Delphin Imperial Lara",
            "location": "Turcja / Riwiera Turecka / Antalya",
            "date": "17.01.2026- 24.01.2026",
            "formated_date": "2026-01-17",
            "price_per_person": "3179",
            "image_url": "https://i.wakacje.pl/no-index/zdjecie/id/20001403112-343-228.jpg",
            "offer_url": "https://www.wakacje.pl/oferty/turcja/riwiera-turecka/antalya/delphin-imperial-lara-209938.html?-od-2026-01-17,7-dni,all-inclusive&utm_source=travellead&utm_medium=cps&utm_campaign=1656-vacccation.com&a_aid=1656&chan=code5",
            "short_url": "https://is.gd/PTjUhv",
            "airport": "Gdańsk, Wrocław, Katowice",
            "likes": 2333,
            "star_rating": "pięciogwiazdkowy",
            "food": "Ultra All Inclusive"
        },
        {
            "page": 4,
            "wakacjeplURL": "https://www.wakacje.pl/lastminute/?str-4,7-dni,do-4990zl,samolotem,3-gwiazdkowe,ocena-8,za-osobe",
            "hotel": "Palm Beach Resort (Hurghada)",
            "location": "Egipt / Hurghada",
            "date": "05.01.2026- 12.01.2026",
            "formated_date": "2026-01-05",
            "price_per_person": "2470",
            "image_url": "https://i.wakacje.pl/no-index/zdjecie/id/20001489143-343-228.jpg",
            "offer_url": "https://www.wakacje.pl/oferty/egipt/hurghada/hurghada/palm-beach-resort-hurghada-784993.html?-od-2026-01-05,7-dni,all-inclusive&utm_source=travellead&utm_medium=cps&utm_campaign=1656-vacccation.com&a_aid=1656&chan=code5",
            "short_url": "https://is.gd/pSJ2Oq",
            "airport": "Katowice, Warszawa, Poznań",
            "likes": 1024,
            "star_rating": "czterogwiazdkowy",
            "food": "All Inclusive"
        },
        {
            "page": 4,
            "wakacjeplURL": "https://www.wakacje.pl/lastminute/?str-4,7-dni,do-4990zl,samolotem,3-gwiazdkowe,ocena-8,za-osobe",
            "hotel": "Sataya Resort (ex. Labranda Sataya Marsa Alam)",
            "location": "Egipt / Marsa El Alam / Port Ghalib",
            "date": "06.01.2026- 13.01.2026",
            "formated_date": "2026-01-06",
            "price_per_person": "2178",
            "image_url": "https://i.wakacje.pl/no-index/zdjecie/id/20001403115-343-228.jpg",
            "offer_url": "https://www.wakacje.pl/oferty/egipt/marsa-el-alam/port-ghalib/sataya-resort-ex-labranda-sataya-marsa-alam-665425.html?-od-2026-01-06,7-dni,all-inclusive&utm_source=travellead&utm_medium=cps&utm_campaign=1656-vacccation.com&a_aid=1656&chan=code5",
            "short_url": "https://is.gd/Zm4evZ",
            "airport": "Warszawa, Katowice, Poznań",
            "likes": 2035,
            "star_rating": "pięciogwiazdkowy",
            "food": "All Inclusive"
        },
        {
            "page": 4,
            "wakacjeplURL": "https://www.wakacje.pl/lastminute/?str-4,7-dni,do-4990zl,samolotem,3-gwiazdkowe,ocena-8,za-osobe",
            "hotel": "Casa Mare Resort (ex. Royal Tulip Beach Resort)",
            "location": "Egipt / Marsa El Alam / Port Ghalib",
            "date": "06.01.2026- 13.01.2026",
            "formated_date": "2026-01-06",
            "price_per_person": "1729",
            "image_url": "https://i.wakacje.pl/no-index/zdjecie/id/20001403116-343-228.jpg",
            "offer_url": "https://www.wakacje.pl/oferty/egipt/marsa-el-alam/port-ghalib/casa-mare-resort-ex-royal-tulip-beach-resort-412351.html?-od-2026-01-06,7-dni,all-inclusive&utm_source=travellead&utm_medium=cps&utm_campaign=1656-vacccation.com&a_aid=1656&chan=code5",
            "short_url": "https://is.gd/V3x0s7",
            "airport": "Gdańsk, Poznań, Warszawa",
            "likes": 539,
            "star_rating": "pięciogwiazdkowy",
            "food": "All Inclusive"
        },
        {
            "page": 4,
            "wakacjeplURL": "https://www.wakacje.pl/lastminute/?str-4,7-dni,do-4990zl,samolotem,3-gwiazdkowe,ocena-8,za-osobe",
            "hotel": "Fuerteventura Princess",
            "location": "Hiszpania / Fuerteventura / Playa Esquinzo",
            "date": "05.01.2026- 12.01.2026",
            "formated_date": "2026-01-05",
            "price_per_person": "2829",
            "image_url": "https://i.wakacje.pl/no-index/zdjecie/id/20001403119-343-228.jpg",
            "offer_url": "https://www.wakacje.pl/oferty/hiszpania/fuerteventura/playa-esquinzo/fuerteventura-princess-480073.html?-od-2026-01-05,7-dni,all-inclusive&utm_source=travellead&utm_medium=cps&utm_campaign=1656-vacccation.com&a_aid=1656&chan=code5",
            "short_url": "https://is.gd/NDZ1z8",
            "airport": "Warszawa, Katowice, Poznań",
            "likes": 373,
            "star_rating": "czterogwiazdkowy",
            "food": "All Inclusive"
        },
        {
            "page": 4,
            "wakacjeplURL": "https://www.wakacje.pl/lastminute/?str-4,7-dni,do-4990zl,samolotem,3-gwiazdkowe,ocena-8,za-osobe",
            "hotel": "Pickalbatros Royal Moderna",
            "location": "Egipt / Sharm el Sheikh",
            "date": "11.01.2026- 18.01.2026",
            "formated_date": "2026-01-11",
            "price_per_person": "2447",
            "image_url": "https://i.wakacje.pl/no-index/zdjecie/id/20001403121-343-228.jpg",
            "offer_url": "https://www.wakacje.pl/oferty/egipt/sharm-el-sheikh/pickalbatros-royal-moderna-876998.html?-od-2026-01-11,7-dni,all-inclusive&utm_source=travellead&utm_medium=cps&utm_campaign=1656-vacccation.com&a_aid=1656&chan=code5",
            "short_url": "https://is.gd/uEt3T8",
            "airport": "Katowice, Warszawa, Wrocław",
            "likes": 1693,
            "star_rating": "pięciogwiazdkowy",
            "food": "All Inclusive"
        },
        {
            "page": 4,
            "wakacjeplURL": "https://www.wakacje.pl/lastminute/?str-4,7-dni,do-4990zl,samolotem,3-gwiazdkowe,ocena-8,za-osobe",
            "hotel": "Sirena Beach Resort & Spa",
            "location": "Egipt / Marsa El Alam / Al-Kusajr",
            "date": "13.01.2026- 20.01.2026",
            "formated_date": "2026-01-13",
            "price_per_person": "2451",
            "image_url": "https://i.wakacje.pl/no-index/zdjecie/id/20001489144-343-228.jpg",
            "offer_url": "https://www.wakacje.pl/oferty/egipt/marsa-el-alam/al-kusajr/sirena-beach-resort-spa-813153.html?-od-2026-01-13,7-dni,all-inclusive&utm_source=travellead&utm_medium=cps&utm_campaign=1656-vacccation.com&a_aid=1656&chan=code5",
            "short_url": "https://is.gd/nruTct",
            "airport": "Katowice, Warszawa, Rzeszów",
            "likes": 2009,
            "star_rating": "pięciogwiazdkowy",
            "food": "All Inclusive"
        },
        {
            "page": 4,
            "wakacjeplURL": "https://www.wakacje.pl/lastminute/?str-4,7-dni,do-4990zl,samolotem,3-gwiazdkowe,ocena-8,za-osobe",
            "hotel": "Sea Gull Beach Resort (Hurghada)",
            "location": "Egipt / Hurghada",
            "date": "14.01.2026- 21.01.2026",
            "formated_date": "2026-01-14",
            "price_per_person": "2203",
            "image_url": "https://i.wakacje.pl/no-index/zdjecie/id/20001403126-343-228.jpg",
            "offer_url": "https://www.wakacje.pl/oferty/egipt/hurghada/hurghada/sea-gull-beach-resort-hurghada-17600.html?-od-2026-01-14,7-dni,all-inclusive&utm_source=travellead&utm_medium=cps&utm_campaign=1656-vacccation.com&a_aid=1656&chan=code5",
            "short_url": "https://is.gd/kyTCIv",
            "airport": "Katowice, Warszawa, Gdańsk",
            "likes": 380,
            "star_rating": "czterogwiazdkowy",
            "food": "All Inclusive"
        },
        {
            "page": 5,
            "wakacjeplURL": "https://www.wakacje.pl/lastminute/?str-5,7-dni,do-4990zl,samolotem,3-gwiazdkowe,ocena-8,za-osobe",
            "hotel": "Salamis Bay Conti",
            "location": "Cypr / Cypr Północny / Famagusta (Gazimagusa)",
            "date": "13.01.2026- 20.01.2026",
            "formated_date": "2026-01-13",
            "price_per_person": "2769",
            "image_url": "https://i.wakacje.pl/no-index/hotel/salamis-bay-conti-plaza-sport-i-rekreacja-beach-bar-824358483-343-228.jpg",
            "offer_url": "https://www.wakacje.pl/oferty/cypr/cypr-polnocny/famagusta-gazimagusa/salamis-bay-conti-1009735.html?-od-2026-01-13,7-dni,all-inclusive&utm_source=travellead&utm_medium=cps&utm_campaign=1656-vacccation.com&a_aid=1656&chan=code5",
            "short_url": "https://is.gd/QfBTVU",
            "airport": "Berlin, Warszawa, Katowice",
            "likes": 196,
            "star_rating": "pięciogwiazdkowy",
            "food": "Ultra All Inclusive"
        },
        {
            "page": 5,
            "wakacjeplURL": "https://www.wakacje.pl/lastminute/?str-5,7-dni,do-4990zl,samolotem,3-gwiazdkowe,ocena-8,za-osobe",
            "hotel": "Calimera Blend Paradise",
            "location": "Egipt / Hurghada",
            "date": "08.01.2026- 15.01.2026",
            "formated_date": "2026-01-08",
            "price_per_person": "2001",
            "image_url": "https://i.wakacje.pl/no-index/hotel/salamis-bay-conti-plaza-obiekt-767563804-343-228.jpg",
            "offer_url": "https://www.wakacje.pl/oferty/egipt/hurghada/hurghada/calimera-blend-paradise-1076792.html?-od-2026-01-08,7-dni,all-inclusive&utm_source=travellead&utm_medium=cps&utm_campaign=1656-vacccation.com&a_aid=1656&chan=code5",
            "short_url": "https://is.gd/32aHT9L",
            "airport": "Warszawa, Poznań, Wrocław",
            "likes": 1700,
            "star_rating": "pięciogwiazdkowy",
            "food": "All Inclusive"
        },
        {
            "page": 5,
            "wakacjeplURL": "https://www.wakacje.pl/lastminute/?str-5,7-dni,do-4990zl,samolotem,3-gwiazdkowe,ocena-8,za-osobe",
            "hotel": "Jaz Mirabel Park",
            "location": "Egipt / Sharm el Sheikh",
            "date": "11.01.2026- 18.01.2026",
            "formated_date": "2026-01-11",
            "price_per_person": "2003",
            "image_url": "https://i.wakacje.pl/no-index/hotel/salamis-bay-conti-aquapark-teren-hotelu-767563807-343-228.jpg",
            "offer_url": "https://www.wakacje.pl/oferty/egipt/sharm-el-sheikh/jaz-mirabel-park-1053498.html?-od-2026-01-11,7-dni,all-inclusive&utm_source=travellead&utm_medium=cps&utm_campaign=1656-vacccation.com&a_aid=1656&chan=code5",
            "short_url": "https://is.gd/XJPRQP",
            "airport": "Katowice, Warszawa, Wrocław",
            "likes": 888,
            "star_rating": "pięciogwiazdkowy",
            "food": "All Inclusive"
        },
        {
            "page": 5,
            "wakacjeplURL": "https://www.wakacje.pl/lastminute/?str-5,7-dni,do-4990zl,samolotem,3-gwiazdkowe,ocena-8,za-osobe",
            "hotel": "Jaz Solaya (ex Sol Y Mar Solaya)",
            "location": "Egipt / Marsa El Alam",
            "date": "13.01.2026- 21.01.2026",
            "formated_date": "2026-01-13",
            "price_per_person": "2890",
            "image_url": "https://i.wakacje.pl/no-index/hotel/salamis-bay-conti-teren-hotelu-1466317866-343-228.jpg",
            "offer_url": "https://www.wakacje.pl/oferty/egipt/marsa-el-alam/jaz-solaya-ex-sol-y-mar-solaya-910405.html?-od-2026-01-13,7-dni,all-inclusive&utm_source=travellead&utm_medium=cps&utm_campaign=1656-vacccation.com&a_aid=1656&chan=code5",
            "short_url": "https://is.gd/YLReoI",
            "airport": "Katowice, Warszawa, Poznań",
            "likes": 1305,
            "star_rating": "pięciogwiazdkowy",
            "food": "All Inclusive"
        },
        {
            "page": 5,
            "wakacjeplURL": "https://www.wakacje.pl/lastminute/?str-5,7-dni,do-4990zl,samolotem,3-gwiazdkowe,ocena-8,za-osobe",
            "hotel": "Pickalbatros Jungle Aqua Park by Neverland",
            "location": "Egipt / Hurghada",
            "date": "14.01.2026- 21.01.2026",
            "formated_date": "2026-01-14",
            "price_per_person": "2575",
            "image_url": "https://i.wakacje.pl/no-index/hotel/salamis-bay-conti-balkon-taras-pokoj-1771428077-343-228.jpg",
            "offer_url": "https://www.wakacje.pl/oferty/egipt/hurghada/hurghada/pickalbatros-jungle-aqua-park-by-neverland-406360.html?-od-2026-01-14,7-dni,all-inclusive&utm_source=travellead&utm_medium=cps&utm_campaign=1656-vacccation.com&a_aid=1656&chan=code5",
            "short_url": "https://is.gd/JcGibQ",
            "airport": "Katowice, Warszawa, Gdańsk",
            "likes": 612,
            "star_rating": "czterogwiazdkowy",
            "food": "All Inclusive"
        },
        {
            "page": 5,
            "wakacjeplURL": "https://www.wakacje.pl/lastminute/?str-5,7-dni,do-4990zl,samolotem,3-gwiazdkowe,ocena-8,za-osobe",
            "hotel": "R2 Rio Calma",
            "location": "Hiszpania / Fuerteventura / Costa Calma",
            "date": "05.01.2026- 12.01.2026",
            "formated_date": "2026-01-05",
            "price_per_person": "2229",
            "image_url": "https://i.wakacje.pl/no-index/hotel/salamis-bay-conti-balkon-taras-pokoj-1771428079-343-228.jpg",
            "offer_url": "https://www.wakacje.pl/oferty/hiszpania/fuerteventura/costa-calma/r2-rio-calma-442072.html?-od-2026-01-05,7-dni,all-inclusive&utm_source=travellead&utm_medium=cps&utm_campaign=1656-vacccation.com&a_aid=1656&chan=code5",
            "short_url": "https://is.gd/WJPx50",
            "airport": "Warszawa, Katowice, Poznań",
            "likes": 1877,
            "star_rating": "czterogwiazdkowy",
            "food": "Śniadania i obiadokolacje (HB)"
        },
        {
            "page": 5,
            "wakacjeplURL": "https://www.wakacje.pl/lastminute/?str-5,7-dni,do-4990zl,samolotem,3-gwiazdkowe,ocena-8,za-osobe",
            "hotel": "King Evelthon Beach Hotel and Resort",
            "location": "Cypr / Cypr Południowy / Paphos",
            "date": "08.01.2026- 15.01.2026",
            "formated_date": "2026-01-08",
            "price_per_person": "2159",
            "image_url": "https://i.wakacje.pl/no-index/hotel/salamis-bay-conti-pokoj-z-widokiem-na-morze-balkon-taras-pokoj-1771428073-343-228.jpg",
            "offer_url": "https://www.wakacje.pl/oferty/cypr/cypr-poludniowy/paphos/king-evelthon-beach-hotel-and-resort-993441.html?-od-2026-01-08,7-dni,all-inclusive&utm_source=travellead&utm_medium=cps&utm_campaign=1656-vacccation.com&a_aid=1656&chan=code5",
            "short_url": "https://is.gd/j1N76J",
            "airport": "Katowice, Poznań, Warszawa",
            "likes": 954,
            "star_rating": "pięciogwiazdkowy",
            "food": "Śniadania i obiadokolacje (HB)"
        },
        {
            "page": 5,
            "wakacjeplURL": "https://www.wakacje.pl/lastminute/?str-5,7-dni,do-4990zl,samolotem,3-gwiazdkowe,ocena-8,za-osobe",
            "hotel": "Pickalbatros Laguna Vista Beach",
            "location": "Egipt / Sharm el Sheikh",
            "date": "11.01.2026- 18.01.2026",
            "formated_date": "2026-01-11",
            "price_per_person": "2595",
            "image_url": "https://i.wakacje.pl/no-index/hotel/salamis-bay-conti-pokoj-843334641-343-228.jpg",
            "offer_url": "https://www.wakacje.pl/oferty/egipt/sharm-el-sheikh/pickalbatros-laguna-vista-beach-876996.html?-od-2026-01-11,7-dni,all-inclusive&utm_source=travellead&utm_medium=cps&utm_campaign=1656-vacccation.com&a_aid=1656&chan=code5",
            "short_url": "https://is.gd/AgcTfj",
            "airport": "Katowice, Warszawa, Wrocław",
            "likes": 1060,
            "star_rating": "pięciogwiazdkowy",
            "food": "All Inclusive"
        },
        {
            "page": 5,
            "wakacjeplURL": "https://www.wakacje.pl/lastminute/?str-5,7-dni,do-4990zl,samolotem,3-gwiazdkowe,ocena-8,za-osobe",
            "hotel": "Albatros Palace Port Ghalib (ex. Red Sea The Palace)",
            "location": "Egipt / Marsa El Alam / Port Ghalib",
            "date": "08.01.2026- 15.01.2026",
            "formated_date": "2026-01-08",
            "price_per_person": "3276",
            "image_url": "https://i.wakacje.pl/no-index/hotel/salamis-bay-conti-pokoj-824358491-343-228.jpg",
            "offer_url": "https://www.wakacje.pl/oferty/egipt/marsa-el-alam/port-ghalib/albatros-palace-port-ghalib-ex-red-sea-the-palace-795027.html?-od-2026-01-08,7-dni,all-inclusive&utm_source=travellead&utm_medium=cps&utm_campaign=1656-vacccation.com&a_aid=1656&chan=code5",
            "short_url": "https://is.gd/dco5hk",
            "airport": "Katowice, Warszawa",
            "likes": 1616,
            "star_rating": "pięciogwiazdkowy",
            "food": "All Inclusive"
        },
        {
            "page": 5,
            "wakacjeplURL": "https://www.wakacje.pl/lastminute/?str-5,7-dni,do-4990zl,samolotem,3-gwiazdkowe,ocena-8,za-osobe",
            "hotel": "Jaz Aquamarine (ex. Iberotel Aquamarine)",
            "location": "Egipt / Hurghada",
            "date": "08.01.2026- 15.01.2026",
            "formated_date": "2026-01-08",
            "price_per_person": "2840",
            "image_url": "https://i.wakacje.pl/no-index/hotel/salamis-bay-conti-pokoj-1771428081-343-228.jpg",
            "offer_url": "https://www.wakacje.pl/oferty/egipt/hurghada/hurghada/jaz-aquamarine-ex-iberotel-aquamarine-757168.html?-od-2026-01-08,7-dni,all-inclusive&utm_source=travellead&utm_medium=cps&utm_campaign=1656-vacccation.com&a_aid=1656&chan=code5",
            "short_url": "https://is.gd/P4QGyv",
            "airport": "Katowice, Warszawa, Poznań",
            "likes": 2233,
            "star_rating": "pięciogwiazdkowy",
            "food": "All Inclusive"
        },
        {
            "page": 6,
            "wakacjeplURL": "https://www.wakacje.pl/lastminute/?str-6,7-dni,do-4990zl,samolotem,3-gwiazdkowe,ocena-8,za-osobe",
            "hotel": "Jaz Elite Amara",
            "location": "Egipt / Marsa El Alam / Port Ghalib",
            "date": "11.01.2026- 18.01.2026",
            "formated_date": "2026-01-11",
            "price_per_person": "3910",
            "image_url": "https://i.wakacje.pl/no-index/hotel/jaz-elite-amara-basen-1610284468-343-228.jpg",
            "offer_url": "https://www.wakacje.pl/oferty/egipt/marsa-el-alam/port-ghalib/jaz-elite-amara-910414.html?-od-2026-01-11,7-dni,all-inclusive&utm_source=travellead&utm_medium=cps&utm_campaign=1656-vacccation.com&a_aid=1656&chan=code5",
            "short_url": "https://is.gd/1hFq99",
            "airport": "Katowice, Warszawa, Poznań",
            "likes": 150,
            "star_rating": "pięciogwiazdkowy",
            "food": "All Inclusive"
        },
        {
            "page": 6,
            "wakacjeplURL": "https://www.wakacje.pl/lastminute/?str-6,7-dni,do-4990zl,samolotem,3-gwiazdkowe,ocena-8,za-osobe",
            "hotel": "db Seabank Resort & Spa (ex RIU Seabank)",
            "location": "Malta / Wyspa Malta / Mellieha",
            "date": "08.01.2026- 15.01.2026",
            "formated_date": "2026-01-08",
            "price_per_person": "1849",
            "image_url": "https://i.wakacje.pl/no-index/hotel/jaz-elite-amara-obiekt-teren-hotelu-basen-1531906573-343-228.jpg",
            "offer_url": "https://www.wakacje.pl/oferty/malta/wyspa-malta/mellieha/db-seabank-resort-spa-ex-riu-seabank-985884.html?-od-2026-01-08,7-dni,all-inclusive&utm_source=travellead&utm_medium=cps&utm_campaign=1656-vacccation.com&a_aid=1656&chan=code5",
            "short_url": "https://is.gd/iDPgdd",
            "airport": "Katowice, Poznań, Warszawa",
            "likes": 2183,
            "star_rating": "czterogwiazdkowy",
            "food": "Śniadania i obiadokolacje (HB)"
        },
        {
            "page": 6,
            "wakacjeplURL": "https://www.wakacje.pl/lastminute/?str-6,7-dni,do-4990zl,samolotem,3-gwiazdkowe,ocena-8,za-osobe",
            "hotel": "Rewaya Majestic Resort",
            "location": "Egipt / Hurghada",
            "date": "14.01.2026- 21.01.2026",
            "formated_date": "2026-01-14",
            "price_per_person": "2442",
            "image_url": "https://i.wakacje.pl/no-index/hotel/jaz-elite-amara-basen-obiekt-1762029437-343-228.jpg",
            "offer_url": "https://www.wakacje.pl/oferty/egipt/hurghada/hurghada/rewaya-majestic-resort-1032876.html?-od-2026-01-14,7-dni,all-inclusive&utm_source=travellead&utm_medium=cps&utm_campaign=1656-vacccation.com&a_aid=1656&chan=code5",
            "short_url": "https://is.gd/SQ88ZV",
            "airport": "Katowice, Warszawa, Gdańsk",
            "likes": 1403,
            "star_rating": "pięciogwiazdkowy",
            "food": "All Inclusive"
        },
        {
            "page": 6,
            "wakacjeplURL": "https://www.wakacje.pl/lastminute/?str-6,7-dni,do-4990zl,samolotem,3-gwiazdkowe,ocena-8,za-osobe",
            "hotel": "Hilton Marsa Alam Nubian Resort",
            "location": "Egipt / Marsa El Alam",
            "date": "11.01.2026- 18.01.2026",
            "formated_date": "2026-01-11",
            "price_per_person": "2525",
            "image_url": "https://i.wakacje.pl/no-index/hotel/jaz-elite-amara-obiekt-1762029436-343-228.jpg",
            "offer_url": "https://www.wakacje.pl/oferty/egipt/marsa-el-alam/hilton-marsa-alam-nubian-resort-910396.html?-od-2026-01-11,7-dni,all-inclusive&utm_source=travellead&utm_medium=cps&utm_campaign=1656-vacccation.com&a_aid=1656&chan=code5",
            "short_url": "https://is.gd/9X84KN",
            "airport": "Katowice, Warszawa, Poznań",
            "likes": 495,
            "star_rating": "pięciogwiazdkowy",
            "food": "All Inclusive"
        },
        {
            "page": 6,
            "wakacjeplURL": "https://www.wakacje.pl/lastminute/?str-6,7-dni,do-4990zl,samolotem,3-gwiazdkowe,ocena-8,za-osobe",
            "hotel": "Cleopatra Luxury Resort Sharm Adults Only",
            "location": "Egipt / Sharm el Sheikh",
            "date": "11.01.2026- 18.01.2026",
            "formated_date": "2026-01-11",
            "price_per_person": "2892",
            "image_url": "https://i.wakacje.pl/no-index/hotel/jaz-elite-amara-teren-hotelu-obiekt-basen-1531906590-343-228.jpg",
            "offer_url": "https://www.wakacje.pl/oferty/egipt/sharm-el-sheikh/cleopatra-luxury-resort-sharm-adults-only-877042.html?-od-2026-01-11,7-dni,all-inclusive&utm_source=travellead&utm_medium=cps&utm_campaign=1656-vacccation.com&a_aid=1656&chan=code5",
            "short_url": "https://is.gd/RDDpZc",
            "airport": "Katowice, Warszawa, Wrocław",
            "likes": 1394,
            "star_rating": "pięciogwiazdkowy",
            "food": "All Inclusive"
        },
        {
            "page": 6,
            "wakacjeplURL": "https://www.wakacje.pl/lastminute/?str-6,7-dni,do-4990zl,samolotem,3-gwiazdkowe,ocena-8,za-osobe",
            "hotel": "Albatros Sea World Resort Marsa Alam",
            "location": "Egipt / Marsa El Alam / Al-Kusajr",
            "date": "08.01.2026- 15.01.2026",
            "formated_date": "2026-01-08",
            "price_per_person": "2741",
            "image_url": "https://i.wakacje.pl/no-index/hotel/jaz-elite-amara-teren-hotelu-1762029440-343-228.jpg",
            "offer_url": "https://www.wakacje.pl/oferty/egipt/marsa-el-alam/al-kusajr/albatros-sea-world-resort-marsa-alam-659828.html?-od-2026-01-08,7-dni,all-inclusive&utm_source=travellead&utm_medium=cps&utm_campaign=1656-vacccation.com&a_aid=1656&chan=code5",
            "short_url": "https://is.gd/bdXynN",
            "airport": "Warszawa, Katowice",
            "likes": 2066,
            "star_rating": "pięciogwiazdkowy",
            "food": "All Inclusive"
        },
        {
            "page": 6,
            "wakacjeplURL": "https://www.wakacje.pl/lastminute/?str-6,7-dni,do-4990zl,samolotem,3-gwiazdkowe,ocena-8,za-osobe",
            "hotel": "Royal Karthago (ex. Karthago)",
            "location": "Tunezja / Djerba",
            "date": "08.01.2026- 15.01.2026",
            "formated_date": "2026-01-08",
            "price_per_person": "1729",
            "image_url": "https://i.wakacje.pl/no-index/hotel/jaz-elite-amara-recepcja-lobby-1531906625-343-228.jpg",
            "offer_url": "https://www.wakacje.pl/oferty/tunezja/djerba/royal-karthago-ex-karthago-535496.html?-od-2026-01-08,7-dni,all-inclusive&utm_source=travellead&utm_medium=cps&utm_campaign=1656-vacccation.com&a_aid=1656&chan=code5",
            "short_url": "https://is.gd/p32EEI",
            "airport": "Katowice",
            "likes": 1726,
            "star_rating": "czterogwiazdkowy",
            "food": "All Inclusive"
        },
        {
            "page": 6,
            "wakacjeplURL": "https://www.wakacje.pl/lastminute/?str-6,7-dni,do-4990zl,samolotem,3-gwiazdkowe,ocena-8,za-osobe",
            "hotel": "Pickalbatros Citadel Sahl Hasheesh (ex. Citadel Azur Resort)",
            "location": "Egipt / Hurghada",
            "date": "14.01.2026- 21.01.2026",
            "formated_date": "2026-01-14",
            "price_per_person": "2906",
            "image_url": "https://i.wakacje.pl/no-index/hotel/jaz-elite-amara-recepcja-lobby-1610284465-343-228.jpg",
            "offer_url": "https://www.wakacje.pl/oferty/egipt/hurghada/hurghada/pickalbatros-citadel-sahl-hasheesh-ex-citadel-azur-resort-75.html?-od-2026-01-14,7-dni,all-inclusive&utm_source=travellead&utm_medium=cps&utm_campaign=1656-vacccation.com&a_aid=1656&chan=code5",
            "short_url": "https://is.gd/O2I9Tn",
            "airport": "Katowice, Warszawa, Gdańsk",
            "likes": 1880,
            "star_rating": "pięciogwiazdkowy",
            "food": "All Inclusive"
        },
        {
            "page": 6,
            "wakacjeplURL": "https://www.wakacje.pl/lastminute/?str-6,7-dni,do-4990zl,samolotem,3-gwiazdkowe,ocena-8,za-osobe",
            "hotel": "Rocamar & Royal Orchid",
            "location": "Portugalia / Madera / Canico",
            "date": "10.01.2026- 17.01.2026",
            "formated_date": "2026-01-10",
            "price_per_person": "2129",
            "image_url": "https://i.wakacje.pl/no-index/hotel/jaz-elite-amara-pokoj-1610284489-343-228.jpg",
            "offer_url": "https://www.wakacje.pl/oferty/portugalia/madera/canico/rocamar-royal-orchid-441966.html?-od-2026-01-10,7-dni,all-inclusive&utm_source=travellead&utm_medium=cps&utm_campaign=1656-vacccation.com&a_aid=1656&chan=code5",
            "short_url": "https://is.gd/CjXIof",
            "airport": "Poznań, Warszawa, Katowice",
            "likes": 1516,
            "star_rating": "czterogwiazdkowy",
            "food": "Śniadania i obiadokolacje (HB)"
        },
        {
            "page": 6,
            "wakacjeplURL": "https://www.wakacje.pl/lastminute/?str-6,7-dni,do-4990zl,samolotem,3-gwiazdkowe,ocena-8,za-osobe",
            "hotel": "Shams Alam Beach Resort",
            "location": "Egipt / Marsa El Alam",
            "date": "13.01.2026- 20.01.2026",
            "formated_date": "2026-01-13",
            "price_per_person": "2244",
            "image_url": "https://i.wakacje.pl/no-index/hotel/jaz-elite-amara-pokoj-1610284466-343-228.jpg",
            "offer_url": "https://www.wakacje.pl/oferty/egipt/marsa-el-alam/shams-alam-beach-resort-718101.html?-od-2026-01-13,7-dni,all-inclusive&utm_source=travellead&utm_medium=cps&utm_campaign=1656-vacccation.com&a_aid=1656&chan=code5",
            "short_url": "https://is.gd/nRCsb9",
            "airport": "Katowice, Warszawa, Rzeszów",
            "likes": 1166,
            "star_rating": "czterogwiazdkowy",
            "food": "All Inclusive"
        },
        {
            "page": 7,
            "wakacjeplURL": "https://www.wakacje.pl/lastminute/?str-7,7-dni,do-4990zl,samolotem,3-gwiazdkowe,ocena-8,za-osobe",
            "hotel": "Sunrise Anjum Resort",
            "location": "Egipt / Marsa El Alam",
            "date": "13.01.2026- 20.01.2026",
            "formated_date": "2026-01-13",
            "price_per_person": "3442",
            "image_url": "https://i.wakacje.pl/no-index/hotel/sunrise-anjum-resort-basen-1621285579-343-228.jpg",
            "offer_url": "https://www.wakacje.pl/oferty/egipt/marsa-el-alam/sunrise-anjum-resort-893480.html?-od-2026-01-13,7-dni,all-inclusive&utm_source=travellead&utm_medium=cps&utm_campaign=1656-vacccation.com&a_aid=1656&chan=code5",
            "short_url": "https://is.gd/a7RGvf",
            "airport": "Katowice, Warszawa, Rzeszów",
            "likes": 1974,
            "star_rating": "pięciogwiazdkowy",
            "food": "All Inclusive"
        },
        {
            "page": 7,
            "wakacjeplURL": "https://www.wakacje.pl/lastminute/?str-7,7-dni,do-4990zl,samolotem,3-gwiazdkowe,ocena-8,za-osobe",
            "hotel": "Limak Atlantis",
            "location": "Turcja / Riwiera Turecka / Belek",
            "date": "10.01.2026- 17.01.2026",
            "formated_date": "2026-01-10",
            "price_per_person": "1989",
            "image_url": "https://i.wakacje.pl/no-index/hotel/sunrise-anjum-resort-basen-obiekt-1621285563-343-228.jpg",
            "offer_url": "https://www.wakacje.pl/oferty/turcja/riwiera-turecka/belek/limak-atlantis-19074.html?-od-2026-01-10,7-dni,all-inclusive&utm_source=travellead&utm_medium=cps&utm_campaign=1656-vacccation.com&a_aid=1656&chan=code5",
            "short_url": "https://is.gd/p3nCUu",
            "airport": "Gdańsk, Katowice, Warszawa",
            "likes": 578,
            "star_rating": "pięciogwiazdkowy",
            "food": "Ultra All Inclusive"
        },
        {
            "page": 7,
            "wakacjeplURL": "https://www.wakacje.pl/lastminute/?str-7,7-dni,do-4990zl,samolotem,3-gwiazdkowe,ocena-8,za-osobe",
            "hotel": "Pickalbatros Royal Moderna",
            "location": "Egipt / Sharm el Sheikh",
            "date": "06.01.2026- 13.01.2026",
            "formated_date": "2026-01-06",
            "price_per_person": "2549",
            "image_url": "https://i.wakacje.pl/no-index/hotel/sunrise-anjum-resort-restauracja-1753179746-343-228.jpg",
            "offer_url": "https://www.wakacje.pl/oferty/egipt/sharm-el-sheikh/pickalbatros-royal-moderna-419804.html?-od-2026-01-06,7-dni,all-inclusive&utm_source=travellead&utm_medium=cps&utm_campaign=1656-vacccation.com&a_aid=1656&chan=code5",
            "short_url": "https://is.gd/lzfHo6",
            "airport": "Katowice, Warszawa",
            "likes": 837,
            "star_rating": "pięciogwiazdkowy",
            "food": "All Inclusive"
        },
        {
            "page": 7,
            "wakacjeplURL": "https://www.wakacje.pl/lastminute/?str-7,7-dni,do-4990zl,samolotem,3-gwiazdkowe,ocena-8,za-osobe",
            "hotel": "Jaz Soma Beach (ex. Solymar Soma Beach)",
            "location": "Egipt / Hurghada",
            "date": "14.01.2026- 21.01.2026",
            "formated_date": "2026-01-14",
            "price_per_person": "2613",
            "image_url": "https://i.wakacje.pl/no-index/hotel/sunrise-anjum-resort-restauracja-basen-1621285546-343-228.jpg",
            "offer_url": "https://www.wakacje.pl/oferty/egipt/hurghada/hurghada/jaz-soma-beach-ex-solymar-soma-beach-680502.html?-od-2026-01-14,7-dni,all-inclusive&utm_source=travellead&utm_medium=cps&utm_campaign=1656-vacccation.com&a_aid=1656&chan=code5",
            "short_url": "https://is.gd/oUFnjH",
            "airport": "Katowice, Warszawa, Gdańsk",
            "likes": 451,
            "star_rating": "czterogwiazdkowy",
            "food": "All Inclusive"
        },
        {
            "page": 7,
            "wakacjeplURL": "https://www.wakacje.pl/lastminute/?str-7,7-dni,do-4990zl,samolotem,3-gwiazdkowe,ocena-8,za-osobe",
            "hotel": "Fantazia Resort",
            "location": "Egipt / Marsa El Alam",
            "date": "13.01.2026- 20.01.2026",
            "formated_date": "2026-01-13",
            "price_per_person": "2305",
            "image_url": "https://i.wakacje.pl/no-index/hotel/sunrise-anjum-resort-teren-hotelu-1621285515-343-228.jpg",
            "offer_url": "https://www.wakacje.pl/oferty/egipt/marsa-el-alam/fantazia-resort-254865.html?-od-2026-01-13,7-dni,all-inclusive&utm_source=travellead&utm_medium=cps&utm_campaign=1656-vacccation.com&a_aid=1656&chan=code5",
            "short_url": "https://is.gd/IYiyfy",
            "airport": "Katowice, Warszawa, Rzeszów",
            "likes": 1061,
            "star_rating": "pięciogwiazdkowy",
            "food": "All Inclusive"
        },
        {
            "page": 7,
            "wakacjeplURL": "https://www.wakacje.pl/lastminute/?str-7,7-dni,do-4990zl,samolotem,3-gwiazdkowe,ocena-8,za-osobe",
            "hotel": "Fergus Cactus Garden (ex. Lemon & Soul Cactus Garden)",
            "location": "Hiszpania / Fuerteventura / Morro Jable",
            "date": "05.01.2026- 12.01.2026",
            "formated_date": "2026-01-05",
            "price_per_person": "2629",
            "image_url": "https://i.wakacje.pl/no-index/hotel/sunrise-anjum-resort-pokoj-1621285463-343-228.jpg",
            "offer_url": "https://www.wakacje.pl/oferty/hiszpania/fuerteventura/morro-jable/fergus-cactus-garden-ex-lemon-soul-cactus-garden-834039.html?-od-2026-01-05,7-dni,all-inclusive&utm_source=travellead&utm_medium=cps&utm_campaign=1656-vacccation.com&a_aid=1656&chan=code5",
            "short_url": "https://is.gd/PU2leV",
            "airport": "Warszawa, Katowice, Poznań",
            "likes": 1960,
            "star_rating": "czterogwiazdkowy",
            "food": "All Inclusive"
        },
        {
            "page": 7,
            "wakacjeplURL": "https://www.wakacje.pl/lastminute/?str-7,7-dni,do-4990zl,samolotem,3-gwiazdkowe,ocena-8,za-osobe",
            "hotel": "Titanic Resort & Aquapark (ex Dessole)",
            "location": "Egipt / Hurghada",
            "date": "07.01.2026- 14.01.2026",
            "formated_date": "2026-01-07",
            "price_per_person": "2532",
            "image_url": "https://i.wakacje.pl/no-index/hotel/sunrise-anjum-resort-pokoj-1621285462-343-228.jpg",
            "offer_url": "https://www.wakacje.pl/oferty/egipt/hurghada/hurghada/titanic-resort-aquapark-ex-dessole-313457.html?-od-2026-01-07,7-dni,all-inclusive&utm_source=travellead&utm_medium=cps&utm_campaign=1656-vacccation.com&a_aid=1656&chan=code5",
            "short_url": "https://is.gd/K8YMFM",
            "airport": "Katowice, Warszawa, Gdańsk",
            "likes": 1641,
            "star_rating": "czterogwiazdkowy",
            "food": "All Inclusive"
        },
        {
            "page": 7,
            "wakacjeplURL": "https://www.wakacje.pl/lastminute/?str-7,7-dni,do-4990zl,samolotem,3-gwiazdkowe,ocena-8,za-osobe",
            "hotel": "Constantinos The Great Beach",
            "location": "Cypr / Cypr Południowy / Protaras",
            "date": "13.01.2026- 20.01.2026",
            "formated_date": "2026-01-13",
            "price_per_person": "1889",
            "image_url": "https://i.wakacje.pl/no-index/hotel/sunrise-anjum-resort-pokoj-1621285461-343-228.jpg",
            "offer_url": "https://www.wakacje.pl/oferty/cypr/cypr-poludniowy/protaras/constantinos-the-great-beach-985902.html?-od-2026-01-13,7-dni,all-inclusive&utm_source=travellead&utm_medium=cps&utm_campaign=1656-vacccation.com&a_aid=1656&chan=code5",
            "short_url": "https://is.gd/XkPUTv",
            "airport": "Katowice, Warszawa, Berlin",
            "likes": 118,
            "star_rating": "pięciogwiazdkowy",
            "food": "Śniadania i obiadokolacje (HB)"
        },
        {
            "page": 7,
            "wakacjeplURL": "https://www.wakacje.pl/lastminute/?str-7,7-dni,do-4990zl,samolotem,3-gwiazdkowe,ocena-8,za-osobe",
            "hotel": "Meraki Resort Hurghada",
            "location": "Egipt / Hurghada",
            "date": "11.01.2026- 18.01.2026",
            "formated_date": "2026-01-11",
            "price_per_person": "3041",
            "image_url": "https://i.wakacje.pl/no-index/hotel/sunrise-anjum-resort-pokoj-1621285480-343-228.jpg",
            "offer_url": "https://www.wakacje.pl/oferty/egipt/hurghada/hurghada/meraki-resort-hurghada-504606.html?-od-2026-01-11,7-dni,all-inclusive&utm_source=travellead&utm_medium=cps&utm_campaign=1656-vacccation.com&a_aid=1656&chan=code5",
            "short_url": "https://is.gd/yiOlfq",
            "airport": "Warszawa, Poznań, Wrocław",
            "likes": 2014,
            "star_rating": "czteroipółgwiazdkowy",
            "food": "All Inclusive"
        },
        {
            "page": 7,
            "wakacjeplURL": "https://www.wakacje.pl/lastminute/?str-7,7-dni,do-4990zl,samolotem,3-gwiazdkowe,ocena-8,za-osobe",
            "hotel": "Bellagio Beach Resort & Spa (ex. Panorama Bungalows Hurghada)",
            "location": "Egipt / Hurghada",
            "date": "11.01.2026- 18.01.2026",
            "formated_date": "2026-01-11",
            "price_per_person": "2356",
            "image_url": "https://i.wakacje.pl/no-index/hotel/sunrise-anjum-resort-pokoj-1753179849-343-228.jpg",
            "offer_url": "https://www.wakacje.pl/oferty/egipt/hurghada/hurghada/bellagio-beach-resort-spa-ex-panorama-bungalows-hurghada-909550.html?-od-2026-01-11,7-dni,all-inclusive&utm_source=travellead&utm_medium=cps&utm_campaign=1656-vacccation.com&a_aid=1656&chan=code5",
            "short_url": "https://is.gd/QGIga5",
            "airport": "Katowice, Warszawa, Wrocław",
            "likes": 2296,
            "star_rating": "pięciogwiazdkowy",
            "food": "All Inclusive"
        },
        {
            "page": 8,
            "wakacjeplURL": "https://www.wakacje.pl/lastminute/?str-8,7-dni,do-4990zl,samolotem,3-gwiazdkowe,ocena-8,za-osobe",
            "hotel": "Sea Gull Beach Resort (Hurghada)",
            "location": "Egipt / Hurghada",
            "date": "11.01.2026- 18.01.2026",
            "formated_date": "2026-01-11",
            "price_per_person": "2192",
            "image_url": "https://i.wakacje.pl/no-index/hotel/sea-gull-beach-resort-hurghada-teren-hotelu-1459219975-343-228.jpg",
            "offer_url": "https://www.wakacje.pl/oferty/egipt/hurghada/hurghada/sea-gull-beach-resort-hurghada-910373.html?-od-2026-01-11,7-dni,all-inclusive&utm_source=travellead&utm_medium=cps&utm_campaign=1656-vacccation.com&a_aid=1656&chan=code5",
            "short_url": "https://is.gd/80GBvI",
            "airport": "Katowice, Warszawa, Wrocław",
            "likes": 745,
            "star_rating": "czteroipółgwiazdkowy",
            "food": "All Inclusive"
        },
        {
            "page": 8,
            "wakacjeplURL": "https://www.wakacje.pl/lastminute/?str-8,7-dni,do-4990zl,samolotem,3-gwiazdkowe,ocena-8,za-osobe",
            "hotel": "Mogan Princess & Beach Club",
            "location": "Hiszpania / Gran Canaria / Mogan",
            "date": "13.01.2026- 20.01.2026",
            "formated_date": "2026-01-13",
            "price_per_person": "3129",
            "image_url": "https://i.wakacje.pl/no-index/hotel/sea-gull-beach-resort-hurghada-dla-dzieci-1459219907-343-228.jpg",
            "offer_url": "https://www.wakacje.pl/oferty/hiszpania/gran-canaria/mogan/mogan-princess-beach-club-442095.html?-od-2026-01-13,7-dni,all-inclusive&utm_source=travellead&utm_medium=cps&utm_campaign=1656-vacccation.com&a_aid=1656&chan=code5",
            "short_url": "https://is.gd/xhIfuL",
            "airport": "Warszawa, Katowice, Poznań",
            "likes": 684,
            "star_rating": "czterogwiazdkowy",
            "food": "All Inclusive"
        },
        {
            "page": 8,
            "wakacjeplURL": "https://www.wakacje.pl/lastminute/?str-8,7-dni,do-4990zl,samolotem,3-gwiazdkowe,ocena-8,za-osobe",
            "hotel": "Kaila City (ex. K House)",
            "location": "Turcja / Riwiera Turecka / Alanya",
            "date": "17.01.2026- 24.01.2026",
            "formated_date": "2026-01-17",
            "price_per_person": "1356",
            "image_url": "https://i.wakacje.pl/no-index/hotel/sea-gull-beach-resort-hurghada-basen-808393226-343-228.jpg",
            "offer_url": "https://www.wakacje.pl/oferty/turcja/riwiera-turecka/alanya/kaila-city-ex-k-house-723364.html?-od-2026-01-17,7-dni,all-inclusive&utm_source=travellead&utm_medium=cps&utm_campaign=1656-vacccation.com&a_aid=1656&chan=code5",
            "short_url": "https://is.gd/eUoepk",
            "airport": "Gdańsk, Wrocław, Katowice",
            "likes": 824,
            "star_rating": "czterogwiazdkowy",
            "food": "Śniadania (BB)"
        },
        {
            "page": 8,
            "wakacjeplURL": "https://www.wakacje.pl/lastminute/?str-8,7-dni,do-4990zl,samolotem,3-gwiazdkowe,ocena-8,za-osobe",
            "hotel": "Dom Pedro Madeira Ocean Beach",
            "location": "Portugalia / Madera / Machico",
            "date": "10.01.2026- 17.01.2026",
            "formated_date": "2026-01-10",
            "price_per_person": "1829",
            "image_url": "https://i.wakacje.pl/no-index/hotel/sea-gull-beach-resort-hurghada-basen-64939595-343-228.jpg",
            "offer_url": "https://www.wakacje.pl/oferty/portugalia/madera/machico/dom-pedro-madeira-ocean-beach-1016842.html?-od-2026-01-10,7-dni,all-inclusive&utm_source=travellead&utm_medium=cps&utm_campaign=1656-vacccation.com&a_aid=1656&chan=code5",
            "short_url": "https://is.gd/YktM9k",
            "airport": "Warszawa, Katowice, Poznań",
            "likes": 367,
            "star_rating": "czterogwiazdkowy",
            "food": "Śniadania (BB)"
        },
        {
            "page": 8,
            "wakacjeplURL": "https://www.wakacje.pl/lastminute/?str-8,7-dni,do-4990zl,samolotem,3-gwiazdkowe,ocena-8,za-osobe",
            "hotel": "Reef Oasis Blue Bay Resort",
            "location": "Egipt / Sharm el Sheikh",
            "date": "20.01.2026- 27.01.2026",
            "formated_date": "2026-01-20",
            "price_per_person": "3593",
            "image_url": "https://i.wakacje.pl/no-index/hotel/sea-gull-beach-resort-hurghada-pokoj-z-widokiem-na-morze-804279220-343-228.jpg",
            "offer_url": "https://www.wakacje.pl/oferty/egipt/sharm-el-sheikh/reef-oasis-blue-bay-resort-596327.html?-od-2026-01-20,7-dni,all-inclusive&utm_source=travellead&utm_medium=cps&utm_campaign=1656-vacccation.com&a_aid=1656&chan=code5",
            "short_url": "https://is.gd/kfhdWI",
            "airport": "Katowice",
            "likes": 1091,
            "star_rating": "pięciogwiazdkowy",
            "food": "All Inclusive Plus"
        },
        {
            "page": 8,
            "wakacjeplURL": "https://www.wakacje.pl/lastminute/?str-8,7-dni,do-4990zl,samolotem,3-gwiazdkowe,ocena-8,za-osobe",
            "hotel": "SBH Kilindini Resort",
            "location": "Tanzania / Zanzibar",
            "date": "07.01.2026- 15.01.2026",
            "formated_date": "2026-01-07",
            "price_per_person": "4929",
            "image_url": "https://i.wakacje.pl/no-index/hotel/sea-gull-beach-resort-hurghada-obiekt-basen-764848162-343-228.jpg",
            "offer_url": "https://www.wakacje.pl/oferty/tanzania/zanzibar/sbh-kilindini-resort-578395.html?-od-2026-01-07,7-dni,all-inclusive&utm_source=travellead&utm_medium=cps&utm_campaign=1656-vacccation.com&a_aid=1656&chan=code5",
            "short_url": "https://is.gd/tQYtKy",
            "airport": "Warszawa, Gdańsk",
            "likes": 1950,
            "star_rating": "pięciogwiazdkowy",
            "food": "All Inclusive"
        },
        {
            "page": 8,
            "wakacjeplURL": "https://www.wakacje.pl/lastminute/?str-8,7-dni,do-4990zl,samolotem,3-gwiazdkowe,ocena-8,za-osobe",
            "hotel": "Ramla Bay Resort",
            "location": "Malta / Wyspa Malta / Ramla Bay",
            "date": "08.01.2026- 15.01.2026",
            "formated_date": "2026-01-08",
            "price_per_person": "1469",
            "image_url": "https://i.wakacje.pl/no-index/hotel/sea-gull-beach-resort-hurghada-teren-hotelu-1459219941-343-228.jpg",
            "offer_url": "https://www.wakacje.pl/oferty/malta/wyspa-malta/ramla-bay/ramla-bay-resort-1006799.html?-od-2026-01-08,7-dni,all-inclusive&utm_source=travellead&utm_medium=cps&utm_campaign=1656-vacccation.com&a_aid=1656&chan=code5",
            "short_url": "https://is.gd/wZO1pl",
            "airport": "Warszawa, Katowice, Poznań",
            "likes": 1957,
            "star_rating": "czterogwiazdkowy",
            "food": "Śniadania (BB)"
        },
        {
            "page": 8,
            "wakacjeplURL": "https://www.wakacje.pl/lastminute/?str-8,7-dni,do-4990zl,samolotem,3-gwiazdkowe,ocena-8,za-osobe",
            "hotel": "Sea Gull Beach Resort (Hurghada)",
            "location": "Egipt / Hurghada",
            "date": "09.01.2026- 16.01.2026",
            "formated_date": "2026-01-09",
            "price_per_person": "2128",
            "image_url": "https://i.wakacje.pl/no-index/hotel/sea-gull-beach-resort-hurghada-teren-hotelu-808398786-343-228.jpg",
            "offer_url": "https://www.wakacje.pl/oferty/egipt/hurghada/hurghada/sea-gull-beach-resort-hurghada-757105.html?-od-2026-01-09,7-dni,all-inclusive&utm_source=travellead&utm_medium=cps&utm_campaign=1656-vacccation.com&a_aid=1656&chan=code5",
            "short_url": "https://is.gd/hXCUVg",
            "airport": "Katowice, Warszawa, Poznań",
            "likes": 1148,
            "star_rating": "czterogwiazdkowy",
            "food": "All Inclusive"
        },
        {
            "page": 8,
            "wakacjeplURL": "https://www.wakacje.pl/lastminute/?str-8,7-dni,do-4990zl,samolotem,3-gwiazdkowe,ocena-8,za-osobe",
            "hotel": "Hilton Marsa Alam Nubian Resort",
            "location": "Egipt / Marsa El Alam",
            "date": "08.01.2026- 15.01.2026",
            "formated_date": "2026-01-08",
            "price_per_person": "2680",
            "image_url": "https://i.wakacje.pl/no-index/hotel/sea-gull-beach-resort-hurghada-teren-hotelu-1459219999-343-228.jpg",
            "offer_url": "https://www.wakacje.pl/oferty/egipt/marsa-el-alam/hilton-marsa-alam-nubian-resort-798073.html?-od-2026-01-08,7-dni,all-inclusive&utm_source=travellead&utm_medium=cps&utm_campaign=1656-vacccation.com&a_aid=1656&chan=code5",
            "short_url": "https://is.gd/Gxhc9V",
            "airport": "Katowice, Warszawa",
            "likes": 1592,
            "star_rating": "pięciogwiazdkowy",
            "food": "All Inclusive"
        },
        {
            "page": 8,
            "wakacjeplURL": "https://www.wakacje.pl/lastminute/?str-8,7-dni,do-4990zl,samolotem,3-gwiazdkowe,ocena-8,za-osobe",
            "hotel": "Jaz Riviera",
            "location": "Egipt / Marsa El Alam / Port Ghalib",
            "date": "13.01.2026- 20.01.2026",
            "formated_date": "2026-01-13",
            "price_per_person": "4833",
            "image_url": "https://i.wakacje.pl/no-index/hotel/sea-gull-beach-resort-hurghada-teren-hotelu-808389751-343-228.jpg",
            "offer_url": "https://www.wakacje.pl/oferty/egipt/marsa-el-alam/port-ghalib/jaz-riviera-943333.html?-od-2026-01-13,7-dni,all-inclusive&utm_source=travellead&utm_medium=cps&utm_campaign=1656-vacccation.com&a_aid=1656&chan=code5",
            "short_url": "https://is.gd/PQwQzG",
            "airport": "Katowice, Warszawa, Rzeszów",
            "likes": 2281,
            "star_rating": "pięciogwiazdkowy",
            "food": "All Inclusive"
        },
        {
            "page": 9,
            "wakacjeplURL": "https://www.wakacje.pl/lastminute/?str-9,7-dni,do-4990zl,samolotem,3-gwiazdkowe,ocena-8,za-osobe",
            "hotel": "Pickalbatros Jungle Aqua Park by Neverland",
            "location": "Egipt / Hurghada",
            "date": "11.01.2026- 18.01.2026",
            "formated_date": "2026-01-11",
            "price_per_person": "2468",
            "image_url": "https://i.wakacje.pl/no-index/hotel/pickalbatros-jungle-aqua-park-by-neverland-aquapark-1504239948-343-228.jpg",
            "offer_url": "https://www.wakacje.pl/oferty/egipt/hurghada/hurghada/pickalbatros-jungle-aqua-park-by-neverland-910444.html?-od-2026-01-11,7-dni,all-inclusive&utm_source=travellead&utm_medium=cps&utm_campaign=1656-vacccation.com&a_aid=1656&chan=code5",
            "short_url": "https://is.gd/ZoQT6k",
            "airport": "Katowice, Warszawa, Poznań",
            "likes": 1803,
            "star_rating": "czteroipółgwiazdkowy",
            "food": "All Inclusive"
        },
        {
            "page": 9,
            "wakacjeplURL": "https://www.wakacje.pl/lastminute/?str-9,7-dni,do-4990zl,samolotem,3-gwiazdkowe,ocena-8,za-osobe",
            "hotel": "Titanic Royal",
            "location": "Egipt / Hurghada",
            "date": "14.01.2026- 21.01.2026",
            "formated_date": "2026-01-14",
            "price_per_person": "2502",
            "image_url": "https://i.wakacje.pl/no-index/hotel/pickalbatros-jungle-aqua-park-by-neverland-aquapark-1504239761-343-228.jpg",
            "offer_url": "https://www.wakacje.pl/oferty/egipt/hurghada/hurghada/titanic-royal-526452.html?-od-2026-01-14,7-dni,all-inclusive&utm_source=travellead&utm_medium=cps&utm_campaign=1656-vacccation.com&a_aid=1656&chan=code5",
            "short_url": "https://is.gd/Nrt4mX",
            "airport": "Katowice, Warszawa, Gdańsk",
            "likes": 1875,
            "star_rating": "pięciogwiazdkowy",
            "food": "Ultra All Inclusive"
        },
        {
            "page": 9,
            "wakacjeplURL": "https://www.wakacje.pl/lastminute/?str-9,7-dni,do-4990zl,samolotem,3-gwiazdkowe,ocena-8,za-osobe",
            "hotel": "IFA Altamarena",
            "location": "Hiszpania / Fuerteventura / Morro Jable",
            "date": "08.01.2026- 15.01.2026",
            "formated_date": "2026-01-08",
            "price_per_person": "2929",
            "image_url": "https://i.wakacje.pl/no-index/hotel/pickalbatros-jungle-aqua-park-by-neverland-aquapark-1504239878-343-228.jpg",
            "offer_url": "https://www.wakacje.pl/oferty/hiszpania/fuerteventura/morro-jable/ifa-altamarena-790321.html?-od-2026-01-08,7-dni,all-inclusive&utm_source=travellead&utm_medium=cps&utm_campaign=1656-vacccation.com&a_aid=1656&chan=code5",
            "short_url": "https://is.gd/HqVaC8",
            "airport": "Gdańsk, Poznań, Warszawa",
            "likes": 2047,
            "star_rating": "czterogwiazdkowy",
            "food": "All Inclusive"
        },
        {
            "page": 9,
            "wakacjeplURL": "https://www.wakacje.pl/lastminute/?str-9,7-dni,do-4990zl,samolotem,3-gwiazdkowe,ocena-8,za-osobe",
            "hotel": "Three Corners Equinox Beach",
            "location": "Egipt / Marsa El Alam",
            "date": "13.01.2026- 20.01.2026",
            "formated_date": "2026-01-13",
            "price_per_person": "2317",
            "image_url": "https://i.wakacje.pl/no-index/hotel/pickalbatros-jungle-aqua-park-by-neverland-basen-teren-hotelu-1504240037-343-228.jpg",
            "offer_url": "https://www.wakacje.pl/oferty/egipt/marsa-el-alam/three-corners-equinox-beach-271450.html?-od-2026-01-13,7-dni,all-inclusive&utm_source=travellead&utm_medium=cps&utm_campaign=1656-vacccation.com&a_aid=1656&chan=code5",
            "short_url": "https://is.gd/TPEoM6",
            "airport": "Katowice, Warszawa, Rzeszów",
            "likes": 123,
            "star_rating": "czterogwiazdkowy",
            "food": "All Inclusive"
        },
        {
            "page": 9,
            "wakacjeplURL": "https://www.wakacje.pl/lastminute/?str-9,7-dni,do-4990zl,samolotem,3-gwiazdkowe,ocena-8,za-osobe",
            "hotel": "Jumbo Resort Watamu",
            "location": "Kenia / Wybrzeże Malindi / Watamu",
            "date": "15.01.2026- 23.01.2026",
            "formated_date": "2026-01-15",
            "price_per_person": "4929",
            "image_url": "https://i.wakacje.pl/no-index/hotel/pickalbatros-jungle-aqua-park-by-neverland-teren-hotelu-1504240027-343-228.jpg",
            "offer_url": "https://www.wakacje.pl/oferty/kenia/wybrzeze-malindi/watamu/jumbo-resort-watamu-776695.html?-od-2026-01-15,7-dni,all-inclusive&utm_source=travellead&utm_medium=cps&utm_campaign=1656-vacccation.com&a_aid=1656&chan=code5",
            "short_url": "https://is.gd/QKCnZ6",
            "airport": "Katowice, Wrocław",
            "likes": 1987,
            "star_rating": "czterogwiazdkowy",
            "food": "All Inclusive"
        },
        {
            "page": 9,
            "wakacjeplURL": "https://www.wakacje.pl/lastminute/?str-9,7-dni,do-4990zl,samolotem,3-gwiazdkowe,ocena-8,za-osobe",
            "hotel": "Sentido Mamlouk Palace Resort & Spa (ex Sunrise)",
            "location": "Egipt / Hurghada",
            "date": "11.01.2026- 18.01.2026",
            "formated_date": "2026-01-11",
            "price_per_person": "2941",
            "image_url": "https://i.wakacje.pl/no-index/hotel/pickalbatros-jungle-aqua-park-by-neverland-aquapark-1762567778-343-228.jpg",
            "offer_url": "https://www.wakacje.pl/oferty/egipt/hurghada/hurghada/sentido-mamlouk-palace-resort-spa-ex-sunrise-448766.html?-od-2026-01-11,7-dni,all-inclusive&utm_source=travellead&utm_medium=cps&utm_campaign=1656-vacccation.com&a_aid=1656&chan=code5",
            "short_url": "https://is.gd/jvm3Dr",
            "airport": "Warszawa, Poznań, Wrocław",
            "likes": 1914,
            "star_rating": "pięciogwiazdkowy",
            "food": "All Inclusive"
        },
        {
            "page": 9,
            "wakacjeplURL": "https://www.wakacje.pl/lastminute/?str-9,7-dni,do-4990zl,samolotem,3-gwiazdkowe,ocena-8,za-osobe",
            "hotel": "Long Beach Resort (ex Hilton Long Beach)",
            "location": "Egipt / Hurghada",
            "date": "11.01.2026- 19.01.2026",
            "formated_date": "2026-01-11",
            "price_per_person": "2129",
            "image_url": "https://i.wakacje.pl/no-index/hotel/pickalbatros-jungle-aqua-park-by-neverland-basen-teren-hotelu-826306774-343-228.jpg",
            "offer_url": "https://www.wakacje.pl/oferty/egipt/hurghada/hurghada/long-beach-resort-ex-hilton-long-beach-412413.html?-od-2026-01-11,7-dni,all-inclusive&utm_source=travellead&utm_medium=cps&utm_campaign=1656-vacccation.com&a_aid=1656&chan=code5",
            "short_url": "https://is.gd/TXpYcT",
            "airport": "Warszawa, Katowice, Poznań",
            "likes": 2059,
            "star_rating": "czterogwiazdkowy",
            "food": "All Inclusive"
        },
        {
            "page": 9,
            "wakacjeplURL": "https://www.wakacje.pl/lastminute/?str-9,7-dni,do-4990zl,samolotem,3-gwiazdkowe,ocena-8,za-osobe",
            "hotel": "El Kasr Sahl Hasheesh",
            "location": "Egipt / Hurghada",
            "date": "11.01.2026- 18.01.2026",
            "formated_date": "2026-01-11",
            "price_per_person": "2579",
            "image_url": "https://i.wakacje.pl/no-index/hotel/pickalbatros-jungle-aqua-park-by-neverland-basen-1504239542-343-228.jpg",
            "offer_url": "https://www.wakacje.pl/oferty/egipt/hurghada/hurghada/el-kasr-sahl-hasheesh-1046766.html?-od-2026-01-11,7-dni,all-inclusive&utm_source=travellead&utm_medium=cps&utm_campaign=1656-vacccation.com&a_aid=1656&chan=code5",
            "short_url": "https://is.gd/E0fByz",
            "airport": "Berlin, Warszawa, Katowice",
            "likes": 1716,
            "star_rating": "pięciogwiazdkowy",
            "food": "All Inclusive"
        },
        {
            "page": 9,
            "wakacjeplURL": "https://www.wakacje.pl/lastminute/?str-9,7-dni,do-4990zl,samolotem,3-gwiazdkowe,ocena-8,za-osobe",
            "hotel": "Jaz Elite Amara",
            "location": "Egipt / Marsa El Alam / Port Ghalib",
            "date": "13.01.2026- 20.01.2026",
            "formated_date": "2026-01-13",
            "price_per_person": "4441",
            "image_url": "https://i.wakacje.pl/no-index/hotel/pickalbatros-jungle-aqua-park-by-neverland-recepcja-lobby-1504226415-343-228.jpg",
            "offer_url": "https://www.wakacje.pl/oferty/egipt/marsa-el-alam/port-ghalib/jaz-elite-amara-860243.html?-od-2026-01-13,7-dni,all-inclusive&utm_source=travellead&utm_medium=cps&utm_campaign=1656-vacccation.com&a_aid=1656&chan=code5",
            "short_url": "https://is.gd/7ylK60",
            "airport": "Katowice, Warszawa, Rzeszów",
            "likes": 2450,
            "star_rating": "pięciogwiazdkowy",
            "food": "All Inclusive"
        },
        {
            "page": 9,
            "wakacjeplURL": "https://www.wakacje.pl/lastminute/?str-9,7-dni,do-4990zl,samolotem,3-gwiazdkowe,ocena-8,za-osobe",
            "hotel": "Sea Star Beau Rivage",
            "location": "Egipt / Hurghada",
            "date": "11.01.2026- 18.01.2026",
            "formated_date": "2026-01-11",
            "price_per_person": "2000",
            "image_url": "https://i.wakacje.pl/no-index/hotel/pickalbatros-jungle-aqua-park-by-neverland-pokoj-1486638803-343-228.jpg",
            "offer_url": "https://www.wakacje.pl/oferty/egipt/hurghada/hurghada/sea-star-beau-rivage-910383.html?-od-2026-01-11,7-dni,all-inclusive&utm_source=travellead&utm_medium=cps&utm_campaign=1656-vacccation.com&a_aid=1656&chan=code5",
            "short_url": "https://is.gd/Ah1JGA",
            "airport": "Katowice, Warszawa, Wrocław",
            "likes": 915,
            "star_rating": "pięciogwiazdkowy",
            "food": "All Inclusive"
        },
        {
            "page": 10,
            "wakacjeplURL": "https://www.wakacje.pl/lastminute/?str-10,7-dni,do-4990zl,samolotem,3-gwiazdkowe,ocena-8,za-osobe",
            "hotel": "Limak Limra",
            "location": "Turcja / Riwiera Turecka / Kemer",
            "date": "10.01.2026- 17.01.2026",
            "formated_date": "2026-01-10",
            "price_per_person": "1714",
            "image_url": "https://i.wakacje.pl/no-index/hotel/limak-limra-basen-teren-hotelu-obiekt-826762625-343-228.jpg",
            "offer_url": "https://www.wakacje.pl/oferty/turcja/riwiera-turecka/kemer/limak-limra-189533.html?-od-2026-01-10,7-dni,all-inclusive&utm_source=travellead&utm_medium=cps&utm_campaign=1656-vacccation.com&a_aid=1656&chan=code5",
            "short_url": "https://is.gd/Qh27vg",
            "airport": "Gdańsk, Wrocław, Katowice",
            "likes": 1091,
            "star_rating": "pięciogwiazdkowy",
            "food": "All Inclusive"
        },
        {
            "page": 10,
            "wakacjeplURL": "https://www.wakacje.pl/lastminute/?str-10,7-dni,do-4990zl,samolotem,3-gwiazdkowe,ocena-8,za-osobe",
            "hotel": "Pickalbatros Palace Resort",
            "location": "Egipt / Hurghada",
            "date": "14.01.2026- 21.01.2026",
            "formated_date": "2026-01-14",
            "price_per_person": "2759",
            "image_url": "https://i.wakacje.pl/no-index/hotel/limak-limra-basen-1768349113-343-228.jpg",
            "offer_url": "https://www.wakacje.pl/oferty/egipt/hurghada/hurghada/pickalbatros-palace-resort-406323.html?-od-2026-01-14,7-dni,all-inclusive&utm_source=travellead&utm_medium=cps&utm_campaign=1656-vacccation.com&a_aid=1656&chan=code5",
            "short_url": "https://is.gd/SVyCNd",
            "airport": "Katowice, Warszawa, Gdańsk",
            "likes": 731,
            "star_rating": "pięciogwiazdkowy",
            "food": "All Inclusive"
        },
        {
            "page": 10,
            "wakacjeplURL": "https://www.wakacje.pl/lastminute/?str-10,7-dni,do-4990zl,samolotem,3-gwiazdkowe,ocena-8,za-osobe",
            "hotel": "Coral Beach (ex Rotana)",
            "location": "Egipt / Hurghada",
            "date": "11.01.2026- 19.01.2026",
            "formated_date": "2026-01-11",
            "price_per_person": "1829",
            "image_url": "https://i.wakacje.pl/no-index/hotel/limak-limra-plaza-teren-hotelu-826762628-343-228.jpg",
            "offer_url": "https://www.wakacje.pl/oferty/egipt/hurghada/hurghada/coral-beach-ex-rotana-442895.html?-od-2026-01-11,7-dni,all-inclusive&utm_source=travellead&utm_medium=cps&utm_campaign=1656-vacccation.com&a_aid=1656&chan=code5",
            "short_url": "https://is.gd/QsLtZX",
            "airport": "Katowice, Warszawa, Poznań",
            "likes": 1696,
            "star_rating": "czterogwiazdkowy",
            "food": "All Inclusive"
        },
        {
            "page": 10,
            "wakacjeplURL": "https://www.wakacje.pl/lastminute/?str-10,7-dni,do-4990zl,samolotem,3-gwiazdkowe,ocena-8,za-osobe",
            "hotel": "Desert Rose Resort",
            "location": "Egipt / Hurghada",
            "date": "14.01.2026- 21.01.2026",
            "formated_date": "2026-01-14",
            "price_per_person": "2575",
            "image_url": "https://i.wakacje.pl/no-index/hotel/limak-limra-recepcja-lobby-1768349119-343-228.jpg",
            "offer_url": "https://www.wakacje.pl/oferty/egipt/hurghada/hurghada/desert-rose-resort-14030.html?-od-2026-01-14,7-dni,all-inclusive&utm_source=travellead&utm_medium=cps&utm_campaign=1656-vacccation.com&a_aid=1656&chan=code5",
            "short_url": "https://is.gd/MFw53N",
            "airport": "Katowice, Warszawa, Gdańsk",
            "likes": 684,
            "star_rating": "pięciogwiazdkowy",
            "food": "All Inclusive"
        },
        {
            "page": 10,
            "wakacjeplURL": "https://www.wakacje.pl/lastminute/?str-10,7-dni,do-4990zl,samolotem,3-gwiazdkowe,ocena-8,za-osobe",
            "hotel": "Telemaque Beach & Spa",
            "location": "Tunezja / Djerba",
            "date": "15.01.2026- 22.01.2026",
            "formated_date": "2026-01-15",
            "price_per_person": "1829",
            "image_url": "https://i.wakacje.pl/no-index/hotel/limak-limra-pokoj-1768349114-343-228.jpg",
            "offer_url": "https://www.wakacje.pl/oferty/tunezja/djerba/telemaque-beach-spa-967040.html?-od-2026-01-15,7-dni,all-inclusive&utm_source=travellead&utm_medium=cps&utm_campaign=1656-vacccation.com&a_aid=1656&chan=code5",
            "short_url": "https://is.gd/ans0YT",
            "airport": "Katowice",
            "likes": 1556,
            "star_rating": "czterogwiazdkowy",
            "food": "All Inclusive"
        },
        {
            "page": 10,
            "wakacjeplURL": "https://www.wakacje.pl/lastminute/?str-10,7-dni,do-4990zl,samolotem,3-gwiazdkowe,ocena-8,za-osobe",
            "hotel": "Long Beach Resort (ex Hilton Long Beach)",
            "location": "Egipt / Hurghada",
            "date": "14.01.2026- 21.01.2026",
            "formated_date": "2026-01-14",
            "price_per_person": "2341",
            "image_url": "https://i.wakacje.pl/no-index/hotel/limak-limra-pokoj-826762648-343-228.jpg",
            "offer_url": "https://www.wakacje.pl/oferty/egipt/hurghada/hurghada/long-beach-resort-ex-hilton-long-beach-3535.html?-od-2026-01-14,7-dni,all-inclusive&utm_source=travellead&utm_medium=cps&utm_campaign=1656-vacccation.com&a_aid=1656&chan=code5",
            "short_url": "https://is.gd/hDm1Ny",
            "airport": "Katowice, Warszawa, Gdańsk",
            "likes": 2045,
            "star_rating": "czterogwiazdkowy",
            "food": "All Inclusive"
        },
        {
            "page": 10,
            "wakacjeplURL": "https://www.wakacje.pl/lastminute/?str-10,7-dni,do-4990zl,samolotem,3-gwiazdkowe,ocena-8,za-osobe",
            "hotel": "Three Corners Sunny Beach",
            "location": "Egipt / Hurghada",
            "date": "11.01.2026- 18.01.2026",
            "formated_date": "2026-01-11",
            "price_per_person": "1934",
            "image_url": "https://i.wakacje.pl/no-index/hotel/limak-limra-pokoj-1501488600-343-228.jpg",
            "offer_url": "https://www.wakacje.pl/oferty/egipt/hurghada/hurghada/three-corners-sunny-beach-910375.html?-od-2026-01-11,7-dni,all-inclusive&utm_source=travellead&utm_medium=cps&utm_campaign=1656-vacccation.com&a_aid=1656&chan=code5",
            "short_url": "https://is.gd/jCgpO5",
            "airport": "Katowice, Warszawa, Wrocław",
            "likes": 1033,
            "star_rating": "czterogwiazdkowy",
            "food": "All Inclusive"
        },
        {
            "page": 10,
            "wakacjeplURL": "https://www.wakacje.pl/lastminute/?str-10,7-dni,do-4990zl,samolotem,3-gwiazdkowe,ocena-8,za-osobe",
            "hotel": "R2 Bahia Playa Design",
            "location": "Hiszpania / Fuerteventura / Tarajalejo",
            "date": "05.01.2026- 12.01.2026",
            "formated_date": "2026-01-05",
            "price_per_person": "2629",
            "image_url": "https://i.wakacje.pl/no-index/hotel/limak-limra-lazienka-1501488588-343-228.jpg",
            "offer_url": "https://www.wakacje.pl/oferty/hiszpania/fuerteventura/tarajalejo/r2-bahia-playa-design-596433.html?-od-2026-01-05,7-dni,all-inclusive&utm_source=travellead&utm_medium=cps&utm_campaign=1656-vacccation.com&a_aid=1656&chan=code5",
            "short_url": "https://is.gd/55njbu",
            "airport": "Gdańsk, Poznań, Warszawa",
            "likes": 767,
            "star_rating": "czterogwiazdkowy",
            "food": "All Inclusive"
        },
        {
            "page": 10,
            "wakacjeplURL": "https://www.wakacje.pl/lastminute/?str-10,7-dni,do-4990zl,samolotem,3-gwiazdkowe,ocena-8,za-osobe",
            "hotel": "Jaz Soma Beach (ex. Solymar Soma Beach)",
            "location": "Egipt / Hurghada",
            "date": "08.01.2026- 15.01.2026",
            "formated_date": "2026-01-08",
            "price_per_person": "2628",
            "image_url": "https://i.wakacje.pl/no-index/hotel/limak-limra-restauracja-1501488549-343-228.jpg",
            "offer_url": "https://www.wakacje.pl/oferty/egipt/hurghada/hurghada/jaz-soma-beach-ex-solymar-soma-beach-758529.html?-od-2026-01-08,7-dni,all-inclusive&utm_source=travellead&utm_medium=cps&utm_campaign=1656-vacccation.com&a_aid=1656&chan=code5",
            "short_url": "https://is.gd/CCOLJv",
            "airport": "Katowice, Warszawa, Poznań",
            "likes": 1728,
            "star_rating": "czterogwiazdkowy",
            "food": "All Inclusive"
        },
        {
            "page": 10,
            "wakacjeplURL": "https://www.wakacje.pl/lastminute/?str-10,7-dni,do-4990zl,samolotem,3-gwiazdkowe,ocena-8,za-osobe",
            "hotel": "Fantazia Resort",
            "location": "Egipt / Marsa El Alam",
            "date": "11.01.2026- 18.01.2026",
            "formated_date": "2026-01-11",
            "price_per_person": "2258",
            "image_url": "https://i.wakacje.pl/no-index/hotel/limak-limra-restauracja-826762652-343-228.jpg",
            "offer_url": "https://www.wakacje.pl/oferty/egipt/marsa-el-alam/fantazia-resort-910385.html?-od-2026-01-11,7-dni,all-inclusive&utm_source=travellead&utm_medium=cps&utm_campaign=1656-vacccation.com&a_aid=1656&chan=code5",
            "short_url": "https://is.gd/f8d146",
            "airport": "Katowice, Warszawa, Poznań",
            "likes": 454,
            "star_rating": "pięciogwiazdkowy",
            "food": "All Inclusive"
        },
        {
            "page": 11,
            "wakacjeplURL": "https://www.wakacje.pl/lastminute/?str-11,7-dni,do-4990zl,samolotem,3-gwiazdkowe,ocena-8,za-osobe",
            "hotel": "Long Beach Resort (ex Hilton Long Beach)",
            "location": "Egipt / Hurghada",
            "date": "11.01.2026- 18.01.2026",
            "formated_date": "2026-01-11",
            "price_per_person": "2178",
            "image_url": "https://i.wakacje.pl/no-index/hotel/long-beach-resort-ex-hilton-long-beach-obiekt-1424863848-343-228.jpg",
            "offer_url": "https://www.wakacje.pl/oferty/egipt/hurghada/hurghada/long-beach-resort-ex-hilton-long-beach-910514.html?-od-2026-01-11,7-dni,all-inclusive&utm_source=travellead&utm_medium=cps&utm_campaign=1656-vacccation.com&a_aid=1656&chan=code5",
            "short_url": "https://is.gd/evGeaS",
            "airport": "Katowice, Warszawa, Wrocław",
            "likes": 620,
            "star_rating": "czterogwiazdkowy",
            "food": "All Inclusive"
        },
        {
            "page": 11,
            "wakacjeplURL": "https://www.wakacje.pl/lastminute/?str-11,7-dni,do-4990zl,samolotem,3-gwiazdkowe,ocena-8,za-osobe",
            "hotel": "Pickalbatros Vita Resort Portofino",
            "location": "Egipt / Marsa El Alam",
            "date": "11.01.2026- 18.01.2026",
            "formated_date": "2026-01-11",
            "price_per_person": "3372",
            "image_url": "https://i.wakacje.pl/no-index/hotel/long-beach-resort-ex-hilton-long-beach-zjezdzalnia-basen-1424863903-343-228.jpg",
            "offer_url": "https://www.wakacje.pl/oferty/egipt/marsa-el-alam/pickalbatros-vita-resort-portofino-925395.html?-od-2026-01-11,7-dni,all-inclusive&utm_source=travellead&utm_medium=cps&utm_campaign=1656-vacccation.com&a_aid=1656&chan=code5",
            "short_url": "https://is.gd/y2iYlO",
            "airport": "Katowice, Warszawa, Poznań",
            "likes": 140,
            "star_rating": "czterogwiazdkowy",
            "food": "All Inclusive"
        },
        {
            "page": 11,
            "wakacjeplURL": "https://www.wakacje.pl/lastminute/?str-11,7-dni,do-4990zl,samolotem,3-gwiazdkowe,ocena-8,za-osobe",
            "hotel": "Aequora Lanzarote Suites",
            "location": "Hiszpania / Lanzarote / Puerto del Carmen",
            "date": "10.01.2026- 17.01.2026",
            "formated_date": "2026-01-10",
            "price_per_person": "3529",
            "image_url": "https://i.wakacje.pl/no-index/hotel/long-beach-resort-ex-hilton-long-beach-teren-hotelu-1460030592-343-228.jpg",
            "offer_url": "https://www.wakacje.pl/oferty/hiszpania/lanzarote/puerto-del-carmen/aequora-lanzarote-suites-442101.html?-od-2026-01-10,7-dni,all-inclusive&utm_source=travellead&utm_medium=cps&utm_campaign=1656-vacccation.com&a_aid=1656&chan=code5",
            "short_url": "https://is.gd/tZJrSI",
            "airport": "Warszawa, Wrocław, Katowice",
            "likes": 2360,
            "star_rating": "czterogwiazdkowy",
            "food": "All Inclusive"
        },
        {
            "page": 11,
            "wakacjeplURL": "https://www.wakacje.pl/lastminute/?str-11,7-dni,do-4990zl,samolotem,3-gwiazdkowe,ocena-8,za-osobe",
            "hotel": "Estalagem Do Mar",
            "location": "Portugalia / Madera / Sao Vicente",
            "date": "10.01.2026- 17.01.2026",
            "formated_date": "2026-01-10",
            "price_per_person": "2229",
            "image_url": "https://i.wakacje.pl/no-index/hotel/long-beach-resort-ex-hilton-long-beach-budynek-glowny-obiekt-1424864029-343-228.jpg",
            "offer_url": "https://www.wakacje.pl/oferty/portugalia/madera/sao-vicente/estalagem-do-mar-441935.html?-od-2026-01-10,7-dni,all-inclusive&utm_source=travellead&utm_medium=cps&utm_campaign=1656-vacccation.com&a_aid=1656&chan=code5",
            "short_url": "https://is.gd/JLPOth",
            "airport": "Warszawa, Katowice, Poznań",
            "likes": 1834,
            "star_rating": "trzygwiazdkowy",
            "food": "Śniadania i obiadokolacje (HB)"
        },
        {
            "page": 11,
            "wakacjeplURL": "https://www.wakacje.pl/lastminute/?str-11,7-dni,do-4990zl,samolotem,3-gwiazdkowe,ocena-8,za-osobe",
            "hotel": "AHG Lion Beach Resort & Spa",
            "location": "Kenia / Wybrzeże Malindi / Watamu",
            "date": "08.01.2026- 16.01.2026",
            "formated_date": "2026-01-08",
            "price_per_person": "4629",
            "image_url": "https://i.wakacje.pl/no-index/hotel/long-beach-resort-ex-hilton-long-beach-recepcja-lobby-1424863606-343-228.jpg",
            "offer_url": "https://www.wakacje.pl/oferty/kenia/wybrzeze-malindi/watamu/ahg-lion-beach-resort-spa-795704.html?-od-2026-01-08,7-dni,all-inclusive&utm_source=travellead&utm_medium=cps&utm_campaign=1656-vacccation.com&a_aid=1656&chan=code5",
            "short_url": "https://is.gd/iEUwA2",
            "airport": "Warszawa, Wrocław",
            "likes": 1466,
            "star_rating": "czterogwiazdkowy",
            "food": "All Inclusive"
        },
        {
            "page": 11,
            "wakacjeplURL": "https://www.wakacje.pl/lastminute/?str-11,7-dni,do-4990zl,samolotem,3-gwiazdkowe,ocena-8,za-osobe",
            "hotel": "Pestana Royal Premium All Inclusive Ocean & Spa",
            "location": "Portugalia / Madera / Funchal",
            "date": "03.01.2026- 11.01.2026",
            "formated_date": "2026-01-03",
            "price_per_person": "4129",
            "image_url": "https://i.wakacje.pl/no-index/hotel/long-beach-resort-ex-hilton-long-beach-recepcja-lobby-1424864301-343-228.jpg",
            "offer_url": "https://www.wakacje.pl/oferty/portugalia/madera/funchal/pestana-royal-premium-all-inclusive-ocean-spa-505824.html?-od-2026-01-03,7-dni,all-inclusive&utm_source=travellead&utm_medium=cps&utm_campaign=1656-vacccation.com&a_aid=1656&chan=code5",
            "short_url": "https://is.gd/eN54OG",
            "airport": "Warszawa, Katowice, Poznań",
            "likes": 275,
            "star_rating": "pięciogwiazdkowy",
            "food": "All Inclusive"
        },
        {
            "page": 11,
            "wakacjeplURL": "https://www.wakacje.pl/lastminute/?str-11,7-dni,do-4990zl,samolotem,3-gwiazdkowe,ocena-8,za-osobe",
            "hotel": "Jaz Aquaviva",
            "location": "Egipt / Hurghada / Makadi Bay",
            "date": "14.01.2026- 21.01.2026",
            "formated_date": "2026-01-14",
            "price_per_person": "2825",
            "image_url": "https://i.wakacje.pl/no-index/hotel/long-beach-resort-ex-hilton-long-beach-pokoj-1424863893-343-228.jpg",
            "offer_url": "https://www.wakacje.pl/oferty/egipt/hurghada/makadi-bay/jaz-aquaviva-342409.html?-od-2026-01-14,7-dni,all-inclusive&utm_source=travellead&utm_medium=cps&utm_campaign=1656-vacccation.com&a_aid=1656&chan=code5",
            "short_url": "https://is.gd/2iC4Iy",
            "airport": "Katowice, Warszawa, Gdańsk",
            "likes": 844,
            "star_rating": "pięciogwiazdkowy",
            "food": "All Inclusive"
        },
        {
            "page": 11,
            "wakacjeplURL": "https://www.wakacje.pl/lastminute/?str-11,7-dni,do-4990zl,samolotem,3-gwiazdkowe,ocena-8,za-osobe",
            "hotel": "Pickalbatros Aqua Blu Resort",
            "location": "Egipt / Hurghada",
            "date": "14.01.2026- 21.01.2026",
            "formated_date": "2026-01-14",
            "price_per_person": "2525",
            "image_url": "https://i.wakacje.pl/no-index/hotel/long-beach-resort-ex-hilton-long-beach-pokoj-1757344044-343-228.jpg",
            "offer_url": "https://www.wakacje.pl/oferty/egipt/hurghada/hurghada/pickalbatros-aqua-blu-resort-406340.html?-od-2026-01-14,7-dni,all-inclusive&utm_source=travellead&utm_medium=cps&utm_campaign=1656-vacccation.com&a_aid=1656&chan=code5",
            "short_url": "https://is.gd/SEa7oe",
            "airport": "Katowice, Warszawa, Gdańsk",
            "likes": 2435,
            "star_rating": "czterogwiazdkowy",
            "food": "All Inclusive"
        },
        {
            "page": 11,
            "wakacjeplURL": "https://www.wakacje.pl/lastminute/?str-11,7-dni,do-4990zl,samolotem,3-gwiazdkowe,ocena-8,za-osobe",
            "hotel": "Canal Central Business Bay",
            "location": "Emiraty Arabskie / Dubaj",
            "date": "09.01.2026- 16.01.2026",
            "formated_date": "2026-01-09",
            "price_per_person": "4348",
            "image_url": "https://i.wakacje.pl/no-index/hotel/long-beach-resort-ex-hilton-long-beach-pokoj-1757343995-343-228.jpg",
            "offer_url": "https://www.wakacje.pl/oferty/emiraty-arabskie/dubaj/dubaj/canal-central-business-bay-980191.html?-od-2026-01-09,7-dni,all-inclusive&utm_source=travellead&utm_medium=cps&utm_campaign=1656-vacccation.com&a_aid=1656&chan=code5",
            "short_url": "https://is.gd/kIuWzi",
            "airport": "Gdańsk, Katowice, Poznań",
            "likes": 1174,
            "star_rating": "pięciogwiazdkowy",
            "food": "Śniadania (BB)"
        },
        {
            "page": 11,
            "wakacjeplURL": "https://www.wakacje.pl/lastminute/?str-11,7-dni,do-4990zl,samolotem,3-gwiazdkowe,ocena-8,za-osobe",
            "hotel": "Serenity Alma Heights (ex. Serenity Fun City)",
            "location": "Egipt / Hurghada / Makadi Bay",
            "date": "14.01.2026- 21.01.2026",
            "formated_date": "2026-01-14",
            "price_per_person": "2310",
            "image_url": "https://i.wakacje.pl/no-index/hotel/long-beach-resort-ex-hilton-long-beach-pokoj-1757343992-343-228.jpg",
            "offer_url": "https://www.wakacje.pl/oferty/egipt/hurghada/makadi-bay/serenity-alma-heights-ex-serenity-fun-city-214655.html?-od-2026-01-14,7-dni,all-inclusive&utm_source=travellead&utm_medium=cps&utm_campaign=1656-vacccation.com&a_aid=1656&chan=code5",
            "short_url": "https://is.gd/h3sM9O",
            "airport": "Katowice, Warszawa, Gdańsk",
            "likes": 1189,
            "star_rating": "pięciogwiazdkowy",
            "food": "All Inclusive Plus"
        }
    ]
}